in78vai,:mercedes: Mercedes,"As someone without twitter to check myself, what's up with Russell's twitter?",25,1662395279.0
in7s12d,:daniel-ricciardo: Daniel Ricciardo,In every single way 🎶,43,1662402967.0
in7bkac,:lando-norris: Lando Norris,"It also slightyl benefitted the mercs because they ALSO pitted and got fresh tires (iirc) to keep them on more even ground, and it was actually VALTTERI'S safety car that got Max in the lead :/",109,1662396343.0
in7ead0,:jacques-villeneuve: Jacques Villeneuve,Yes. At a point when both RBR and Merc sims STILL showed he would win it!,21,1662397427.0
in75x7a,:alexander-albon: Alexander Albon,Bet they think she told Latifi to craah in abu dhabi too,42,1662394108.0
in9e937,:max-verstappen-33: Max Verstappen,"they’re also wrong lol, nothing comes close to football",8,1662428944.0
inab4kt,:new-user: New user,It's not even close.,3,1662448409.0
in76tv4,:max-verstappen-1: Max Verstappen,"Yeah, it's just horrendous. On the plus side my mute/block list keeps growing with all these horrible F1 Twitter accounts and their ludicrous takes. 

At least most of football twitter is united about VAR being absolutely terrible in the PL lol.",11,1662394473.0
in7cu7b,:max-verstappen-1: Max Verstappen,I just avoided Twitter for the entirety of December after Abu Dhabi 21 happened. It really got terrible.,3,1662396848.0
in8141z,:charles-leclerc: Charles Leclerc,"Reddit users want to feel superior, but nah, Reddit just has a better system at hiding the very worst posts",43,1662406777.0
in7wqps,:mclaren: McLaren,"we greatly overestimated the average person’s ability for independent analysis and self-awareness.. we always expect better from people on their own, but so many of us even in adulthood need to be “guided”/taught how to think through things in a lot of ways.",4,1662404921.0
in7m88u,:mika-hakkinen: Mika Häkkinen,"It's become an issue when DTS came out. Before liberty and DTS, we didn't really have an inside look into teams or even driver's personal lives. We first became fans of the sport. Then we became fans of certain drivers based on their racing ability, or things we could see them do during a race weekend. 

DTS came out and focused more on drivers than racing.   New fans are first drawn to driver's personalities and looks, only after that do they decide if they actually like the sport itself. I know people irl who ""love"" Charles but they've never seen a single race because the sport is ""boring"". They just think he's hot.",13,1662400595.0
in78a80,:kimi-raikkonen: Kimi Räikkönen,"Twitter has been solely a cesspool at least for the past six years, not a new thing.",18,1662395045.0
in7qyzm,:lotus: Lotus,Pretty much every F1 World champion up to the 2000s then,16,1662402529.0
in8ibf0,:red-bull: Red Bull,Remember their Christmas ad wishing everyone happy holidays with Max having his 51g moment accompanying that message,10,1662414170.0
in7io2n,:damon-hill: Damon Hill,Ted was the worst for me. Very disappointed in him.,39,1662399168.0
in77952,:sebastian-vettel-5: Sebastian Vettel,"I felt that was more ""they look like they're adjusting the belts to distract from the fact they may have let a car out on track without a wheel tightened to avoid a fine"" than ""they purposely caused a safety car to help max"". If that was the goal why not leave it parked the first time? I never heard crofty suggest anything of the sort",107,1662394642.0
in88xv3,:mclaren: McLaren,"Yuki had some pretty weird things going on before he retired, some people went full tinfoil hat to say he and alpha did it to preference redbull and VER. Some of those people thought Hannah the redbull head of strategy planned it with them. Threw a bunch of abuse at her. Then the hashing F1xed came along which in my opinion is a beautiful blend of F1 and Fixed. No way that alpha and RB planned it when RB will defo win both titles but the hastag itself is pretty creative.",8,1662410097.0
in7tp0y,:formula-1-2018: Formula 1,"Absolutely agree. It used to be a relatively niche sport with people who largely understood what they were watching. The demographic has changed massively, everyone and their dog claims to be into F1 now and loads really don't understand the nuances of the sport.",5,1662403655.0
in873rd,:alexander-albon-23: Alexander Albon,"Drive to Survive, the Netflix docu-drama that began a few seasons ago.",15,1662409313.0
in7lf8p,:ferrari: Ferrari,"Absolutely, it took plenty of skill. I think most people appreciate good defending",132,1662400267.0
ina5q7w,:kimi-raikkonen: Kimi Räikkönen,People will complain that drivers shouldnt be allowed to race people theyre not in championship fight with and then complain there is no racing and its all drs overtakes.,4,1662444311.0
in9ynxc,:lewis-hamilton: Sir Lewis Hamilton,Perez should learn from bottas and take out two mercs at the start.,8,1662439615.0
in7c2gh,:sergio-perez: Sergio Pérez,He’s getting so much hate for not staying out. Going from “you are selfish and I lost a lot of respect for you” to “you are a disgrace and you don’t deserve Lewis as a teammate”. Some are demanding Mercedes to bring Bottas back. It’s pretty sad.,78,1662396542.0
in7i1w7,:max-verstappen: Max Verstappen,"Noo, mummy, noo, this is so not right!",10,1662398924.0
in8d65w,:fernando-alonso: Fernando Alonso,"“I don’t want to imply anything, so I’ll just say it outright “",39,1662411924.0
in7cu5t,:red-bull: Red Bull,"Max was in the lead the entire race. He was like 10 seconds clear of Lewis before his first pit stop, and then barely behind the two Mercedes when they made their first pit stop. After that they gained some ground on him of course, being on fresher tyres, but Max was always ""virtually"" in the lead. Without safety cars however he would have had to overtake both Mercedes cars near the end of the race, with fresh softs or mediums against them on used hards. Would have been an interesting finish of the race, but he probably would have been able to do it.

After the VSC he was on new hards ahead of the Mercedes on new mediums. The hards weren't working very well on that Red Bull, but he had a comfortable lead and the hard would have degraded less towards the end of the race, so very unlikely the Mercedeses would have been able to challenge him.

After the 2nd SC it was all over of course.

Each safety car slightly benefited Max, but he was always in control of the race.",25,1662396848.0
in7bspi,:red-bull: Red Bull,How Nico Rosberg Was Behind Abu Dhabi 2021 (The Truth Will Shock You!),30,1662396436.0
in7auui,:mclaren: McLaren,"I heard she offered him a case of Red Bull.

/s",14,1662396067.0
in783ed,:mclaren: McLaren,"I have to keep muting/blocking bad F1 takes, bad football takes, bad political takes - the list is at an all time high right now lol. 

VAR discussions are all the rage on PL twitter. It also helps when Declan Rice himself tweets about how atrocious VAR is. Unites all of us lol.",6,1662394969.0
in7924j,:mclaren: McLaren,"I used to like Twitter for football but I'm a Liverpool fan and it feels like the abuse, toxicity and point scoring is so out of hand that it's honestly disheartening. I think I've somehow avoided F1 Twitter but from what I hear it's just the same.

I actually like Reddit more for Football discussions now. It feels so much more open and fair on the likes of r/soccer. And I may end up that way with F1 too. Twitter just has an issue in general with the toxicity and abuse.",5,1662395355.0
in8cl7p,:lando-norris: Lando Norris,"Still is.

Reddit is only slightly better.  It can get pretty shit on here too.",3,1662411673.0
in84o5x,:firstname-lastname: Firstname Lastname,Mods. Reddit has mods. That’s the biggest difference.,19,1662408282.0
in8hey5,:pirelli-wet: Pirelli Wet,Twitter replies are like browsing Reddit exclusively on controversial sorting.,9,1662413774.0
in7sblm,:ferrari: Ferrari,"Exactly how I view this topic too. I even saw a tiktok a little while ago, about a huge group (I would guess in large part females) that make up stories/smut/fanfiction on Tumblr. A site that I though was long gone.

And if you would've told me five years ago, that there would be fanfiction about Leclerc and his sexual activities, I would ask you if you've gone mad.

But this is a part of the new following in F1. The focus is in large parts on looks, personality, and the fame & glamour. Not the car, not the driving, not about achievements, but more of what they say, how they look, and what they post to Instagram.",11,1662403090.0
in8a9et,:alexander-albon-23: Alexander Albon,"Serious question, is nasty fan behavior like this as prevalent in other UK and European based sports? I live about 2-1/2 hours from COTA, and in the 2 F1 races I've attended there, the majority of fans there are pretty respectful and want to see close, fair racing above all else.

I understand that UK based media serves the vast majority of the English speaking world and there's going to be a smidge of a UK bias (As an American, I can barely stand to watch American based coverage of the Olympics because of the overwhelming US athlete bias), but the way some F1 fans are so disrespectful to each other has really surprised me. Is this a case of a vocal minority making others look bad, or has the European F1 fanbaee actually gotten worse in the past decade?",3,1662410666.0
in7saup,:mika-hakkinen: Mika Häkkinen,"Maybe he thinks they should revive the ""best 11 results"" rule.",8,1662403082.0
in9u9lz,:kevin-magnussen: Kevin Magnussen,I used to switch over to world feed commentary for Martin Brundle but last weekend with Jolyon Palmer and Alex Brundle has been excellent.,3,1662436987.0
in9daxy,:mclaren: McLaren,"Plus there is a big difference between a live commentator saying something a little weird in one of those odd racing situations, versus coming out after the fact with outright accusations of cheating. And I agree he was suspicious of the belts vs tyres and that oddity, I didn't get from him that he was accusing them of impacting the race in a nefarious way.",7,1662428496.0
in8zy0f,:max-verstappen: Max Verstappen,"He did say why didn't he stop by a marshal post, when infact yuki did stop by a marshal post and he said many times that this played right into Verstappens hands and there was distinct change in his tone",3,1662422359.0
in8dxrc,:fernando-alonso: Fernando Alonso,That is an excellent hashtag regardless of how crazy it’s inventor must be.,3,1662412256.0
in7x4oe,:ferrari: Ferrari,"""Carguys"" (or lets say ""carperson"") and Formula 1 have always gone hand in hand. F1 as the pinnacle of innovation, the pinnacle of speed. With casual fans, often neither interested in cars/motoring or the technical/scientific bit, many start to be interested in other stuff surrounding the sport.

So getting all the history about and around F1, then trying to understand the technical stuff. It is A LOT to take in. A good comparison is Top Gear. A show that was loved by carpeople, but also the casual viewer that just wanted a laugh.

So a lot of the newer fans will rather start on a more personal and human level I think, which meshes perfectly with social media. Instagram with all the pictures and videos, Twitter with all the thoughts and meme stuff. So rather than understanding the cars, they go for the people. Personalities, looks, and the fame surrounding.

The problem I have with it is that I think F1 should be about the vehicles and the teams. Politics, personal opinions, and too much exposure just doesn't do this sport any good.",4,1662405086.0
in7bjkn,:pierre-gasly: Pierre Gasly,yeah about alluding to the fact that AT were trying to make it seem that they didn’t do an unsafe release in regards to yuki’s tyre,8,1662396336.0
in7lxsb,:mclaren: McLaren,"I don't get the hate.

Can drivers not have preferences on who wins a championship? Should he have folded and let Ham through just because he is Hamilton? Same goes for Perez last year lol

People like that are so stupid.",68,1662400478.0
ina2fub,:mick-schumacher-47: Mick Schumacher,They went fucking car racing,3,1662442030.0
ina2oo1,:mclaren: McLaren,Very much this. People seem to forget how he single handedly gave both Merc and Lewis the WDC and WCC advantage from what he did in Hungary.,5,1662442190.0
in7fhvp,:chequered-flag: Chequered Flag,Are they mental? Wtf is wrong with thesr people.,34,1662397912.0
in8g4dm,:sebastian-vettel: Sebastian Vettel,"The translation should say ""I don't want to accuse anybody of anything"". It has the vibes of right-wing conspiracy theorists who are ""just asking questions""...",10,1662413203.0
in8enh4,:jacques-villeneuve: Jacques Villeneuve,"Agreed. Especially since overtaking isn’t that big of an issue anymore. Plus, it’s entirely possible Max would have stayed out longer and bolted on mediums, with an even greater pace advantage (but admittedly further back in that case). There is just no way Merc wins it no matter what happens, unless Max or RBR screws up.",5,1662412568.0
in7abhu,:max-verstappen: Max Verstappen,Red Bull Step Sister Team confirmed! 🫡,12,1662395855.0
in8my5u,:default: Stefan GP,And self policing via upvote/downvote,13,1662416263.0
in7om95,:mercedes: Mercedes,Dts is what is wrong with them. While generating a bigger fanbase it was bound to attract the most dumb animals on this planet...,12,1662401565.0
in7vdid,:ferrari: Ferrari,"Turkey 21 was a wet race and there was no DRS available when they battled. All Hamilton had to do was drive past TSU and he couldn't. 

Why didn't Petrov just let ALO past in 2010? He was racing him, that's why",40,1662404357.0
in7s12n,:mclaren: McLaren,"I can see that, no point in trying to prevent the car behind you to pass if you're both losing time. I'm sure there's extra ""motivation"" to help out a driver on your sister team.",13,1662402967.0
in7rv8n,:mclaren: McLaren,"> If a driver has a preference. They shouldn't voice it. They make themselves targets for fixing accusations and death threats.

Agreed. I don't think people would have given Tsunoda much shit if he kept it to himself, at the same time, ""fans"" are stupid and make up shit like that. 

I watched that race, I remember the hate Glock got, and still gets from that race. If he had pitted like everyone else did, no one would be talking about Glock. Again, fans being stupid.",6,1662402899.0
in7reqo,:chequered-flag: Chequered Flag,Didnt they already exist before DtS though?,11,1662402709.0
in81ta9,:sergio-perez: Sergio Pérez,"drive to survive didnt brought up all the toxicity overnight, that was all there, its just that now theres more buzzing around F1, and people are being louder, thats all",4,1662407070.0
imrtdb4,:williams: Williams,"Yeah, right. Flares weren't allowed last year",5959,1662107541.0
imrtli8,:giuseppe-farina: Giuseppe Farina, Narrators voice: *They didn’t*,1892,1662107733.0
imrtu7y,:mclaren: McLaren,Flares aren't allowed at any races I believe,512,1662107939.0
imrv9xe,:lando-norris: Lando Norris,These boys sneaking in flares while I'm gonna get my powerbank taken off of me. A yoke,178,1662109160.0
imru3q8,:mclaren: McLaren,F1 security is bullshit anyway. My wife had her umbrella taken off her at Spa while I walked straight in with mine. It inevitably rained and fifty thousand umbrellas suddenly opened up.,307,1662108164.0
imrtzmq,:pirelli-wet: Pirelli Wet,“That sign won’t stop me because I can’t read”,498,1662108066.0
imrvobl,:lewis-hamilton: Sir Lewis Hamilton,they should try a big sign outside the airport saying 'no bombs allowed',11,1662109493.0
ims2c2c,:valtteri-bottas-77: Valtteri Bottas,Aaaaaaand flares already lit 1 minute into FP1 lol,12,1662114760.0
imrw8ye,:sebastian-vettel-5: Sebastian Vettel,They werent allowed in Spa either,10,1662109970.0
imru1wn,:mclaren: McLaren,We'll see how well this sign has worked as soon as VER takes to the track :D,91,1662108121.0
imrurx4,:porsche: Porsche,Yeah and drugs are forbidden at festivals,86,1662108734.0
ims2b8h,:michael-masi: Michael Masi,And we are live... and the first flares are on...,7,1662114743.0
ims2dll,:claire-williams: Claire Williams,Literally four or five set off as Max started in FP1.,8,1662114790.0
imrtyx3,:jim-clark: Jim Clark,Disco Stu is at the gate looking sad,22,1662108050.0
imrugl8,I survived Spa 2021 and all I got was this lousy flair,"""Het is een Nederlands evenement, we zijn in Nederland. Hadden ze maar een Nederlands bord neergezet."" - every Dutch speaking person carrying a tourch.

*edited a word*",56,1662108469.0
imsdpaz,:niki-lauda: Niki Lauda,"""That sign won't stop me because I can't read""",6,1662121521.0
imrvioz,:pastor-maldonado: Pastor Maldonado,"Headlines on Monday:

# Lube Manufacturers report Record Sales over Dutch GP Weekend",24,1662109365.0
imsbt2q,:mclaren: McLaren,"Need to start having stewards throw them out from the track. Not like you can't see who is holding one. 

Sure there's the issue of people light it and throw it on the ground etc but they really need to get tougher to stop them.

I'd be pissed if I paid a fortune to go to a gp and start or parts of the race are hidden cos I'm buried in bloody smoke",22,1662120547.0
ims21vd,:mclaren: McLaren,"About as effective as the ""drugs are banned"" signs at festivals",6,1662114552.0
ims24tg,:mclaren: McLaren,"“Hand them in at the gates.”

Hope the security check is a bit stricter than just that.",6,1662114613.0
ims7477,:lewis-hamilton: Sir Lewis Hamilton,"Flares were banned at Spa as well, look how well that worked.",5,1662117914.0
imrtupp,:pierre-gasly: :pirelli-wet: Pedro Gaseoso's Worst Nightmare,"I really don't get the whole obsession of those Dutch fans with flares, it was barely a thing in F1 before the hype around Max was reaching insane heights here.",131,1662107951.0
imrtk3t,:charles-leclerc: Charles Leclerc,This guarantees there won't be any flares after the race,34,1662107701.0
imsaajg,:formula-1-2018: Formula 1,"Can't stand the flares on TV, so I can't imagine how awful they must be stuck in the middle of the smoke. Sadly doubt this will stop them from being used.",4,1662119727.0
imt28yq,:max-verstappen-1: Max Verstappen,Something tells me we’re still gonna see flares 😂,3,1662132103.0
imsdaer,:mclaren: McLaren,They shouldn't be allowed anywhere.,9,1662121314.0
imru13d,:formula-1-2018: Formula 1,Is that a flare or are you glad to see me,8,1662108102.0
imrulub,:kimi-raikkonen: Kimi Räikkönen,"I don’t think they have ever been allowed.

I clearly remember the fans handing them on at previous races…",3,1662108589.0
imrvd26,:max-verstappen: Max Verstappen,"Checks are really simple. You can bring in everything. Been there, done that, got the shirt. But I don't have flares or smoke bombs.",3,1662109233.0
imrxlo4,:max-verstappen-33: Max Verstappen,Yeah… I have been to plenty of Dutch sport events in my life. They have never been allowed. They always get through though.,3,1662111087.0
imry692,:formula-1-2018: Formula 1,How about we use bath bombs?,3,1662111564.0
ims0ext,:francois-cevert: François Cevert,so i\`m guessing they have guards that will go and find people who light it up during the weekend?,3,1662113326.0
ims2b78,:red-bull: Red Bull,People are already burning flares 2 minutes into Practice session 1...,3,1662114742.0
ims2g0u,:formula-1-2018: Formula 1,2 mins into FP and...they're back,3,1662114836.0
ims2msr,:lewis-hamilton: Sir Lewis Hamilton,Yeah I saw flares on FP1 and then I saw this post. Lol,3,1662114971.0
imrucw6,:robert-kubica: Robert Kubica,"Any flares?

No.

Good. Next!",6,1662108380.0
ims1nq8,:we-race-as-one: #WeSayNoToMazepin,There are cameras everywhere. Even one flare should make you banned. Where is the security? During concerts in my country I cannot even take a backpack with me as it's not allowed and you are searched before entering. Why not the same here?,6,1662114264.0
imrwuol,:nico-hulkenberg: Nico Hülkenberg,"I don't understand the problem. Every Italian curcuit in MotoGP was drenched in yellow smoke during the warmup lap. Nobody (riders, officials, etc.) seemed to care. What is the difference in F1?",17,1662110466.0
imrveyg,:charles-leclerc: Charles Leclerc,Idk how flares don’t start more fights. If I paid the crazy high amount of money it takes to see an F1 race in person and someone in front of me set off a flare I’d be LIVID,11,1662109277.0
imrvzgd,:charlie-whiting: Charlie Whiting,"Won't stop anyone, same as at footie games",5,1662109748.0
imth5k8,:ayrton-senna: Ayrton Senna,"I hate them, the obstruct viewing like last time the grand stand blocked part of the track with the massive cloud of orange smoke.",4,1662137859.0
imtnmyu,:new-user: New user,Abnoxious assholes use flares,4,1662140388.0
imrwo3u,:michael-schumacher: Michael Schumacher,There will always be a way to get them inside.,2,1662110319.0
imrwwhm,:formula-1-2018: Formula 1,Least effective sign ever,2,1662110507.0
imrxfyv,:pirelli-wet: Pirelli Wet,Good luck with that,2,1662110955.0
ims062r,:ferrari: Ferrari,I just want to be able to clearly see the track on TV without a haze. Austria was terrible viewing.,2,1662113136.0
ims0k5l,:nigel-mansell: Nigel Mansell,Yeah that'll teach em. The first few laps are gonna be a smokey mess and its gonna be ass to watch.,2,1662113436.0
ims2erk,:aston-martin: Aston Martin,They using them right now in there audience lol,2,1662114812.0
ims2k0c,:paddock-club: 🇦🇺 Australian GP Fire Marshal,FP1…full of flares,2,1662114914.0
ims36kt,:flavio-briatore: Flavio Briatore,"*Haha, You have no power here.*",2,1662115362.0
ims3ya7,:max-verstappen-33: Max Verstappen,If you explicitly tell the Dutch not to bring something that explodes or lights on fire they will bring even more.,2,1662115887.0
ims7y6j,:porsche: Porsche,[*Security check for flares*](https://pbs.twimg.com/media/CI15SJHUAAAiAUX?format=jpg&name=900x900),2,1662118415.0
ims96vt,:red-bull: Red Bull,Hold my stroopwafel,2,1662119122.0
ims9tgn,:formula-1-2018: Formula 1,Unbelievable! I’ll wear whatever damn pants I want to!!,2,1662119466.0
imsab5m,:george-russell: George Russell,[What we are going to see in lap one](https://www.iconsdb.com/orange-icons/square-icon.html),2,1662119737.0
imsfbfc,:sebastian-vettel: Sebastian Vettel,"I'm at the circuit and one was literally set off in the fan zone. Regardless of warnings, we will see them at quali and during the race.",2,1662122328.0
imsh8r3,2022 Engine Suppliers,Good.,2,1662123254.0
imsmqrv,:mclaren: McLaren,Yeah good luck with that,2,1662125774.0
imso1zh,:alain-prost: Alain Prost,"If their security is as tight as COTA last year, there will be thousands of ""flares"" in the stands",2,1662126350.0
imst2va,:haas: Haas,You have to actually enforce this. If stands light up with flares send stewards and start removing people. People will quickly start ratting out if you threaten their ability to watch a race they paid a lot of money and travelled for.,2,1662128461.0
imsuevy,:nico-hulkenberg: Nico Hülkenberg,They weren't allowed at Spa either and yet somehow they were there anyway,2,1662129006.0
imti60e,:max-verstappen-1: Max Verstappen,"Because signs like that always work, just as they do in Football.",2,1662138251.0
imtn02s,:alpine: Alpine,Sadly they simply don't have enough security to kick out the people who do sneak them in. And the ones with such flagrant disregard for the rules are the ones likely to kick off when you tell them what to do.,2,1662140137.0
imtrgjw,:pirelli-soft: Pirelli Soft,"Will convince absolutely no one. I've set of flares and smoke bombs at football matches before. When I was younger. And this sign annoys me a bit. I know I would've brought smoke bombs, which is actually what they're mostly using, and if caught would've pleaded innocent thay they're not actually flares.

I'm sure the small print prohibits smoke bombs too but they should advertise more thr adverse effect setting them off at a race track had and enforce it. Our club, being a small one, unofficially allocated us an entire stand to play with away from other supporters. Before local laws caught up with us and mandated the club do something about it. Thay was fine, it was observed by adult security with buckets of cold water and first aid training and overall a fun experience with popular support from supporters who watched us from the main stand. They enjoyed our show and it generated a good atmosphere. Telling us flares weren't welcome wasn't going to stop us. I know that would of been our attitude if the club tried to stop us. 

I imagine no possible situation where this is appropriate at an f1 race. Even if you allocated all pyro into a particular section you cannot prevent it reaching some part of an active track. Maybe it could be allowed once all the cars are stationary and in their garages but good luck stopping it before the race unless you somehow confiscated them then returned them all right after the race. Impossible.

Overall, not good for the sport in my opinion. Too dangerous, too disruptive and not popular.",2,1662141890.0
imvcv1j,:sebastian-vettel: Sebastian Vettel,Misleading. 2 signs down it says they’re handing them out evenly so the entire track is coated in orange smoke,2,1662166728.0
imscxsy,:racing-pride: Racing Pride,"First lap: 🟧

Final lap: 🟧🟧🟧🟧🟧",6,1662121139.0
imrwu97,:kimi-raikkonen: Kimi Räikkönen,"Well, it's progress. I for one hope that flare bois get ejaculated from the venue but I know it won't go down like that",5,1662110456.0
ims4bxt,:alphatauri: AlphaTauri,Can't wait for Singapore where people get arrested for trying to bring flare in.,6,1662116140.0
