in40brb,:pierre-gasly: Pierre Gasly,"Pitting right before Yuki's virtual SC was a huge mistake by Ferrari, though. And it cost him the 2nd place and possible fight for 1st.

And to those who think it was just bad luck and no mistake was made, I'll sum up the event :

-Yuki stops claiming something is wrong with tires at the rear (possibly not screwed),  causing a yellow flag.    
-Ferrari prepares to pit Leclerc anticipating a SC. Other teams seem to be prepared to do the same.      
-Ferrari aborts its pit because SC is still not on during Leclerc's possible pit window.     
-AT tells Yuki the tires are ok and that he can go on. Thus he restarts but drives very slowly, indicating that something still remains not right.     
-During this time, AT and Yuki must surely communicate. These communications, although not broadcasted on the TV feed, are available for all teams to listen to, and all teams have a dedicated team in this regard.      
-Ferrari pits Leclerc. [edit: Apparently Leclerc asked if they could not delay the pit a bit, just to be sure there wouldn't be a VSC or SC (surely he must have seen Yuki's car was going very slowly still while passing him and that some further clarification was needed), but Xavi told him he was fine and could pit].    
-Other drivers, especially those competing with Leclerc, have not pitted yet.      
-Yuki pits again for quite long, and goes out again, but very slowly. Confirming that indeed, something is wrong.      
-Turns out there is a huge issue with the rear differential and Yuki is instructed to stop on the side of the track ASAP (around less than a minute after Leclerc's pit stop).     
-Yuki stops and a VSC is declared.     
-Notably every driver competing with Leclerc pits, apart from Hamilton who did not pit at all. This hints that other teams were waiting to see confirmation on whether the race might be influenced by a VSC or SC while Ferrari stopped caring about Yuki's situation at the moment he restarted after initially stopping.

This is a very avoidable mistake by Ferrari's strategy. That is also quite costly for Leclerc.",141,1662329998.0
in3fqks,:charles-leclerc: Charles Leclerc,"First without issues in 10 races, jesus christ. Ferrari really have stepped it up this season, just in the wrong way. I mean its better than being in the midfield but they'll possibly finish in the same position as last year in a way better car",30,1662321110.0
in2h41u,:charles-leclerc: Charles Leclerc,he’s never been happy to settle,37,1662307153.0
in3lsn9,:max-verstappen-33: Max Verstappen,"I think he's been cursed by that interviewer in Miami. The one called him ""Chuck boy""",20,1662323693.0
in31q4h,:fia: FIA,"Well, he pitted right before the sc, so it was unlucky race",37,1662315235.0
in39uyj,:ferrari: Ferrari,"Yeah like nothing really went wrong for Ferrari today (or rather, for LeClerc). They just didn’t have the pace of the Mercedes and Red Bull",19,1662318612.0
in3qcxz,:max-verstappen-1: Max Verstappen,Doesn't that seem like it might hurt even worse?  Even when they don't screw the pooch they are no longer competitive and .ah have been surpassed by Merc.,3,1662325635.0
in4odyp,:lewis-hamilton: Sir Lewis Hamilton,Just in time for the car's pace to completely fall off.,1,1662341328.0
in2pu5e,:daniel-ricciardo: Daniel Ricciardo,Definitely. I was happy for him that the sc came abd that he had pace to get in the podium. I was shocked at how slower that Russell he was,61,1662310561.0
in3du1b,:ferrari: F1? More like F5-F5-F5.,"Yeah, they screwed up Carlos' pit stop and cost his the race, but in terms of Charles, the strats were good, the pit stops were good, they simply didn't have a fast enough car.",454,1662320299.0
in2rjuh,:safety-car-mercedes: Safety Car,"> I think he's just tired here.

But expert armchair psychologists have confirmed this is the race where Ferrari broke him, even though this is the best race he's had since Austria and Miami before that.",476,1662311215.0
in5l45e,:pirelli-hard: Pirelli Hard,"Yeah, I hate this sort of picture-caption-combos where the poster can just make up their own narrative.",2,1662359491.0
in3sgbv,:lando-norris: Lando Norris,Right.  This is a very physically demanding track,1,1662326526.0
in2ptqj,:max-verstappen: Max Verstappen,His optimistic hopeful smile when he said that line will come to live on in infamy lol,452,1662310556.0
in41bmk,:charles-leclerc: Charles Leclerc,"He shouldn't have done it really. Should have kept contract length as a levarage, as Verstappen did before 2021. He signed a long term contract only after becoming champion.",8,1662330453.0
in2gunr,:red-bull: Red Bull,Agree. Not sure if its TD or just the setup and tyre management.,420,1662307051.0
in2ox4z,:ferrari: Ferrari,"Yep, today was fine, car just went from arguably quickest on the grid to 3rd fastest. There's only so much he could do.",40,1662310199.0
in2h399,:george-russell-63: George Russell,"what's TD?

It's technical directive, thanks.",132,1662307144.0
in2gr0f,:kimi-raikkonen: Kimi Räikkönen,"Yeah, somehow they didn't fuck up his strategy, just got unlucky with the VSC and the car lost pace after the TD.

Still he did his best, no engines blowing up this time.",81,1662307012.0
in304db,:kimi-raikkonen: Kimi Räikkönen,Maybe doing medium instead of hard. He was losing like 5s after pit,1,1662314582.0
in2hvbq,:pastor-maldonado: Poster Maldonado,Carlos was broken today though. He managed to fight off the Ferrari clowns in Monaco and Silverstone. But today they won.,341,1662307450.0
in2hpc7,:porsche: Porsche,They are suffering from higher tire degradation than Red Bull.,349,1662307385.0
in2jh9v,:carlos-sainz: Carlos Sainz,Tyre degradation. Leclerc stayed within 2 seconds of Max early then rapidly got dropped. His pace relative to Max dropped a lot towards the end of the stint.,62,1662308074.0
in2pm5k,:charles-leclerc: Charles Leclerc,I was genuinely confused in Austria when they had such good race pace and better tire deg than redbull. Seems to be a one off,25,1662310476.0
in2l89f,:michael-schumacher: Michael Schumacher,"They got the tyres on temperature faster... Because they eat them faster as well, that is why they lose race pace as the stint  progresses compared to other cars.",17,1662308748.0
in2p7t5,:ferrari: Ferrari,"It really isn't, the handling and balance of every car changes completely between full and low fuel. There have been lots of cases like that - for example Ferrari and Haas in 2019, or even Merc in 2013.",7,1662310317.0
in2nt8y,:charles-leclerc: Charles Leclerc,They have tyre issues since 2019. Never compleatly sorted them out. They are alway fast in the slow corners and have high tyre degradation.,1,1662309764.0
in30ch8,:kimi-raikkonen: Kimi Räikkönen,They eat the tires too much.,1,1662314673.0
in2ijmj,:daniel-ricciardo-3: Daniel Ricciardo,"Yeah he doesn't deserve this, he should have been up there fighting for the championship.",163,1662307705.0
in37mr0,:pirelli-hard: Pirelli Hard,"I felt like pouring one out when he signed such a long contract with Ferrari. They're a top team, but it feels like he signed away all that potential, to never win a WDC.",1,1662317676.0
in2ls5c,:honda: Honda,"You leave your logic out of our pity-for-Leclerc and Ferrari Sucks party!

And Happy Cakeday!",50,1662308965.0
in5dx9p,:niki-lauda: Niki Lauda,"They didn't really forget it, but were told too late to get the tires ready.  They were running out of the garage with the 4 tires when the car was already coming in the pit box, so the guy with the rear left had to go all around the car.",2,1662354622.0
in3shbr,:sebastian-vettel: Sebastian Vettel,"Are they actually saying that? Because of the time he won it with an illegal car?

Mkay Sky.",3,1662326538.0
in2hhhc,:red-bull: Red Bull,They broke a world champion,60,1662307299.0
in3ne5d,:ferrari: Ferrari,Honestly today wasn’t bad. I do think it’s the TD,1,1662324366.0
in2iga4,:red-bull: Red Bull,I'm all in for Charles or Lewis in the other RB. Let's bring it,32,1662307670.0
in3hepv,:ferrari: Ferrari,"Better than 2021 too, it's just that they're on a downward trajectory right now so it feels worse",7,1662321817.0
in407h5,:sebastian-vettel: Sebastian Vettel,TD = Tyre Deg?,1,1662329943.0
in2h2a9,:flavio-briatore: Flavio Briatore,brokest,16,1662307132.0
in51dr0,:carlos-sainz: Carlos Sainz,Car-Lost,2,1662347590.0
in2j33c,:bmw-sauber: BMW Sauber,And now Mercedes has come knocking picking up any scraps they can get their hands on,20,1662307920.0
in34c2i,:mercedes: Mercedes,Nope. Leclerc with Merc. We need dank Sharl in a black Merc.,11,1662316312.0
in3eza8,:daniel-ricciardo: Daniel Ricciardo,Until he changes teams...,4,1662320789.0
in2lvt3,:sebastian-vettel: Sebastian Vettel,Honestly he just looks tired lol,23,1662309006.0
in2n0ua,:max-verstappen: Max Verstappen,"It's only exaggerating if someone photoshops some pigeons, a loaf of bread, and Death into this picture.",2,1662309453.0
in3q45d,:red-bull: Red Bull,next year is their year,1,1662325531.0
in2r0hx,:safety-car-mercedes: Safety Car,"> look for options.

*Would you prefer Haas or Williams. Question?*",24,1662311018.0
in3d869,:sebastian-vettel: Sebastian Vettel,Kimi's lucky he slid in right after Michael.,2,1662320038.0
in2n2p5,:ferrari: Ferrari,"This is simply not true.
Barrichello and Massa were second drivers, not so fast as real champions (Schumacher, Hamilton, Verstappen). They can’t compete with superior drivers at their times. Massa got unlucky, but honestly he didn’t deserve that title in 2008, Hamilton was stronger and it has always been. 


Alonso is a team killer, as in McLaren he is the First Lady, he broke the teams, he broke the unity; think that he didn’t share his data with Massa who is a real second driver. He is not a team player, but formula 1 is also about sharing data and helping the team to build a better car. You can’t be like “give me a fast car” without giving your contribution for it. The driver is the first source of informations for engineering. For example Vettel was absolutely superior in this matter compared to Alonso.


Vettel screwed himself many times under pressure, he showed that he won with a clear stronger car with zero competitors and he was simply not at the level of Hamilton; Lewis Hamilton or Max Verstappen would have won with 2018 Ferrari, be honest. 

Ferrari is not a career killer. Drivers who don’t win are simply weaker than drivers who win, when both have competitive cars.",-2,1662309474.0
in3yo2e,:formula-1-2018: Formula 1,"So he’s not allowed to care about his career. 

Get fucked why are you even here hah",6,1662329244.0
in2nkez,:yuki-tsunoda-22: Yuki Tsunoda,"That pit stop was atrocious. Another example of Ferrari shootings themselves in the foot,",2,1662309669.0
in3x0p0,:nico-rosberg: Nico Rosberg,All the Sainz were there.,331,1662328510.0
in3tlz9,:we-race-as-one: #WeSayNoToMazepin,A soul for a soul,76,1662327027.0
in5kskw,:fia: FIA,Checking...,2,1662359259.0
in2uih2,:formula-1-2018: This person is hyped for 2022,Did they swap chassis? Does Sainz now have the cursed one?,198,1662312364.0
in2z9tp,:nigel-mansell: Nigel Mansell,That’s what I said. I hate seeing Ferrari mess up so much.,6,1662314238.0
in32yyp,:sebastian-vettel: Sebastian Vettel,And a partridge in a pear tree,210,1662315747.0
in4ogi8,:lewis-hamilton: Sir Lewis Hamilton,And still ahead of Merc.  Fucking nightmare season for both teams.,1,1662341362.0
in40u0o,:sebastian-vettel: Sebastian Vettel,"Charles ""Chuck"" Leclerc I think it was, and at some point in the interview he called him ""baby"".",8,1662330227.0
in3l9rh,:murray-walker: Murray Walker,While that is unlucky that is hardly a mistake as you don't know in advance when a Safety Car will happen unless your name is Flavio Briatore.,48,1662323472.0
in2n0at,:sergio-perez: Sergio Pérez,throttle issues,45,1662309447.0
in4397r,:chequered-flag: Chequered Flag,"How can you even say that ? The pitstops and safety car timing, all went wrong for them. Mercedes were not that faster than them. They were always at the better strategy at any given time of the race so they looked better.",9,1662331361.0
in35x9o,:fernando-alonso: Fernando Alonso,"Bruh
Leclerc was like over half a second faster than Sainz per lap and he was the issue?! Is this a joke?",52,1662316964.0
in30jif,:ferrari: Ferrari,Have you seen the pace of his teammate ? I don’t think he could have done anything more today.,59,1662314752.0
in38q0d,:formula-1-2018: Formula 1,"You say that the podium was gifted to him but he was unlucky as well in the sense that he pitted just before the SC. So, in one scenario he lost out and in another scenario he benefited. It would have been a close battle between George and Leclerc for the final third position if all things would have played out normally.

Also, he drove much better than his team-mate. That's possible the only reliable metric. Ferrari just didn't have the race pace today.",17,1662318133.0
in49vmi,:lewis-hamilton-44: Sir Lewis Hamilton,I see your braindead takes transcend r/soccer,1,1662334513.0
in3fipq,:ferrari: Ferrari,And they got a bit unlucky with the SCs/VSCs,162,1662321016.0
in42jts,:mclaren: McLaren,You forgot the unsafe release hahaha,1,1662331029.0
in37tp7,:carlos-sainz: Carlos Sainz,">	armchair psychologist

you mean like every psychologist?",106,1662317758.0
in3utjv,:formula-1-2018: Formula 1,"Yeah, Zandvoort is just an exhausting track to drive for the drivers, so many direction changes in such a short time.

Today Leclerc's side of the garage at least can be very pleased with their result.",1,1662327551.0
in30rms,:michael-masi: Michael Masi,[Decor in Charles' garage at Ferrari](https://img.buzzfeed.com/buzzfeed-static/static/2015-10/26/18/enhanced/webdr01/grid-cell-13876-1445898523-2.jpg),303,1662314841.0
in2h8u4,:ferrari: Ferrari,It’s both.,185,1662307204.0
in2loxs,:ferrari: Ferrari,"New TD screwed them and probably caused them tyre problems. All throughout the season ferrari were great at finding the right setup for the race.
It's clear to me that with the new TD they either don't understand the car very well or they have lost a significant amount of performance and can't do too much.",75,1662308931.0
in4opqc,:lewis-hamilton: Sir Lewis Hamilton,Pace was looking great on Saturday.  LeClerc absolutely takes pole if he cleaned up the second sector.,2,1662341484.0
in2h8ed,:anthoine-hubert: Anthoine Hubert,Technical Directive.,98,1662307199.0
in2hchh,:red-bull: Red Bull,"Technical directive. It got I to effect from last race, and suddenly Ferrari lost the pace",18,1662307244.0
in2il9f,:romain-grosjean: Romain Grosjean,Touchdown!,13,1662307723.0
in2ln72,:formula-1-2018: Formula 1,"Turbo Diesel, probably.",17,1662308911.0
in2haag,:mclaren: McLaren,Technical directive,3,1662307220.0
in2k8hm,:formula-1-2018: Formula 1,Timothy Dalton,10,1662308370.0
in2hbel,:max-verstappen: Max Verstappen,Technical Directive?,2,1662307231.0
in2h87f,:sebastian-vettel: Sebastian Vettel,Tire degradation?,-2,1662307197.0
in3085w,:kimi-raikkonen: Kimi Räikkönen,Always seems to fuckup Ferrari.,1,1662314624.0
in3jgo5,:formula-1-2018: Formula 1,Tapioca Dudding.,1,1662322703.0
in3dhyu,:sebastian-vettel: Sebastian Vettel,what’s the new technical directive say?,1,1662320154.0
in2yddo,:max-verstappen: Max Verstappen,"Higher car, less downforce, more sliding.",22,1662313881.0
in5mx2t,:ferrari: Ferrari,">Mercedes has resolved their issues 

Come on, let's just say that FIA solved the problem for them",2,1662360802.0
in380yk,:red-bull: Red Bull,[Technical Directive](https://www.formula1.com/en/latest/article.tech-tuesday-understanding-the-technical-directive-on-floors-that-will-come.JGEsskbNaf5cpMy2uijHP.html),2,1662317844.0
in2zhzy,:haas: Haas,"wish I could tell you that Carlos fought the good fight, and Fereari let him be. I wish I could tell you that - but F1 is no fairy-tale world. He never said who did it, but we all knew.",29,1662314330.0
in2kqe8,:formula-1-2018: Formula 1,My man fought it until the end like a true hero. And I think everyone who have been driving for Ferrari since 2008 are heroes,77,1662308557.0
in2s6yb,:carlos-sainz: Carlos Sainz,"Yeah, up until that terrible pit stop. He was in the mix of the game. Then it just felt he is putting out a race to not lose rather to win. That hunger to race was gone.",35,1662311463.0
in326r0,:mick-schumacher: Mick Schumacher,I have a hard time feeling bad for Carlos after passing on the straight under yellows right next to a stationary car. That was pretty fucking braindead.,-3,1662315425.0
in30z3d,:ferrari: Ferrari,"Is this because they're running higher downforce/different camber than other teams?

I always wondered why the difference is so big vs RB",1,1662314927.0
in2vgsa,:pirelli-hard: Pirelli Hard,Or his pace was always significantly worse than Max he was just pushing harder to make the gap appear the same and borrowing from the future,1,1662312733.0
in3nqrp,:charles-leclerc: Charles Leclerc,Only having 1 practice session before parc ferme fucked Red Bull in Austria imo. You only have 1 hour to get things right. Same happened to Ferrari in Imola.,3,1662324515.0
in2xy65,:max-verstappen: Max Verstappen,Was it colder there maybe?,3,1662313713.0
in39ne6,:we-race-as-one: #WeSayNoToMazepin,Red Bull admitted they fucked up their setup I think,1,1662318525.0
in3syw1,:lando-norris: Lando Norris,"That's why DAS was useful as well, it lets you have the best of both worlds.  Brake magic too.",2,1662326744.0
in2is4r,:red-bull: Red Bull,"110%

As happy as I am to see Max take this home, I'm also gutted for Charles. Hopefully he gets another shot next year",97,1662307799.0
in3t4gu,:red-bull: Red Bull,He's definitely fighting an uphill battle,1,1662326812.0
in2il14,:kimi-raikkonen: Kimi Räikkönen,Kimi got away by winning it in his first year,59,1662307721.0
in4phe7,:lewis-hamilton: Sir Lewis Hamilton,And that team is Red Bull...,1,1662341853.0
in2m2p9,:ferrari: Ferrari,You know he has just finished a formula 1 race,16,1662309081.0
in3fttl,:honda: Honda,"We are checking…

Also, nice username.",1,1662321147.0
in3p3lt,:mick-schumacher-47: Mick Schumacher,"Mercedes will have an open seat once Hamilton retires. They can even decide if they want a contender alongside Russell (Leclerc) oor a solid 2nd driver (Sainz).

RedBull will also have the same option for Perez's seat.",1,1662325099.0
in3lzm1,:kimi-raikkonen: Kimi Räikkönen,"Lol imagine thinking that the 2018 car would win a championship 😂

Mercedes were on a totally different level on the 2nd half.",4,1662323776.0
in2obf1,:ayrton-senna: Ayrton Senna,"Good points, but with all these Ferrari was a mess. A lot of these looses are on the Ferrari as well.",0,1662309966.0
in3630l,:jenson-button: Jenson Button,"Barrichello was never first driver material.

Massa was for 2008 and could be strong at other times, but no. Considering every driver Ferrari has had since 2007 though, him and Alonso have brought them closest to a drivers title since their last.

Vettel, yes I'll give you that. They definitely fucked him about at times, but he was quite error prone in his later years.

Alonso......he didn't give a contribution to them?! He was their best driver since Schumacher, always gave every single thing he had in the car. With data sharing yes he wasn't always a team player and has shwon that with other teams, but you can't fault him inside the car like with Vettel.",0,1662317032.0
in2nrhs,:mclaren: McLaren,Yep. 15 seconds u just cant take back.,1,1662309745.0
in3nryy,:mika-hakkinen: Mika Häkkinen,They have just one lucky charm in Ferrari and it was Charles time yo hold it.,2,1662324528.0
in4l6qf,:michael-masi: Michael Masi,We are checking....,1,1662339789.0
in4q131,:sebastian-vettel: Sebastian Vettel,No just the red ones are cursed,1,1662342112.0
in33yt5,:charles-leclerc: Charles Leclerc,LOL,3,1662316159.0
in3dk1d,:stand-with-ukraine: #StandWithUkraine,🤣🤣,1,1662320179.0
in3p4v4,:charles-leclerc: Charles Leclerc,"Charles did ask if they shouldn't wait to see if there would be an SC, Xavi said no they're fine 🥲",42,1662325114.0
in3yjgz,:pierre-gasly: Pierre Gasly,"Yes it was a mistake. Yuki did go again, but every other team waited to see wether there was a real issue or not. 1 more lap worth of patience and they'd pit right at the right time.

If other teams did it, it means Ferrari would have been able to.

Because when Yuki restarted his car, he kept driving slowly back to the pit. So clearly not ""everything [was] okay with the car"" as AT told Yuki. Every team has people dedicated to listening other teams' radio and they did miss this key information. That seemingly other teams caught.

It's not as obvious, but it remains a big strategic mistake that cost Leclerc 2nd if not a fight for 1st.",10,1662329186.0
in2p5aw,:max-verstappen-1: Max Verstappen,"But not major enough to take away the win. And he'd rather have some throttle issues and win than get a p3, i'm sure.",22,1662310288.0
in3gd81,:martin-brundle: Martin Brundle,He didnt have the pace to fight for a podium today. Just lucky merc went for the win with lewis. Whether that is just down to the car or not the issue was still with his pace not with Ferrari strategy.,3,1662321378.0
in46cyn,:ferrari: F1? More like F5-F5-F5.,That was Carlos not Charles. With Charles they probably did everything they could.,2,1662332826.0
in474uc,:yuki-tsunoda-22: Yuki Tsunoda,"It wasn’t really an unsafe release. Sainz had to stop because there were mclaren mechanic walking ahead of him and as the result lost time.

Zandvoort pit lane just sucks, it’s too cramped.",1,1662333195.0
in39bbz,:safety-car-mercedes: Safety Car,touché,35,1662318381.0
in3gobt,:michael-schumacher: Michael Schumacher,Nice one,4,1662321509.0
in3ixxx,:pirelli-hard: Pirelli Hard,https://i.imgur.com/jRVBrAP.jpg,39,1662322478.0
in2ip9s,:niki-lauda: Niki Lauda,Possibly one causing the other as well.,76,1662307767.0
in2z55b,:honda: ありがとう,It’s a party in Spain but the S is silent,1,1662314187.0
in391k5,:damon-hill: Damon Hill,"Binotto was insistent talking to Sky that the TD hasn't affected them at all, so we can say with almost 100% certainty that it has.",75,1662318266.0
in391cd,:formula-1-2018: Formula 1,Giovinazzi is busy preparing for his seat at Haas hence couldn't do the setup work for Ferrari this weekend and hence the lack of pace.   /s,7,1662318264.0
in2oqqi,:max-verstappen: Max Verstappen,Thanks! My first guess was tire deg,57,1662310132.0
in2hav8,:george-russell-63: George Russell,thank you,11,1662307226.0
in3ezx6,:max-verstappen: Max Verstappen,Tony Dalton?,1,1662320796.0
in3a0ye,:damon-hill: Damon Hill,"Oh, it's not close to the end yet. Much more to fight yet!",5,1662318683.0
in2xee7,:pirelli-intermediate: Pirelli Intermediate,"He was not in the mix though, he was falling away from Leclerc/holding up Hamilton and co. He had no luck after that tho.",18,1662313497.0
in2lg6n,:default: Default,They were the only ones complaining about tyre deg on the radio (at least what was broadcasted).,85,1662308835.0
in3644q,:fernando-alonso: Fernando Alonso,No. It was hotter even,4,1662317044.0
in2q8e9,:ferrari: Ferrari,It usually is about tire wear,2,1662310717.0
in2j54d,:daniel-ricciardo-3: Daniel Ricciardo,Yep Max surely is going to cruise through this one but next year maybe. He has proved that he has what it takes to be up there fighting with Max.,33,1662307942.0
in34i3d,:charles-leclerc: Charles Leclerc,Hopefully Red Bull steals him away 👀,1,1662316381.0
in38ad5,:kimi-raikkonen: Kimi Räikkönen,"“Just leave me alone, I know what I’m doing.”

-Drivers who win with Ferrari",21,1662317954.0
in2jo25,:sebastian-vettel: Sebastian Vettel,"Imo, If it was anyone but Ham/Alo in one of their seat, McLaren would have won the championship. Ferrari got lucky that they had a clear #1 while the McLaren drivers took points off each other.",29,1662308148.0
in2iymn,:max-verstappen-1: Max Verstappen,"I think under Arrivabene they used to be more organised, calm and composed!",12,1662307871.0
in2pl5k,:daniel-ricciardo: Daniel Ricciardo,"Alonso, Vettel. Who is the third?",3,1662310466.0
in2p5o2,:mohammed-ben-sulayem:  :pride-flag: Mohammed Ben Sulayem,"> max will be number 1 no matter who is in the second seat

RB don't work that way. If someone came along and ended up performing better than Max he'd be dumped in an instant.",9,1662310293.0
in2me7q,:sebastian-vettel: Sebastian Vettel,"That’s exactly what I’m trying to say. He’s literally just tired, not “broken.”",9,1662309205.0
in3b020,:pirelli-hard: Pirelli Hard,The 1982 special,40,1662319093.0
in3bhc3,:lando-norris: Lando Norris,But they have a newer power unit...the power unit is also cursed,12,1662319290.0
in42pfk,:chequered-flag: Chequered Flag,"Ferrari cant handle two fuckups at the same time, they can only focus one fuckup at a time.",2,1662331101.0
in665mm,:formula-1-2018: Formula 1,But it comes with a free Frogurt!,2,1662376557.0
in3oj3o,:renault: Renault,"The can screw up as much as they want, it has not made a difference since 15 years now.

They will never touch the strategy team.",12,1662324854.0
in3i5ge,:formula-1-2018: Formula 1,Yeah I don’t think anyone needs to be executed for this.,1,1662322134.0
in3djvc,:seb-bee: Sebastian Vettel,And a seagull in a french T (cam),9,1662320177.0
in3ln8q,:formula-1-2018: Formula 1,Whilst verstappen was racing in clogs.  Lol,1,1662323630.0
