in74ma8,:fernando-alonso: Fernando Alonso,People like Jordan F1 do not help this cause with their tinfoil hat creating strange theories,11,1662393585.0
in7i4ix,:formula-1-2018: Formula 1,Toto insinuated it was some conspiracy during this post-race interview. Surprised he isn’t getting more heat for this,26,1662398953.0
in79a4y,:lewis-hamilton: Sir Lewis Hamilton,Like RB need any help what so ever in winning this season. It’s been practically in the bag since the break 😂,7,1662395443.0
in7487h,:sebastian-vettel: Sebastian Vettel,"This is what the boom of the sport has caused, too many individuals who have no idea what they're talking about having to share their opinion on any platform that they can (*especially social media*).",3,1662393427.0
in7aod3,:we-race-as-one: #WeSayNoToMazepin,"Petition to donate an extra braincell to those toxic ""fans"".
1 braincell = 1 less twitter comment.",3,1662395998.0
in7e48u,:mercedes: Mercedes,This is what our sport is now. Nice work everyone,3,1662397358.0
in7extq,:sebastian-vettel: Sebastian Vettel,But didn't the VSC force Max to put earlier and it was Bottas causing the SC that helped him more?,3,1662397689.0
in7hu2g,:ayrton-senna: Ayrton Senna,Yet another lesson how social media runneth amok with it’s bullshittery. Strange times.,3,1662398838.0
in7i5dd,:lewis-hamilton: Sir Lewis Hamilton,"Sometimes its questionable how a technologically advanced, intelligence-laden sport like f1 attracts seemingly unintelligent fans",3,1662398962.0
in7lmp7,:mercedes: Mercedes,"This whole thing is some proper tinfoil hat bullshit.

Shit happens in racing. Cars breakdown, Ferrari, bad pit stops, Ferrari, driver error, Ferrari... The idea that AT/Yuki were manipulating the race is a full-blown conspiracy theory. People attacking a driver, a team, or team personnel because a race didn't go their way are sick, sick people.

Unbelievable.",3,1662400351.0
in7mjo2,:ferrari: Ferrari,"After checking the Mercedes replies yesterday on the post congratulating THEIR driver George Russell, I knew all hope was lost, F1 fans I've met in real life are not like that, but in places like Twitter there is no hope at all",3,1662400726.0
in7s6kr,:red-bull: Red Bull,"How stupid you think Red Bull would be? They are leading the championship by a mile this year, it's in the bag and they will win plenty races that are still on the calendar.

Of course Red Bull wants to win at Zandvoort but not that bad to come up with this nonsense. People are insane.",3,1662403031.0
in808gf,:new-user: New user,I blame Netflix,3,1662406407.0
in80rbw,:max-verstappen: Max Verstappen,"This might be the dumbest ""outrage"" in F1 in a while",3,1662406628.0
in85ll9,:formula-1-2018: Formula 1,That Tsunoda thread was an embarassment to read.,3,1662408677.0
in8de3u,:formula-1-2018: Formula 1,Anyone who would even consider red bull would cheat on a season they are running away with the championship are absolutely asinine and plain stupid.,3,1662412019.0
in8dpq4,:max-verstappen: Max Verstappen,We’re evolving but backwards,3,1662412159.0
in8f7hq,:mclaren: McLaren,Twitter really is a sespit isn't it.,3,1662412813.0
in8j3wr,:porsche: Porsche,"Sky Sports commentators especially people like Crofty & Ted played a role instigating these non-sense.

Mercedes has been competitive for one race & there's more drama & toxicity than the entire season so far.

There so many ways you can debunk these non-sense.

1. The race wasn't over Max still had a very good chance to win the race.


2. If AT's goal was to cause SC/VSC why they didn't retire the car the first time? Yuki had already loosened his seatbelt & was ready to get of the car. They could've just retired the car right there. Now Yuki even got reprimand for driving with loose seatbelt.


3. Why they didn't to this last year when championship was actually close? This year they have both championship in the pocket. Max doesn't even need to win race to win the championship. These people are suggesting that they did all of this and risked everything because there was chance that they may not win this one race.",3,1662414523.0
in9an49,:default: Default,"Yukis incident didn’t really matter in the end anyway, it put both Mercs on fresh mediums while Verstappen was on hards, they where catching Max too before the SC",3,1662427286.0
in73kj4,:ferrari: Ferrari,What is the reason for Hanna's hate? It's not her fault for Tsunoda's retirement,9,1662393161.0
in7724f,:max-verstappen-33: Max Verstappen,I think the worst part is Hannah really would not have liked so much attention. Poor woman.,5,1662394565.0
in7ab9w,:sergio-perez: Sergio Pérez,"This is nothing.

You want a good conspiracy theory? Ferrari being utter shit in both strategy and pits while Binotto insists that everything is running according to plan.",7,1662395853.0
in7bss2,:formula-1-2018: Formula 1,Nobody deserves that abuse for being that good at their job. Shes on another level,7,1662396437.0
in7e2sd,:max-verstappen: Max Verstappen,One woman is smarter then the rest of the grid. Grow up.,7,1662397342.0
in7fsd5,:lewis-hamilton: Sir Lewis Hamilton,"This is exactly the kind of shit why I am hesitant to call myself an ""anything-fan"". Like, ""Tsunoda-Gate"" was a fun meme, but why do people gotta take everything so fucking seriously. Why do 5% (if it's even that) of Twitter-no-lifers gotta ruin it for the rest of us?

As a Lewis fan, I want to apologize for the rest of us, especially to Hannah, for having to deal with this bs",5,1662398029.0
in77aqi,:gilles-villeneuve: Gilles Villeneuve,"Congratulations DtS. You've created enough artificial drama to attract a bunch of fair weather, casual fans who now believe the bullshit you fed them and find boogeymen under every rock.

This is on you, we didn't have this toxicity in 2010. Thank god I don't have TWITter",13,1662394660.0
in74eta,:kimi-raikkonen: Kimi Räikkönen,"Ah, the “best fans in the world” show their colors yet again.",19,1662393503.0
in73srd,:stand-with-ukraine: #StandWithUkraine,Sky Sports F1 is also to blame but somehow no one within F1 or FIA seems to do anything against it,29,1662393255.0
in77fhm,:max-verstappen-1: Max Verstappen,maybe one day they'll learn to ignore the trolls instead of giving them oxygen. who gives a fuck what Twitter thinks!,8,1662394713.0
in76pzr,:red-bull: Red Bull,"Why cant everyone just shut the f*ck up, and enjoy the sport? The cars? The drivers? The whole atmosphere on track? Like come on people…… 🤨",4,1662394430.0
in7lhfq,:mclaren: McLaren,"Breaking news: Twitter sucks and is not indicative of real life. 

I understand why AT are so upset, but are we pretending like this type of thing could never or has never happened in F1? Lmao.",5,1662400291.0
in71jki,:daniel-ricciardo: Daniel Ricciardo,What was being said about Hannah? Even on F1 twitter she seems to be getting praise for the race strat.,16,1662392337.0
in7615o,:robert-kubica: Robert Kubica,"when the rest of the F1 fanbase has moved on but the LHCult has to keep dragging everyone down.  let's just all fucking get over ourselves, move on, and enjoy some racing",18,1662394152.0
in7sjr4,:ferrari: Ferrari,LH Cult back at it again,9,1662403184.0
in71q9v,:yuki-tsunoda: Yuki Tsunoda,"Why even give the trolls and conspiracy theorists the time of day? Statements like this don’t make any sense. Anyone with functioning brain cells knows why, and can adequately explain what happened with Yuki on track. They know it, everyone with an IQ above seven knows it. Why bother?",25,1662392412.0
in768oj,:charles-leclerc: Charles Leclerc,Please don't forget that Sky F1 and Toto Wolff fueled this in their post-race bit where they smirked about Yuki's incident.,28,1662394237.0
in72mdi,:manor: Manor,Rightfully so! absolutely rediculous statements,5,1662392773.0
in74hza,:red-bull: Red Bull,remember Mexico q3 last year,4,1662393538.0
in75qn7,:carlos-sainz: Carlos Sainz,"Social medias were a mistakes, they brought way more issues than solutions.

Just bots and sheeps vomiting frustration on a keyboard..",5,1662394033.0
in77eov,:mclaren: McLaren,"The fact that they feel the need to publish this statement shows how bad the state of social media has gone. 

But also the fact that so many people genuinely believe in this also shows how bad the integrity of F1 has become. The harm Abu Dhabi 2021 did will be felt for years to come",5,1662394704.0
in7d8gr,:mclaren: McLaren,"F1 Twitter fan base is fucking awful. I assume it's the same in insta, but I don't use that one.",4,1662397008.0
in7fv4m,:ferrari: Ferrari,Pro life tip. Get off twitter. Twitter is a cesspool of crap and nonsense. Stop giving these people attention.,3,1662398060.0
in7m4rf,:safety-car-aston-martin: Safety Car,this all started with the weird and stupid Crofty comment suggesting AT were trying to cover their mistake with pretending Yuki's seatbelt had been undone.I don't understand why a commentator would think this as the first thing,5,1662400555.0
in73qhe,:mclaren: McLaren,Sky F1 pedalled the same conspiracy and entertained Toto Wolff’s conspiracy discussion too. They owe AlphaTauri and Hannah an apology as well.,20,1662393229.0
in752hg,:force-india: Force India,"Simple thing don't open twitter that God foresaken app, shit should be banned, fuck free speech that shit gay as hell",2,1662393764.0
in76sm1,:haas: Haas,"Toxic fans being toxic, nothing new",2,1662394460.0
in774nk,:mick-schumacher: Mick Schumacher,"RIP her DMs, if she has social media.",2,1662394593.0
in77xdk,:max-verstappen: Max Verstappen,Wait what happened this time?!,2,1662394904.0
in79fb2,:stand-with-ukraine: #StandWithUkraine,Wait a second. I thought all the conspiracy theories were just memes. Are people being serious about this?,2,1662395500.0
in79wrk,:pirelli-soft: Pirelli Soft,"People got way too much time on their hands tbh 😒 

Turn off the internet once in a while and go out",2,1662395692.0
in7jfvv,:carlos-sainz: Carlos Sainz,"All that happened yesterday was that Hamilton finished 4th in a race he should've finished 2nd in (with a very faint chance of 1st, at best).

And what resulted out of it is Yuki receiving tons of abuse, some of them being racist. Death threats and multiple sexist and misogynistic comments about Hannah Schmitz. Even George received a fair bit of abuse.

That says a lot about how toxic the community has become post-DTS.",953,1662399477.0
in8km6j,:max-verstappen: Max Verstappen,"Most fan bases of almost all professional sports are full of toxic, hateful people. It has always been that way. We just live in a time where social media has given these people a platform to spew their hate without any consequences",3,1662415203.0
in73sns,:max-verstappen: Max Verstappen,"Whats funny to me is that AT apparently manipulates a meaningless race when RB basically has the 2 titles won already, but doesnt do shit at Abu Dhabi when the WDC is decided by whoever wins.",1936,1662393254.0
in74e82,:pirelli-hard: Pirelli Hard,"And to deny Lewis, not like it was Charles. And how would they even signal to Yuki to *pretend* to have a problem? And like Yuki would put up with that shit. And couldn't the FIA verify the problem with the car?? 

But logic obviously isn't their strong suit so nvm.",135,1662393496.0
in88nj7,:george-russell: George Russell,"Exactly why would they risk getting both teams and the drivers disqualified when both championships look like they are in the bag and Merc is not their competition this year. Why this year and not last year when the championship came down to one lap. 

Also if you are going to do it why do it in such a showy and suspicious way. Why not have Yuki just hit a barrier somewhere. 

How does Redbull tell AT to do this and then how do they tell the driver and why do it then ? When they stuck the hard tires on and not when MV was at the point that he wanted the softs which seemed like the plan? 

It falls apart with the least amount of critical thought.",3,1662409975.0
in7cv1c,,"Also what i don't get is, Yuki was already stopped on track and if he had stayed there would have gotten a VSC or SC out. There was absolutely no need for AT to ask him to drive back, change some shit and put him out again. If there was a conspiracy going on they could have just let him park his car on track the first time.",4,1662396857.0
in73of4,:we-race-as-one: #WeSayNoToMazepin,"Yeah it’s about the Yuki incident. The broadcast cameras turned to Hannah on the Red Bull pit wall as it was happening and she had a smile on her face/was giggling, so that set off the conspiracy theories…

Edit: changed Sky to “the broadcast” since apparently Sky doesn’t choose those shots.",1249,1662393205.0
in71u8r,:kimi-raikkonen: Kimi Räikkönen,Yeah some people started saying that Yuki deliberately stopped on track to help Max (who hadn't pitted yet),369,1662392455.0
in72lw4,:kimi-raikkonen: Kimi Räikkönen,"F1 social media has become incredibly toxic the past 2 years. Even bloody football twitter is less toxic nowadays. All F1 social media has become is a pissing match on who can hate other drivers more. Not even who is better or whatever. 

The ""this is rigged"" *ironically* and Crashgate 2.0 jokes were funny but then some people actually took it seriously and decided ""yeah, time to say ABUSE""",1976,1662392767.0
in72scv,:pastor-maldonado: Poster Maldonado,The state of F1 commentary and journalism. Sky and several other F1 media floated the idea of a conspiracy. There is enough toxicity in the fanbase without the media pushing these kinds of narratives.,449,1662392841.0
in746xy,:alexander-albon: Alexander Albon,"A similar sort of thing happened after Monaco with the Williams blue flags situation (Although no response had to be made), and people were sending so much shit to the team and drivers. It seems certain people love to jump to conspiracy crap before thinking maybe someone just made a stupid error",21,1662393413.0
in75r3j,:lance-stroll-18: Lance Stroll,"I thought people were joking about the AT conspiracies, but when I saw people actually seriously discuss it as if it were a possibility, I was quite taken aback.

I don't know what to make of the state of social media surrounding any F1 topic. Even though I know it is a select few who like to make noise and the rest are bots, but boy do they flood the forums with all kinds of shit",4,1662394038.0
in7n850,:formula-1-2018: Formula 1,FANBASE? Who seeded the idea in fanbase? Martin Brundle and  Crofty.,4,1662400998.0
in725gu,:yuki-tsunoda: Yuki Tsunoda,"They don’t *have* to respond to this at all. It’s not like all the tinfoil hat wearers are going to read this and go “Oh shit, that’s right. Silly me, I should have considered the logical outcome.”",97,1662392581.0
in77yp0,:jordan: Jordan,"Nuts isn't it.   

Imagine thinking that both teams and Red Bull a huge global mega brand would irreparably damage their brand by cheating.... Especially in a season where Max is dominating and they don't even need to, ...especially after a very close season last year where they didn't even do any BS with their sister team to gain an advantage (if anything Max got disadvantaged more than once due to Alpha Tauri)...  

It truly beggars belief, I'm convinced this is toxic fans just now trying to come to terms with the fact Lewis has lost this year, and trying to come up with an excuse to delegitimise Max's 2nd title like they did his 1st.  Watch them say he shouldn't have won it this year due to some made up idea of cheating.  I've said it before and I'll say it again, these cultists in F1 social media remind me so much of MAGA cultists who see only what they want to see... It's a mental illness.  

I'll also say Sky Sports and the likes of Crofty do nothing but fan the flames too, even suggesting ""should they be allowed to pit during safety car?"" Whenever it didn't go Lewis's way, but any other time he says nothing about it and even talks it up how a safety car pit stop could shake things up... They are partly responsible for whispering shit in their ear.  Ted too does it often, says at the start of the season they won't mention Abu Dhabi again, yeh he still constantly brings it up as a reminder... He even hinted at some kind of conspiracy during Yuki's dilemma...ffs sky",36,1662394918.0
in7hhgm,:we-race-as-one: #WeRaceAsOne,"Sky Sports themselves threw around the words “conspiracy theory” several times on their broadcast. This pointed message is just as much for them as it is crazy fans on Twitter, and that’s the real disappointment honestly.",3,1662398698.0
in7a2st,:pierre-gasly: Pierre Gasly,"F1 twitter is the absolute worst fanbase I've ever seen in sports, it's insane how bad it's become",2,1662395758.0
in7ew5w,:lando-norris-4: Lando Norris,"also english isn’t his first language, it will take him longer to find the right words",295,1662397670.0
in7eti9,:max-verstappen: Max Verstappen,"Tsunoda got a lot of abuse thrown at him, F1xed was even trending for a while on Twitter.",106,1662397640.0
in7f4fz,:kimi-raikkonen: Kimi Räikkönen,"The whole thing was a fiasco with tsonoda stopping, then getting told everything is fine, pitting where they probably refastened his seatbelts and then stopping again. It should not be a surprize if tsunoda was not feeling completely comfortable with how the things went.",27,1662397762.0
in8ov0f,:red-bull: Red Bull,"Agree, and he got a reprimand for it, which will be his fifth of this season and he will get a grid penalty at Monza I believe",23,1662417138.0
in8wz1s,:toro-rosso: Toro Rosso,"This always happens with Reddit,they refuse to admit that they might be part of the problem",32,1662420952.0
in76p58,:lewis-hamilton: Sir Lewis Hamilton,Doesn’t even make sense a strategy chief would not have the power to do that even if Red bull wanted to lol,56,1662394421.0
in76u21,:juan-manuel-fangio: Juan Manuel Fangio,"It's this the new (old) ""i'm not racist, buuuut..""?",94,1662394475.0
in742aa,:mclaren: McLaren,Because she’s a woman in motorsport and one that’s become more visible because she’s excellent at her job. Some of the stuff that was written about her under a now deleted tweet was horrible. They were questioning how she got her job. Calling her horrible names and making vile accusations against her.,262,1662393361.0
in7bnhr,:kimi-raikkonen: Kimi Räikkönen,"Uhhh https://www.reddit.com/r/formula1/search?q=inaki+Rueda

http://google.com/search?q=site:reddit.com/r/formula1+rueda",10,1662396378.0
in7fpr1,:chequered-flag: Chequered Flag,"I dont think grass is enough, more like 4 white walls and a coat",21,1662398000.0
in77ne5,:max-verstappen-1: Max Verstappen,"it doesn't need to be said and should just be ignored, fuck twitter.",12,1662394800.0
in76aoi,:sebastian-vettel: Sebastian Vettel,So a normal race thread then?,91,1662394259.0
in7f2g3,:mika-hakkinen: Mika Häkkinen,I got called a RedBull ass licker for telling someone to stop with the conspiracies lol,46,1662397740.0
in7n8dn,:max-verstappen: Max Verstappen,"I saw comments like “george shouldnt have pitted and if he didnt, max would be stuck in a drs train”… they dont even know the rules properly. Its weird how so many “casuals” have such strong opinions",51,1662401001.0
in8olx1,:formula-1-2018: Formula 1,Plenty of people in this subs quali thread were saying the exact same thing. It's not limited to F1 twitter,3,1662417021.0
in78lv7,:carlos-sainz: Carlos Sainz,Considering AT are the accused/subject of the hate I'm not too surprised,31,1662395175.0
in79fe0,:sebastian-vettel: Sebastian Vettel,"It wasn’t always this bad. The amount of statements that teams/drivers have made condemning “fan” actions has gone up massively since DTS/Liberty. Things were never this awful in contentious moments pre-2018. Of course there were a couple shitheads, but the quantity of toxic fans has gone up massively since people have started following this sport like it’s a soap opera.",83,1662395500.0
in8ffd6,:pirelli-hard: Pirelli Hard,"Most of the people who are toxic on twitter are also here...

There's just no downvote on twitter",16,1662412903.0
in75x1v,:red-bull: Red Bull,"Not only disqualification but Horner and Tost would probably be banned from the sport. Flavio Briatore was banned, later overturned, from all FIA events after crashgate.",36,1662394106.0
in89duq,:george-russell: George Russell,It’s worrying that some of these people can just so easily disregard facts and twist everything to their own narrative. Like how do they function in the real world.,6,1662410289.0
in730iv,:max-verstappen: Max Verstappen,Yesterdays race thread was full of dumb fucks as well,49,1662392933.0
in72inu,:mclaren: McLaren,You can't expect people to not react if you're main broadcaster is already conspiring during the broadcast and using the entire post-race to emphasize on that subject.,38,1662392731.0
in73ns6,:ferrari: Ferrari,"Tsunoda had some issue and went to the pits. After like a 40 second pitstop, they sent him out, only to tell him to stop the car and retire. Because this was already on the track, it brought out a VSC, which helped Max maintain his lead in front of the Mercs. Mercs were on a 1 stop strategy with pretty good pace, Max was on a 2 stop, with his 2nd stop still to do. Thanks to the VSC, he was able to perfom the 2nd stop while maintaining his lead. Basically Tsunoda's retirement ruined Mercs strategy which led to some conspirators think that Tsunoda retired on purpose and was told to do so by RB.",65,1662393198.0
in777xq,:charles-leclerc-16: Charles Leclerc,"Them, but also the teams themselves. The toxicity from Toto and Horner last year I personally think is largely responsible for the situation we're in today. If they could act like professionals and not fuel fire with every comment, then the media wouldn't react to it and exacerbate the situation.",19,1662394628.0
in7xk19,:michael-schumacher: Michael Schumacher,Did you watch the US elections ? It is wild how out of touch with reality the MAGA and Trump supporters were. It is not wild to imagine similar people believing that Yuki and AT cheated yesterday,5,1662405270.0
in73bbo,:love-is-love: Love Is Love,"I interpreted what Sky said as a different ""conspiracy"" - that they had brought Yuki in again and focused on the seat belt to cover up the fact that they sent him out without correctly attaching the wheels, so that they didn't get fined.",263,1662393055.0
in74ibo,:red-bull: Red Bull,"Sky commentators were insinuating that AT were trying to avoid a penalty for the unsafely screwed tyre by making it seem like it's a seat belt issue. They weren't pushing a conspiracy about collusion smh. If you're a sky q or sky glass customer (doing my best impression), or have an F1 TV subscription - go rewatch that part of the race. And please edit or remove your comment too because you're making a false claim",79,1662393542.0
in8jysl,:jim-clark: Jim Clark,They are incapable of ever saying anything bad about Saint Lewis of Hamilton.,7,1662414909.0
in7818x,:charles-leclerc: Charles Leclerc,"People like him that support their favorite driver blindly  (to sometimes extreme effect) create a very toxic environment. All good and dandy to support your favorite driver, but some of those people really go off on the wrong end.",11,1662394946.0
in8kocn,:porsche: Porsche,"I watched the interview, He was clearly joking (it was probably better not to joke about knowing how people react) but Sky Sports used to instigatie more non-sense.

https://twitter.com/SkySportsF1/status/1566765591754588162?t=pLcFF7jct7fhBP6xdRjZwA&s=19",4,1662415228.0
in8ym7k,:nigel-mansell: Nigel Mansell,~~Twitter~~ socialmedia really is a sespit isn't it.,3,1662421725.0
in74hs3,:sebastian-vettel: Sebastian Vettel,People think she has orchestrated the whole thing (Yuki stopping and VSC that follows) to prevent Lewis from winning.,13,1662393536.0
in74naq,:max-verstappen: Max Verstappen,"According to the conspiracy theorists she orchestrated it to help Max with the safety car. Even read some of these braindead takes in this thread, it’s so dumb.",10,1662393597.0
in74jro,:max-verstappen: Max Verstappen,The feed cut to her smiling on the pit-wall and that was all team #FueledByLove needed to dog-pile their toxicity onto her.,16,1662393557.0
in7mxvb,:jenson-button: Jenson Button,breaking news: twitter is full of real people living a real life in putting their toxicity there.,6,1662400883.0
in72seh,:max-verstappen: Max Verstappen,That's not how it works. We've seen since 2016 that's not how it works.,9,1662392842.0
in728rf,:george-russell: George Russell,Why should AT simply lay down and take it? They have a duty to protect their team and drivers.,25,1662392618.0
in72734,:red-bull: Red Bull,"Well, people are getting actual death threats over stuff like this. That’s why they bother.",42,1662392600.0
in72mfy,:fernando-alonso: Fernando Alonso,"You're not wrong that none of the knuckle dragging losers who spew hate will care. But it is worth it to stand up to it. The company coming out and saying this isn't to reach those brainless shit stains, it's to show support to those being harrassed. It makes it easier for them to go through something like that knowing they have support. Silence only emboldens the scum more",13,1662392774.0
in72lkz,:mike-beuttler: Mike Beuttler,"> Anyone with functioning brain cells knows why

You vastly overestimate Twitter.",12,1662392763.0
in76qxg,:sebastian-vettel: Sebastian Vettel,"They didn’t flock this narrative, they flocked the theory that AT did it to cover up their own mistake of misfitting the wheel (which ultimately wasn’t the case), nothing about collusion.",23,1662394440.0
