inbxigp,:hrt: HRT,He’s going for first.,4147,1662481524.0
inbxbr5,:bernd-maylander: Bernd Mayländer,He's smiling so that makes it ok,4132,1662481451.0
inbyk6w,:carlos-sainz-55: Carlos Sainz,Holy fuck that's a long finger,1272,1662481934.0
inc20iu,:honda: Honda,Love the smirk,359,1662483268.0
inby7fr,:formula-1-2018: Formula 1,Toto not sending an email this time,362,1662481796.0
inbxmv4,:lewis-hamilton: Who the f*ck is Nelson Piquet?,That fan lucky he didn’t get snapped like a cookie…or slice of toasted pumpernickel.,659,1662481573.0
inc2geh,:lewis-hamilton-44: Sir Lewis Hamilton,With a smile.,60,1662483439.0
inc0vyt,:fia: FIA,Lmao good stuff,16,1662482828.0
inc4m22,:charles-leclerc: Charles Leclerc,Link to the video where the fan actually says that?,12,1662484272.0
inc2fck,:pirelli-medium: Pirelli Medium,"If you’re gonna do it, at least say it right. He said Michael!",326,1662483427.0
inc80so,:formula-1-1993: Formula 1,"He's also smiling, so i think he's joining in.",8,1662485592.0
incdscz,:sergio-perez: Sergio Pérez,look at the smile on his face lol,8,1662487808.0
inc53ik,:lewis-hamilton: Sir Lewis Hamilton,"Toto, it's called a motor race. We went car racing.",58,1662484463.0
inbz7nk,:alpine: Alpine,That is so not right.,129,1662482189.0
indxuf8,:fernando-alonso-14: Fernando Alonso,that was so not right,5,1662510517.0
ine6swv,:charlie-whiting: Charlie Whiting,Can we all stop getting the quote wrong please?,11,1662514530.0
inc30mw,:lewis-hamilton: Sir Lewis Hamilton,Nothing beats the Toto Smirk.,16,1662483652.0
ine9923,:red-bull: Red Bull,"No Toto, no, that is soo not right!",4,1662515604.0
inczigc,:max-verstappen-33: Max Verstappen,While smirking lmfao,6,1662496055.0
incd42s,:max-verstappen: Max Verstappen,Good on him.,3,1662487543.0
inc5ats,:jim-clark: Jim Clark,Haha I just love Toto. Guy is a multimillionnaire in a sport that historically has been too serious bit stays care free,16,1662484541.0
ind5var,:sergio-perez-11: Sergio Pérez,"People making drama because ""no one handled this well"", while Toto and everybody involved were laughing or smiling.",8,1662498470.0
incasru,:pirelli-hard: Pirelli Hard,I mean that’s fair,6,1662486656.0
incu65d,:haas: Haas,not having the audio is really =(,2,1662494055.0
ind335k,:sergio-perez-11: Sergio Pérez,Lol love it.,2,1662497408.0
indbg44,:michael-schumacher: Michael Schumacher,I wish this was slightly clearer so I could use it as WhatsApp stickers,2,1662500681.0
infd8pb,:red-bull: Red Bull,But he is also ‘laughing’,2,1662540040.0
infe7fs,:george-russell: George Russell,That was not so right.,2,1662540869.0
infy7c1,:kevin-magnussen: Kevin Magnussen,"I'm shocked by this middle finger, I think I won't be about to sleep tonight...",2,1662554086.0
inge55g,:formula-1-2018: Formula 1,"No Toto no, no Toto that was so not right.",2,1662561150.0
inc86p3,:chequered-flag: Chequered Flag,"Haha, this is good. Can tell Toto is taking it in stride, definitely been a year of learning for the Mercedes crew, might make them stronger if they can build a fast car next year.",5,1662485657.0
incykl7,:fernando-alonso: Fernando Alonso,Such a legend,2,1662495706.0
inca0yv,:toto-wolff: Toto Wolff,"that’s my team principal! 🖕🏼

EDIT: egregious spelling mistake",5,1662486366.0
inbx8au,:max-verstappen-1: Max Verstappen,😂😂,4,1662481413.0
inbx8sf,:max-verstappen: Max Verstappen,He is just pointing to Max flying right above him in his private jet,-1,1662481419.0
indtnde,:max-verstappen: Max Verstappen,That was so not right.,2,1662508588.0
indz4r8,:red-bull: Red Bull,hmm Maike,2,1662511112.0
ind36a1,:ayrton-senna: Ayrton Senna,Toto’s a fuckin hottie <3,2,1662497440.0
inbzx47,:michael-schumacher: Michael Schumacher,Nice.,3,1662482461.0
indaxre,:alfa-romeo: Alfa Romeo,I wonder if the brithish media will attack him lile they did Kimi (Austria 2019) AND Max(US 2021) when they flipped the bird to Lewis on track,0,1662500471.0
inck8fp,:daniel-ricciardo-3: Daniel Ricciardo,He smiles but we know it hurts,0,1662490267.0
inbxvty,:valtteri-bottas: 🍑 Valtteri ButtAss,What makes me giddy is that this is exactly what Horner talks about. It's very easy to get to Toto.,-53,1662481671.0
inc2p1d,:safety-car-aston-martin: Safety Car,I would have pulled a wad of cash out of my pocket and pointed lol.,1,1662483531.0
ind14ef,:niki-lauda: Niki Lauda,"No!  Toto, No!",1,1662496662.0
inbzf83,:porsche: Porsche,Finally some emotion from him.,-22,1662482272.0
inc0enm,:sebastian-vettel-5: Sebastian Vettel,What a class act,-10,1662482645.0
inc1wly,:max-verstappen: Max Verstappen,Imagine if Horner did this. He'd be getting death threats.,-50,1662483226.0
inc6nns,:formula-1-2018: Formula 1,That is hilarious 😂,1,1662485062.0
inc76hn,:pirelli-wet: Pirelli Wet,Everyone liked it.,1,1662485265.0
inc7p93,:bernd-maylander: Bernd Mayländer,No video? Sad,1,1662485467.0
inc9wvd,:kevin-magnussen-20: Kevin Magnussen,"What are you talking about, he is pointing to the clouds obviously",1,1662486322.0
ince61q,:michael-schumacher: Michael Schumacher,"No guys that’s a German “hello friend, hope you’re doing well” hand signal. 

It’s a classic part of their culture",1,1662487956.0
inci6mv,:alpine: Alpine,meh,1,1662489496.0
incigq7,:kimi-raikkonen: Kimi Räikkönen,He’s poinitng up to the planes,1,1662489603.0
inckk6h,:porsche: Porsche,"""Fuck them all""",1,1662490390.0
inclq4h,:zhou-guanyu-24: Zhou Guanyu,This is not right,1,1662490834.0
incneok,:charles-leclerc: Charles Leclerc,Toe Toe Wolff,1,1662491483.0
incshv6,:williams: Williams,If I was that fan I’d treasure that memory forever,1,1662493427.0
inbxxy2,:pirelli-intermediate: Pirelli Intermediate,"Nah, I think he is pointing at the planes.",421,1662481694.0
indhdsa,:lewis-hamilton:michael-schumacher::niki-lauda: HAM/MSC/LAU,That reference. BTCC goodness,5,1662503142.0
inc55d6,:murray-walker: Murray Walker,<3,7,1662484482.0
incptd0,:alpine: Alpine,"He pulled a Dale, just telling him he is Number 1",1,1662492407.0
incc794,:mika-hakkinen: Mika Häkkinen,"He took it like a champ, made the fan's day and he probably had a lot of fun doing it.",95,1662487196.0
inc0lja,:guenther-steiner: Guenther Steiner,Having the ability to laugh at yourself is so beneficial to your mental health.,339,1662482719.0
inbz5m0,:max-verstappen-33: Max Verstappen,Came here to say this,64,1662482167.0
ind0347,:mercedes: Mercedes,Toto seems like the type of guy who loves a bit of banter. He's a top lad.,1,1662496271.0
inbzjqp,:haas: Haas,Its a common trait amongst F1 staff as the cars are very tight and they need slender fingers to retrieve all the 10mm sockets they drop in the engine.,942,1662482321.0
inc1lvx,:red-bull: Red Bull,"Heh… you know what they say about long fingers 😏


They can shred on the guitar!!!",68,1662483108.0
inc3v6e,:safety-car-mercedes: Safety Car,Toto’s just an all around giant human being.,19,1662483980.0
incsfec,:formula-1-2018: Formula 1,Hide your girl,14,1662493400.0
inc775f,:new-user: New user,Looks like Harry Potter’s wand,7,1662485273.0
inc656e,:pierre-gasly-10: Pierre Gasly,😈👉🍩😳,6,1662484865.0
inc0mzl,:fernando-alonso: Fernando Alonso,"*knocks dude out*

""Micheal did you get the fists I sent you?""",147,1662482734.0
inc18xa,:daniel-ricciardo-3: Daniel Ricciardo,But last time it was too squishy. It has to be like a cookie almost. Krack,82,1662482968.0
inc09yw,:lewis-hamilton-44: Sir Lewis Hamilton,"I don’t know about lucky, I’d like to get snapped by Toto",132,1662482597.0
inc1et3,:daniel-ricciardo: Daniel Ricciardo,Or the shit beat out of him like his headphones.,5,1662483030.0
inbyrat,:we-race-as-one: #WeRaceAsOne,khattt,5,1662482011.0
inc6705,:jim-clark: Jim Clark,it’s dimwits that don’t know what an austrian accent is. classic game of telephone,119,1662484883.0
inc9vzd,:murray-walker: Murray Walker,Toto it's called a dank meme. We went memeing.,32,1662486313.0
inc7b5e,:max-verstappen-1: Max Verstappen,I see literally nobody here making it bigger. Everybody here agrees that this is just in good fun.,39,1662485315.0
inec89g,:carlos-sainz: Carlos Sainz,"Fuck man, after that ridiculous shit, if I had skin in the game, I'd be fuming for months, let alone a little salty.",4,1662516929.0
inc9y4a,:max-verstappen-33: Max Verstappen,"Toto is worth 1.25 **B**illion & self made, gotta respect that",25,1662486335.0
inccbqe,:jack-brabham: Sir Jack Brabham,Toto is part of the tres commas club. The man can laugh his troubles away all day long,9,1662487240.0
inehlut,:carlos-sainz: Carlos Sainz,Principal,3,1662519403.0
incn05z,:pirelli-hard: Pirelli Hard,"Takin it way too seriously, Toto is grinning here so he thought it was funny",10,1662491326.0
inbydcb,:formula-1-2018: Formula 1,"i really dont think its that serious, he's clearly laughing in the pic",130,1662481859.0
inby6to,:ferrari: Ferrari,Tbf at this point whatever he reacts with (even when he ignores) everyone will try to read something. It's good that he can smile,43,1662481789.0
inbz211,:carlos-sainz: Carlos Sainz,Is this a serious comment lol,48,1662482127.0
inc1jou,:oscar-piastri: Oscar Piastri,"He's smiling in this photo lol, not the best example",12,1662483084.0
inbyneo,:mclaren: McLaren,That's a reach,30,1662481968.0
inbzxh1,:lewis-hamilton: Sir Lewis Hamilton,Lmao are you serious? You’ve never seen a middle finger in a joking manner?,20,1662482465.0
inc0fhw,:lewis-hamilton-44: Sir Lewis Hamilton,Stop inventing,21,1662482655.0
inbz0a2,:max-verstappen: Max Verstappen,Yeah he mentioned that in an interview right? Someone asked why he always stirs shit with Toto and horner said he does it because it's easy to get on Toto's nerves.,-4,1662482107.0
inc890y,:lewis-hamilton-44: Sir Lewis Hamilton,Victim mentality,22,1662485681.0
inc2z5p,:lando-norris: Lando Norris,No.,24,1662483637.0
inc6rv8,:pirelli-wet: Pirelli Wet,"It's not in his haracter, I would expect to be flipped by Toto and verbally destroyed by Horner.",3,1662485107.0
inceezy,:max-verstappen: Max Verstappen,Geeezus that was smooth. Like he was planning on saying that the entire time.,255,1662488053.0
incq0ye,:nelson-piquet: Nelson Piquet,Croft sucks.,-3,1662492488.0
incs4ig,:nigel-mansell: Nigel Mansell,"That's second only to ""The car upside-down is a Toyota, with Will Hoy crawling out of it"" in Murray's BTCC commentaries.",1,1662493288.0
inc22ep,:kevin-magnussen-20: Kevin Magnussen,"“I’m going for first, says John Clelland!” will forever be my favorite line in the history of motorsports commentary",149,1662483289.0
inccy7l,:murray-walker: Murray Walker,Arguably the greatest save in the history of broadcasting.,16,1662487479.0
inc8f89,:ferrari: Ferrari,This is the universal sign that you got the banter and love it for what it is,798,1662485748.0
inddxxh,:max-verstappen-1: Max Verstappen,This is fun. F1 banter hasn't been fun for a year now.,18,1662501706.0
incbjcu,:jack-brabham: Sir Jack Brabham,"It blows my mind that so many people take everything they say seriously. Especially Horner, who almost always wears a sarcastic half grin. It’s just tribalism, I guess.",758,1662486941.0
inckbpi,:formula-1-2018: Formula 1,Becoming a meme as a team principal is basically job security. I'm curious if Guenther would still be employed if he wasn't saying stuff like foksmash,161,1662490302.0
incbq7w,:kimi-raikkonen: Kimi Räikkönen,"I remember seeing some posts here about people who had paddock access who said that they saw Toto and Christian after a few races giggling relentlessly together and before they parted ways they gave each other massive hugs.

Theres a few candid pictures that seem to back that up. They exist to be lightning rods for the team to take stress of the drivers but truth be told, there has to be an extreme level of respect and appreciation between the two after all his time.",126,1662487015.0
incc7up,:jack-brabham: Sir Jack Brabham,"Toto and Horner are the 1A and 1B of shit disturbers in the field. 

You can't help but laugh at them when they stir up shit. Every bad comment raises the profile of their teams, the income and their overall net worth. F1 has always been a exercise in somehow making money and the love of going fast; modern F1 is just a lot better at that making money part.",52,1662487202.0
ind7u8o,:haas: Haas,I think Toto and Horner love to compete against in all of the aspects of F1. Including politics. It’s almost like the coordinated rap feuds,2,1662499237.0
inchas8,:alexander-albon: Alexander Albon,They're literally like a double act. Horner and Wolff,3,1662489155.0
incofn0,:lewis-hamilton: Sir Lewis Hamilton,Lovable and Horner used in the same sentence will always be weird to me,1,1662491884.0
incrqro,:porsche: Porsche,"They are both millionaires. I wouldn't give a shit about what people thought of me if I was a millionaire. Hell, I don't even now.",1,1662493147.0
inbzrtv,:mick-schumacher: Mick Schumacher,*in the engine* ❗,247,1662482408.0
inc35zv,:lewis-hamilton: Sir Lewis Hamilton,But all of the Ferrari team have short stubby fingers so they can’t get all of the 10mm sockets so they leave them in the engine hence the unreliability,26,1662483708.0
inbzzre,:pirelli-soft: Pirelli Soft,Stop giving me personal experience anxiety.,9,1662482489.0
inckkph,:niki-lauda: Niki Lauda,I know you’re joking but I’ve recently noticed that everyone at merc seems to have long ass fingers. Have you seen how big Hamilton’s hands are??,2,1662490396.0
inc57gu,:alain-prost: Alain Prost,"Pretty handy on the keyboard, too",19,1662484505.0
ineuqc5,:michael-schumacher: Michael Schumacher,Put the hard tyres away waltuh,2,1662526382.0
inc11sb,:formula-1-2018: Formula 1,Uhm Toto i don’t read my email while being knocked out,45,1662482892.0
inc252s,:mclaren: McLaren,Mike Krack,26,1662483318.0
inc1gjb,:daniel-ricciardo: Daniel Ricciardo,r/suddenlygay,48,1662483048.0
incgki4,:alexander-albon: Alexander Albon,We went shitstirring,2,1662488873.0
incxkh7,:mohammed-ben-sulayem:  :pride-flag: Mohammed Ben Sulayem,This guy F1's,2,1662495336.0
incqoik,:max-verstappen-1: Max Verstappen,"Exactly. The fan shouting it was laughing, Toto was grinning. Everyone can and should enjoy some banter back and forth.",6,1662492738.0
incz8wt,:pirelli-hard: Pirelli Hard,"To me it looks more like forced sarcastic smile. One of those ""yeah, you are really not funny"" moments.",0,1662495955.0
inbygsd,:valtteri-bottas: 🍑 Valtteri ButtAss,Hide the pain Harold vibes,-39,1662481896.0
inbzsqc,:valtteri-bottas: 🍑 Valtteri ButtAss,The man lost one WDC in the past 8 years. He turned a billionaire during the same period and has an amazing family. He can always smile.,3,1662482417.0
inbzhgz,:valtteri-bottas: 🍑 Valtteri ButtAss,Exactly the interview I thought of immediately after seeing this pic.,-4,1662482297.0
inc2sqd,:charles-leclerc: Charles Leclerc,he smashes like 5 headsets per year,16,1662483571.0
inc07lv,:porsche: Porsche,"I meant this year, as every camera shot from the races, he's been looking like someone pissed in his cornflakes.",4,1662482572.0
incjqk9,:murray-walker: Murray Walker,"Sorry to ruin the illusion a bit but IIRC Murray later revealed that his BTCC commentaries were actually recorded a few days after the race. Quite often he was off at a F1 race when the BTCC races were happening, so he'd have to record these during the week and then they'd be broadcast on the following weekend on a highlights show. He would do them in the style of them being live, but he would know what was going to happen so he could script some lines",276,1662490079.0
incax1o,:chequered-flag: Chequered Flag,Salut de internationale!,22,1662486701.0
inc8kef,:love-is-love: Love Is Love,Foreign minishitstirrer.,1,1662485803.0
incg4qp,:haas: Haas,"""I'm going for first, says Toto Wolff!""

We miss you, Murray.",18,1662488706.0
inc3cf1,:carlos-sainz: Carlos Sainz,Insanely quick thinking our Murray!,22,1662483778.0
inccgyy,:daniel-ricciardo-3: Daniel Ricciardo,"Definitely.

Ricciardo at Top Gear taking questions from the audience


""What does the back of Lewis's car look like""

Middle finger. Top banter.

[Edit video link](https://youtu.be/hIPcWmAIqsk). Top notch.",554,1662487294.0
incc9ae,:john-surtees: John Surtees,"Horner is one of my favorite people. My brother hates him. He loves Toto. Honestly, they match our personalities perfectly. Lol.",361,1662487216.0
inccrv5,:daniel-ricciardo-3: Daniel Ricciardo,"> It’s just tribalism, I guess.

I think people genuinely don't understand that he's playing a character and not ""this is who he genuinely is as a person"".

Some people just don't get banter and shit talking. Not to generalise a whole nation (but I will) but Aussies and Brits get it really well, Canadians struggle.",39,1662487411.0
incev53,:andreas-seidl: Andreas Seidl,"My issue with a lot of what Horner says is that he knows he's stirring the pot but he doesn't know when to stop.   


Like, within the paddock and F1 politics it's very funny. Friday he'll call for a rule change and sunday he'll call for the opposite, that's the game.   


However, he also knows that he can get social media going and is willing to stir up the worst parts of their fanbase. All of the ""Lewis tried to kill max"" bullshit was really shitty, at least in my eyes, since he knows that it'll kick off a harassment campaign, and surprise, it did! Then like 5 days later the team releases a half hearted 'no, pls, don't harass lewis with racist slurs' message after the harm is already done.",81,1662488228.0
ing4v23,:formula-1-2018: Formula 1,Some people just can’t recognize British sarcasm even when it slaps them right in the face.,2,1662557211.0
incow0d,:default: Default,F1 has probably tripled in popularity in the last 3 years a lot of the fans have literally never seen Horner in shithouse mode.,1,1662492056.0
ind0cej,:lando-norris-4: Lando Norris,"I'll admit, I think Horner is a bit of a bastard, but I definitely want him to stay on the grid cause he's a perfect villain and he definitely gets a kick out of stirring the pot.  


As my mate once said, F1 is just a soap opera with cars, it's nothing without the story.",1,1662496368.0
ind9rtk,:lewis-hamilton: Sir Lewis Hamilton,">Becoming a meme as a team principal is basically job security.

If this were the case, Binotto & Sfnauzer would have nothing to worry about this year.",91,1662500002.0
ine33tw,:zhou-guanyu: Zhou Guanyu,I bet he would. I still believe he's a good team principal and just got fucked over by rich energy.,8,1662512899.0
incc91l,:ferrari: Ferrari,"The scene in Drive To Survive where they talk about the DAS system kinda shows this too, they're shooting the shit then Horner is just like ""y'know, we *are* gonna file a complaint about it"" and Toto just enthusiastically responds something like ""but isn't it such a cool idea?""",143,1662487214.0
incwamr,:pirelli-wet: Pirelli Wet,That goes for any competitor in a sport really. Fans gotta separate their on and off-track personalities. They might be friends but they also understand that they're both there to win.,3,1662494853.0
ind2nky,:sebastian-vettel-5: Sebastian Vettel,"Two people who see each other most weeks of the year, have a lot in common, and have a lot of face time together. Sure they might get heated during a race or when doing their job with the press but they probably know each other extremely well.

It’s like when a photo of Bono and GP got quite popular. Same deal with them really. It’s easy to relate to people in your position.",2,1662497244.0
inccz6j,:daniel-ricciardo-3: Daniel Ricciardo,"> Every bad comment raises the profile of their teams, the income and their overall net worth.

That's it right there.

So many comments ""why camera always on Horner, why always following Toto""

Cause they LOVE it and give interviews and dance and talk sgit to get more interviews. 

Whereas Seidl just wants to be left alone. Franz Tost.. who?",52,1662487490.0
ind9w4f,:max-verstappen: Max Verstappen,no snitching in the world is going to help Ferrari enough to make a difference.,4,1662500050.0
inc6hce,:charles-leclerc: Charles Leclerc,Is that a good thing or a bad thing🤔,21,1662484994.0
incjh97,:nicholas-latifi: Nicholas Latifi,"> 6'5""

For the non-American/Brit Redditors, Toto is 1.06 George Russell's tall.",12,1662489980.0
incf5dk,:carlos-sainz: Carlos Sainz,"Jeez, it’s a wonder he had a racing career at all being that tall.",5,1662488337.0
inc0u2i,:max-verstappen-1: Max Verstappen,Huh? What was that?,85,1662482809.0
incq6kg,:fernando-alonso: Fernando Alonso,Found the Ferrari engineer,3,1662492548.0
inckons,:formula-1-1993: Formula 1,GP2 ENGINE,2,1662490438.0
ind0vdc,:andreas-seidl: Andreas Seidl,For a minute there I was very confused as to where I was,3,1662496568.0
inccnol,:daniel-ricciardo: Daniel Ricciardo,"It's ok bud, you don't need a long finger, short and fat are just as good. Keep shovelling down them burgers and you too can touch the sides.",1,1662487367.0
inc74xc,:valtteri-bottas: Valtteri Bottas,I bet Toto is cracked at Valorant,12,1662485248.0
ine1onr,:michael-schumacher: Michael Schumacher,Huh? I feel like this joke is the opposite of misogynistic. If anything it objectifies Toto by reducing his worth in the marriage to his physical attributes (his fingers).,3,1662512262.0
inda266,:daniel-ricciardo: Daniel Ricciardo,Ok hero well done yes yes you are a knight among men.,7,1662500117.0
indhc8x,:sebastian-vettel: Sebastian Vettel,Well maybe you should because there is something with the teeth,5,1662503124.0
incpwqz,:lewis-hamilton-44: Sir Lewis Hamilton,He can do it disrespectfully too,27,1662492443.0
inc4y44,:red-bull: Red Bull,Nothing sudden about it with Toto,30,1662484404.0
inc46lf,:lewis-hamilton: Sir Lewis Hamilton,reddit,11,1662484102.0
inc7ms9,:max-verstappen-1: Max Verstappen,No! Because I'm an optimist. Makes my life more fun haha.,10,1662485440.0
incrou7,:pirelli-hard: Pirelli Hard,"Oh yeah I understand that, I just got a diff vibe from ur comment ig I didnt take it as intended",5,1662493126.0
ind533g,:pirelli-hard: Pirelli Hard,Depends how u see it,2,1662498165.0
ind8bss,:max-verstappen: Max Verstappen,"Oh, I see! Well, still a great line!",15,1662499427.0
indk3yl,:nigel-mansell: Nigel Mansell,"Still had some great off the cuff ones though. IF is Formula One spelt backwards, Senna spins in Barca - he's in the gravel, it's lava actually but he's in it, Mansells gonna beat Nelson Piquet by 50 sec... he's stopping! Canada 91. Or my favourite there's nothing wrong with that car EXCEPT IT'S ON FIRE, I had a Volvo catch fire on me on the motorway and was quoting that for weeks.",26,1662504317.0
infiiso,:lewis-hamilton: Sir Lewis Hamilton,"This doesn’t ruin anything for me, Murray knew the outcome and still could commentate with this much energy and enthusiasm?  That’s still magic to me",3,1662544398.0
incpr2i,:alan-jones: Alan Jones,I bet you're real fun at parties.,-11,1662492383.0
ind8lb6,:sergio-perez: Sergio Pérez,*cough*bullshit*cough*,11,1662499532.0
ind8o7b,:sergio-perez: Sergio Pérez,"“Yes, I know the finger Goose”",10,1662499564.0
ind8fxj,:michael-schumacher: Michael Schumacher,Oh geeze I'm sorry I hate it when it does that.,6,1662499472.0
inem7ov,:carlos-sainz-55: Carlos Sainz,"Someone else on this thread said the commentary was recorded post race, ignorance is better sometimes",2,1662521656.0
inccmeg,:sebastian-vettel: Sebastian Vettel,"""Can you see that"" while giving him the finger, was a classic.",215,1662487352.0
incj33l,:charles-leclerc-16: Charles Leclerc,">Ricciardo at Top Gear taking questions from the audience

>""What does the back of Lewis's car look like""

Ricciardo taking questions next year ""What does the back of a F3 car look like?""",90,1662489834.0
inciwma,:mclaren: McLaren,Yeah shame it was scripted audience reaction,34,1662489766.0
incozd7,:toto-wolff: Toto Wolff,I miss him already,1,1662492090.0
incfqbz,:ayrton-senna: Ayrton Senna,"I mean, I can see someone disliking Horner, but not hating him. I can't say the same about Helmut.",113,1662488553.0
indafph,:gerhard-berger: Gerhard Berger,"I don't hate Horner, but he's my least favorite person in the paddock after Jos and Marko. I wasn't big on Ron Dennis either, but he's been gone awhile.",1,1662500268.0
incg8us,:pirelli-intermediate: Pirelli Intermediate,I've generally found that other Euro nationalities take it really personally and then respond with really bitter comments lol. Its really funny to watch haha.,8,1662488750.0
incqkwj,:max-verstappen-1: Max Verstappen,"And Americans too. Most Americans don’t get sarcasm even if it’s so thick you can’t stir anymore. A buddy of mine I work with that’s loves F1 as much as I do, did not get all the drama last year with Toto and Horner. He genuinely thought that they were gonna come to blows in a presser at some point. I had to explain to him that on track they are rivals, but I’m sure off track while they may not spend massive amounts of time together, there’s a mutual respect and competitiveness. They are doing what they believe is best for their drivers and team while expecting no less from the other.",0,1662492700.0
inczzg4,:andreas-seidl: Andreas Seidl,You haven’t seen bants until some Irish lads take the absolute piss. Hilariously savage — it’s in the blood here.,1,1662496231.0
