i9vasnm,formula1,inaugural prediction thread extra hilarious last year many many baffled comment response weird mechanic thing brief faq keep automatically reappearing whenever submit new prediction e every single race reddit constructed feature anything whenever submit prediction count upvote anything either fun contest,1,1653434769.0
i0qhytc,formula1,prediction token austrian gp,2519,1647342764.0
i0qie2i,formula1,bet 200 token per race gonna broke 5th race edit 300 token bankrupt 4th race,695,1647343060.0
i0qj68t,formula1,fuking hell hard going charles pole win hope ferrari beauty turn beast raceday,517,1647343592.0
i0qkt0z,formula1,betting russell 1 win pole position every race 2 win every race 3 never crash race 4 first driver history perfect season 5 go 5 season winning streak 6 maldonado make comeback haas let honest nobody stand chance anymore lewis end 5th last season,321,1647344669.0
i0qiftb,formula1,let go sharrrlllll,145,1647343094.0
i0t3ht6,formula1,getting hand two also forget join r formula1 prediction challenge http redd te1ei0 also see previous sticky http www reddit com r formula1 comment temjc9 2022_rformula1_predictions_tournament i0qw1k8 regarding mechanic prediction tournament know know really considered naming,71,1647382291.0
i0qiksz,formula1,go lad time lose point weekend see,62,1647343188.0
i0qw1k8,formula1,hi inaugural prediction thread extra hilarious last year many many baffled comment response weird mechanic thing reluctantly head 2022 brief faq keep automatically reappearing whenever submit new prediction e every single race reddit constructed feature anything whenever submit prediction count upvote anything either fun contest vote chaos,57,1647350854.0
i0qi1fq,formula1,prediction backkkkkk getting goosebump seeing race week post soooo long chance might see max v leclerc want,167,1647342815.0
i0qis94,formula1,love al winner previous tournament look like dead account,35,1647343329.0
icc83lp,formula1,carlos leclerc,28,1655220577.0
igshrle,formula1,ol charles pole max win never fails,27,1658245615.0
i0qi6fb,formula1,time become poor,24,1647342912.0
i3rm474,formula1,surprised russell main choice pool checo actually got pole better car,24,1649341768.0
i1m0cq0,formula1,stupid fucking shit,22,1647914566.0
ibnlue4,formula1,go safest bet charles pole max win,20,1654722236.0
ihlo6pw,formula1,f1 2022 summarized win race max verstappen start pole charles leclerc,19,1658769491.0
icd2m5n,formula1,tough choose carlos leclerc jorge russel spanish monegasque british legend,16,1655233042.0
ilbxecz,formula1,funny see gonna get pole position charles leclerc gonna win belgian gp max verstappen,14,1661181480.0
i0qjruf,formula1,new season new regulation could go wrong betting,14,1647343997.0
i3ra6bs,formula1,fucking georgie mercedes checo pole,14,1649336465.0
i0qikzs,formula1,hate new reddit,103,1647343191.0
iccnsuz,formula1,carlos leclerc lmao,12,1655226974.0
i0qmc8e,formula1,haas yes charles win max pole know mean boy girl mercedes 1 2,11,1647345627.0
icclgn2,formula1,bet carlos leclerc whoever driver hope engine stay intact,10,1655226017.0
i0qiuiz,formula1,ferrari getting prediction exciting year,10,1647343372.0
i5fv9lu,formula1,max verstappen even option,10,1650427758.0
iccr3fc,formula1,jorge russel,9,1655228305.0
ilbhphd,formula1,seems like ferrari pole max win pretty safe bet,10,1661174962.0
imre8gz,formula1,max win race 0 5 sec 5 15 sec 1 lap,10,1662095744.0
i1kr2kv,formula1,george russell guess perez red bull way better chance win mercs right,9,1647894809.0
i9twg6n,formula1,believe charles leclerc finish race monaco gp,9,1653413085.0
icc6nzx,formula1,dumb didnt think leclerc option pole put 30,9,1655219974.0
ihou7wf,formula1,overdosing hopium hoping ferrari win pole clearly see bet real life anyway hope bottas go bowling time get unpredictable podium maybe haas,10,1658822917.0
i3t7ekp,formula1,love last polesitter option guy got knocked q1,7,1649364282.0
i8zsw3b,formula1,come 111k upvotes,8,1652821344.0
ice6mg2,formula1,almost pattern every gp leclerc win quali verstappen win race,9,1655250992.0
ice74w7,formula1,carlos leclerc,9,1655251241.0
i5ib5kt,formula1,weird found first question easiest answer think red bull finish,7,1650476603.0
i9xj52s,formula1,rip everyone think leclerc get pole weekend,6,1653484291.0
icc87xh,formula1,jorge russell,8,1655220628.0
ildn32z,formula1,57ish think charles pole 66ish think max win feel sad italian,7,1661205785.0
i1k37jb,formula1,greater chance getting pole george russell,5,1647885347.0
i3v86pi,formula1,hell mercs pool checo someone really like perez,6,1649398331.0
i5gdrhs,formula1,fact max even option new one,5,1650440513.0
i71cpm8,formula1,bet like bet actual money yolo max disappointed,7,1651504904.0
i8zns4b,formula1,clue work type thread point afraid ask,6,1652819214.0
ibno8z7,formula1,want believe puro pinche checo pérez,6,1654723289.0
icco3g4,formula1,get pole charles win max sealed deal season,7,1655227094.0
iccxjss,formula1,jorge russel favorite driver,6,1655230947.0
icd1j2x,formula1,carlos leclerc lol,7,1655232595.0
icd5va0,formula1,canadian gp carlos leclerc answer ferrari need,6,1655234388.0
ie997bo,formula1,care coin 75 left keep voting checo,7,1656548476.0
ihlor3h,formula1,put gasly let ride,7,1658769703.0
ihnnhsy,formula1,30 chance rain weekend boy hoping bottas take half field year,6,1658798148.0
ilbyfzf,formula1,rawe ceek bois triple header incoming,6,1661181887.0
imqwv1v,formula1,choice extremely depressing,6,1662086392.0
i0qi520,formula1,lot vote verstappen seem read around mercedes fastest mile sandbagging testing,65,1647342886.0
i5ckj6f,formula1,clicked pretty fast verstappen grouped someone else,17,1650379596.0
i0qjjsf,formula1,wow people really confident max year,6,1647343847.0
i0qmjt1,formula1,well last time top 250 time different however vote hope logic,5,1647345754.0
i0qmpyo,formula1,cant believe many people think haas score point,4,1647345856.0
i1knl0g,formula1,easy kevin pole win,4,1647893425.0
i495efz,formula1,ayo 2nd,6,1649650563.0
i5cv1ld,formula1,show r saying posted 13 hour ago comment one month ago,6,1650383635.0
i8zo79a,formula1,ferrari always,4,1652819390.0
i9ucolv,formula1,lec pole max win leclerc mechanical problem,5,1653419875.0
i9uvp5h,formula1,decided play one strategically bet le popular option mostly basically predicted charles poll dnfing max winning,6,1653427942.0
icc8dek,formula1,putting timbits king latifi score point canada stroll good come edit welp got stroll got yeah,5,1655220692.0
iccg949,formula1,latifi stroll even option canadian gp rigged voting,5,1655223927.0
iccv0hs,formula1,wanna go full spanish newspaper yo put max maximo versttapen,5,1655229899.0
iccx05g,formula1,carlos leclerc,5,1655230723.0
icdawbg,formula1,see charles brother carlos leclerc,4,1655236467.0
ice0vm1,formula1,even vote pedro gaseoso take win specifically,4,1655248157.0
ieyhpad,formula1,start capping max payouts edit e g sainz pole paid 5 1 instead correct ratio nearly 40 1,4,1657037531.0
igsyus4,formula1,voting sainz winning til run outta point baby,5,1658252005.0
igtuofn,formula1,woo let go know absolutely nothing f1 showed feed made guess adding token pool,4,1658263884.0
inhd6gr,formula1,think fuel every week hope dream hoping boy carlos,7,1662574576.0
i5douue,formula1,mod low key throwing shade verstappen,12,1650394898.0
i9uhqcb,formula1,going vote max every week loses happy win gain fake internet point win win,11,1653421989.0
i71eqv1,formula1,hate many fake upvotes poll get,17,1651505744.0
i0qkxr8,formula1,going leclerc pole max win,4,1647344752.0
i0qmsun,formula1,wheres sainz,5,1647345903.0
i0qn3lo,formula1,bet charles leclerc pole win race bet point verstappen always lose prediction anyway,4,1647346087.0
i0qosi1,formula1,last year hesitant vote favourite week ran credit stopped putting credit hamilton started dominating last four race,5,1647347072.0
i0r30c7,formula1,work click say page found,4,1647354046.0
i0su6b3,formula1,last year ended ranked 263 311298 norris pole,5,1647378696.0
i1k8gov,formula1,max give u fantastic lap,4,1647887365.0
i5fhkjj,formula1,yeah leave one two guy win lmao,2,1650421069.0
i8zyiok,formula1,start pole charles win max love community,4,1652823749.0
i900uqm,formula1,anyone else open post tried reddit fun also chrome,5,1652824779.0
i90knjb,formula1,charles bin lauda take pole immediately crash max,4,1652834099.0
i91ekdo,formula1,team worst average finishing position spanish gp proceed list top 3 team,5,1652849522.0
i9tls7v,formula1,got 300 token bottas poll win,4,1653408739.0
i9tyw0i,formula1,bottas quote edit quote,4,1653414091.0
i9u6zyb,formula1,yes charles leclerc charles leclerc believe charles believe,4,1653417472.0
ibn099s,formula1,always bet chaos baku,4,1654712974.0
ibpz129,formula1,vettel win,3,1654775200.0
iccdyt3,formula1,dissapointed máximo verstappen option,4,1655223002.0
iccjgzn,formula1,jorge russel,3,1655225220.0
icd13kr,formula1,love carlos leclerc,5,1655232414.0
icddwxq,formula1,carlos leclerc,5,1655237731.0
icdwsxu,formula1,carlos leclerc,4,1655246157.0
icegjrb,formula1,jorge russell haha,4,1655255912.0
icelktf,formula1,carlos leclerc,4,1655258423.0
ie7teof,formula1,oh god went legreg done,4,1656526978.0
ie83xlu,formula1,max win race lec win qual haas good qual bad race bottas get point week,4,1656531182.0
ie96zg9,formula1,know nothing f1 racing like sport wish luck,4,1656547450.0
iezufxy,formula1,hamilton,3,1657056951.0
ihlri3a,formula1,banking hamilton weekend point may well go fun,5,1658770734.0
ihm9mp3,formula1,wheres hamilton one start prediction,4,1658777665.0
ild38kt,formula1,max verstappen ftw,4,1661197694.0
imqe8uv,formula1,oh boy wait read 5 month old post,2,1662077957.0
inhwza4,formula1,series mishap unfortunate circumstance see another monza midfielder take win although time midfielder albon latifi finish inside point ric finish 16th also dead last several others dnf norris podium alongside russel ferrari amazing pair pit stop first tyre change undercut strategy red bull ruined safety car two lap later ferrari reliability issue binotto leaf circuit ground around lap 40 hear week later news come going bathroom also health concern come cannot continue run team rest season also podium someone drop trophy probably jos,4,1662581915.0
i0qic8f,formula1,sainz disrespect unreal,20,1647343024.0
i0t3b19,formula1,downvoting post last year nothing actual tournament know mod fault like reddit handling whole thing,14,1647382217.0
i5dxo83,formula1,max verstappen someone else poll,14,1650398090.0
i0qmnrr,formula1,hate take new reddit,12,1647345820.0
i5dhwrt,formula1,lol max even answer choice,8,1650392276.0
igsnjss,formula1,fail lewis,9,1658247798.0
i5chntq,formula1,like max option winning,11,1650378470.0
i0qj5zb,formula1,people pretty bullish ver red bull,3,1647343588.0
i0qm8ra,formula1,torn making expected result v hope see saturday sunday,3,1647345567.0
i1k96r0,formula1,im seeing lot split pole win fairly sure everyone going safety car right,3,1647887652.0
i1lopbl,formula1,got max pole leclerc winning,3,1647909272.0
i3qwpzm,formula1,would like petition bottas put back one explicit option bet everything could last season intention stopping,3,1649328921.0
i3rd7q6,formula1,betting perez bring pain checo,3,1649337852.0
i3tamfb,formula1,checo get pole,3,1649365582.0
i3tgbdh,formula1,max max,3,1649367912.0
i4knud1,formula1,prediction open aussie gp,3,1649862359.0
i5d6kjt,formula1,rb car idk man,3,1650388062.0
i90oerl,formula1,carlos last time betting make happen,3,1652835868.0
i9tltns,formula1,fyi high chance rain race weekend could exciting race,3,1653408756.0
i9tv2nj,formula1,perez gonna win one damn eventually,3,1653412519.0
i9u33jk,formula1,start betting addiction,3,1653415832.0
ibmtvjo,formula1,hope lose token going max ferrari get back please,3,1654710293.0
iccazo8,formula1,carlos leclerc,3,1655221782.0
icciaby,formula1,vote jorge russel anyone know,3,1655224746.0
iccjnl4,formula1,carlos leclerrc,3,1655225294.0
iccjodm,formula1,ah yes carlos leclerc,3,1655225302.0
iccrwh4,formula1,one noticing carlos leclerc,3,1655228632.0
icctn39,formula1,carlos leclerc pole ferrari dumfuk maximum win always,3,1655229338.0
iccuec5,formula1,carlos leclerc,3,1655229649.0
icdpoae,formula1,carlos leclerc,3,1655242788.0
ice2fo9,formula1,one else gonna mention jorge,3,1655248935.0
icf2taq,formula1,carlos leclerc,3,1655267761.0
iclqo9d,formula1,say carlos leclerc race winner,3,1655399475.0
ie71ktc,formula1,imma keep betting carlos win,3,1656516113.0
ie89qxd,formula1,let see lewis remembering reminding british driver bos crazy race though see somebody else win idk felt like making crazy prediction bet 10 token probably max honest leclerc continuing trajectory getting 75 pole 9 win time retires,3,1656533445.0
igtg9cv,formula1,clearly mercedes sand bagging hamilton win,3,1658258496.0
igtia86,formula1,excited partake someone pleasse guide,3,1658259266.0
igtkuhy,formula1,france gonna say max start pole suffers mechanical problem either retires drop back charles win battle checo race end lec per sai,3,1658260231.0
igtpf7l,formula1,awesome seeing first time,3,1658261930.0
ihlhyt2,formula1,know nothing prediction car finish,3,1658767132.0
ihloixt,formula1,lot people mindset lol,3,1658769620.0
ihlz7e4,formula1,ferrari box last lap,3,1658773667.0
ihmakrm,formula1,gonna speedrun running law requires always go solely vote checo,3,1658778027.0
ilbkklx,formula1,predict lot car,3,1661176220.0
impz8ua,formula1,wining williams win wild week,3,1662071362.0
imq10dj,formula1,term money money,3,1662072108.0
imqz1t7,formula1,max run train dutch gp see go way unless crash crashed,3,1662087399.0
imu3xwb,formula1,latifi grid safety car guaranteed,3,1662146901.0
inhxeg2,formula1,read ferrell,3,1662582067.0
iniehcz,formula1,monza impossible predict last year one constant usually winner tends someone left field let go checo,3,1662588558.0
i5csz9c,formula1,max showing option,6,1650382845.0
iccfnac,formula1,carlos leclerc,5,1655223681.0
i0qs51s,formula1,damn hate fucking auto upvote,8,1647348886.0
i0ra0y3,formula1,prediction people take part force use new reddit,8,1647356953.0
ihlc7lx,formula1,get token,6,1658764935.0
i0qkm9d,formula1,going sainz 2022,4,1647344546.0
i9tujh1,formula1,fucking hate prediction tournament,5,1653412300.0
iccdztr,formula1,hell carlos leclerc,3,1655223013.0
i0qlg4z,formula1,want give yes ha question always incident,2,1647345073.0
i0qltit,formula1,heart say leclerc brain past trauma say hamilton,2,1647345308.0
i0qn5gb,formula1,carlos missing tv feed carlos missing voting,2,1647346118.0
i0qnpgv,formula1,haas wcc let go,2,1647346450.0
i0r1375,formula1,voted lewis lewis way worst happens least victory silver lining,2,1647353196.0
i0r3ref,formula1,bet no1,2,1647354365.0
i0r5rb6,formula1,board ferrari hype train sharl legreg win pole haas score point,2,1647355207.0
i0rbtlr,formula1,got 92nd however many last year let see dar drop year,2,1647357682.0
i0rl8fl,formula1,oh,2,1647361367.0
i0rzrh1,formula1,people lot le confident mercedes sandbag steak interesting,2,1647366973.0
i0s3x32,formula1,everyone doubting merc goat bold call,2,1647368583.0
i1lkyn4,formula1,question 3 safety car track dangerous fuck,2,1647907600.0
i1m8o3f,formula1,surely safety car right bet 100 token,2,1647918594.0
i1mmqyu,formula1,money max charles got bad history street race,2,1647927173.0
i3qyq5k,formula1,putting house haas,2,1649330229.0
i3rmdqf,formula1,da hec saying haas score alpine,2,1649341886.0
i3sd5ac,formula1,going australian grand prix fun,2,1649352772.0
i5fcerm,formula1,wow even poll assumes max car work weekend,2,1650418834.0
i725flw,formula1,im three hundred imma go broke 4th race lol luck favor bold say,2,1651516415.0
i72dgsv,formula1,voting carlos win till,2,1651519652.0
i73h5w3,formula1,albon anything looking 0,2,1651536746.0
i8zmmpg,formula1,went sergio perez win feel like one weekend,2,1652818737.0
i8zmvib,formula1,bottas win everythimg,2,1652818837.0
i90mnd5,formula1,checo fk,2,1652835037.0
i91hma4,formula1,voting sainz till win,2,1652851639.0
i925ctr,formula1,mercedes worst average position charles leclerc pole carlos sainz win let chili please return token,2,1652871839.0
i93sf23,formula1,never see post rest eternity somebody help,2,1652898758.0
i9tpfjp,formula1,feeling bottas sneak way podium weekend,2,1653410214.0
i9tt0sk,formula1,predicting another tragedy ferrari leclerc want see trend repeat last year leclerc poll go max take win hopefully voting mean come true,2,1653411678.0
i9tzb2e,formula1,13 hour top time jesus,2,1653414263.0
ibms03c,formula1,okay new prediction token pay get wait next year season start,2,1654709512.0
ibmwecg,formula1,know much bet wrath god high atop thing causing max finish,2,1654711344.0
ibn029m,formula1,also bet latifi crash,2,1654712892.0
icc75ag,formula1,canadian driver,2,1655220174.0
icc9i1g,formula1,guy think future hold stroll 6th season yet anything f1 always hoping better car yet always light year away teammate,2,1655221170.0
icd0328,formula1,hell carlos leclerc,2,1655231999.0
icdpd1d,formula1,carlos leclerc,2,1655242646.0
icdpnsp,formula1,carlos leclerc smart bet get payout two driver,2,1655242782.0
icdx76d,formula1,gave canadian driver cant get point guaranteed bet ever trust latifi stroll could intense bet say canadian driver crush,2,1655246349.0
ie82vj8,formula1,prediction thread work,2,1656530763.0
ie8uiac,formula1,given know moment think max take pole new gearbox location leclerc car give extra stability need get win betting george highest brit finisher yet finish outside top 5 race current mercedes yet finish race edit holy go planned,2,1656541876.0
ie9c0cf,formula1,u effulgency make prediction mick win race year,2,1656549779.0
iezzw3z,formula1,idea carlo rooting,2,1657059221.0
igsu19n,formula1,think gonna see messy shenanigan first couple corner leaning one ferrari rb mercedes win think someone going want make statement going lead dnfs least crippling damage ruin pace whether russell hammy verstappen leclerc know,2,1658250211.0
igtf8pt,formula1,idea people let ride main man russell,2,1658258119.0
ihn1d4x,formula1,ferrari fan refuse vote brain heart,2,1658788446.0
ihn76if,formula1,anyone else missing token french gp excited finally get prediction correct except pole see anything,2,1658790914.0
ihnnn75,formula1,ferrari washed,2,1658798214.0
ihnp7he,formula1,started watching f1 drive survive absolutely background watching f1 prediction absolutely zero idea going,2,1658798907.0
iho7dfz,formula1,raining 2 ferraris 1 max 1 bottas 4 immediate car infront 1 stroll 1 latifi fun 10,2,1658807444.0
ilc0jsv,formula1,page found,2,1661182713.0
ilcmap7,formula1,given http www reddit com r formula1 comment wuu8pq its_been_a_while_since_a_driver_took_successive confidently predict leclerc win belgium please ferrari also vettel driver day abu dhabi year heard first p,2,1661191051.0
ild7c53,formula1,going lewis pole win,2,1661199325.0
ild95j7,formula1,aston martin mean seb,2,1661200045.0
ildmjgi,formula1,date one going,2,1661205545.0
ildoz35,formula1,feeling mercedes going quick,2,1661206628.0
ile6yvh,formula1,asking friend next token drop season come,2,1661214820.0
impzkgn,formula1,mazepin swoop last minute take wdc like russia annexing crimea,2,1662071498.0
imqdnk6,formula1,verstappen win never guess get pole position,2,1662077700.0
imqgex8,formula1,know anything formula 1 always vote carlos see name,2,1662078923.0
imqxcpa,formula1,give one good reason pick max pole win right,2,1662086617.0
imr5owl,formula1,really wish could prediction mobile,2,1662090681.0
imrjffs,formula1,4 000th place almost 300 000 player token left,2,1662099365.0
inh0fww,formula1,taking risk week reckon ferrari verstappen crash first corner,2,1662569812.0
inhkuui,formula1,even put hamilton option smh,2,1662577497.0
inhtdso,formula1,helllll naaaaah ferrari ferrari without fuckup somewhere,2,1662580612.0
iniow5l,formula1,simple man see prediction tournament block user,2,1662592944.0
injsq97,formula1,fn click bait,2,1662611901.0
i0qk1cz,formula1,option leclerc sainz better chance,5,1647344167.0
i0qidf2,formula1,still five specific driver option thought last year tournament result proved disastrously bad idea,4,1647343047.0
i90226v,formula1,working king use apollo,5,1652825316.0
i8ztwon,formula1,average lowest finishing position mean one closer 1 2 misleading consider low positons go top bottom 1 2 3 4 5 low mathematical meaning,2,1652821774.0
igtzhrv,formula1,best thing idea thing mean,4,1658265711.0
igunm8f,formula1,people upvoting paid feature reddit take data serve non stop ad need super survey 60 year,3,1658275765.0
ilbj8kl,formula1,know nothing formula1,2,1661175643.0
igtind5,formula1,give shit get rid poll,4,1658259405.0
i9u9f5u,formula1,never downvote thread artificially inflated nonsense,3,1653418493.0
i0qlvzm,formula1,nothing guy hell sub weighted heavily reddit algorhythm,3,1647345350.0
ibmu18s,formula1,let opt stupid prediction game,2,1654710359.0
ieygeo8,formula1,prediction thread get many upvotes every subreddit shouldnt post pinned instead absurd upvote manipulation,2,1657037024.0
i0qkylv,formula1,hey wanna get f1 watch u,2,1647344766.0
i9tvao8,formula1,prediction car go round circle various location across globe win,2,1653412611.0
i9uq8rk,formula1,anyone voted leclerc win monaco,2,1653425582.0
ibn5ljy,formula1,could fuckin azerbagina know michael de santa,2,1654715244.0
iccjb9m,formula1,carlos leclerc,2,1655225155.0
icemx0u,formula1,jorge russell,2,1655259100.0
icero95,formula1,jacques villenueve say year,2,1655261498.0
ihm10z5,formula1,watch fascist grand prix saudi golf,1,1658774367.0
ie74wer,formula1,fuck hamilton pole win silverstone,1,1656517415.0
imq79yd,formula1,stop clogging front page shit,2,1662074816.0
ie7lrxw,formula1,wait pay participate hell,1,1656523968.0
i3rlfsg,formula1,old design version please,1,1649341465.0
i72wd5h,formula1,betting wife kid charles,1,1651527419.0
ibmwzjo,formula1,somebody explain extremely upvoted thanks,1,1654711591.0
ibmy84l,formula1,voting max pole win surely let right,1,1654712119.0
icc9emp,formula1,lewis going win canada,1,1655221130.0
iccdrr1,formula1,charlos leclerc charles,1,1655222923.0
iccijhl,formula1,carlos leclerc,1,1655224846.0
icedu96,formula1,matter fact canadian driver belong grid,1,1655254556.0
igsgsd2,formula1,person fast car faster car win,1,1658245243.0
ihl8rif,formula1,nobody finish even spookier one car finish,1,1658763616.0
ihlbfat,formula1,last 300 coin think would made far,1,1658764633.0
inhtwwz,formula1,earth get 188k vote moment 800 comment formula 1 post definitely using different formula rest,1,1662580804.0
ingyxip,formula1,cmonn r formula1 make filter _,-2,1662569239.0
ibn4wmo,formula1,schumacher starting race 1,0,1654714946.0
igsi8c6,formula1,mercedes mercedes watch formula 1,0,1658245789.0
icci6bm,formula1,learn spell player name,-1,1655224701.0
i0qj0gx,formula1,trade real money,1,1647343485.0
i0qjfxk,formula1,oh shit go,1,1647343775.0
i0qjtcc,formula1,predict ha suffer number strange unfortunate track incident accident season,1,1647344024.0
i0qkdg6,formula1,voting close,1,1647344388.0
i0qks45,formula1,going risky bisky thinking mclaren unintentionally sandbagged due break issue daniel sick going haas point someone else someone else,1,1647344652.0
i0qln45,formula1,haas,1,1647345196.0
i0qnx9c,formula1,keep wheel,1,1647346577.0
i0qqot6,formula1,snow yes,1,1647348115.0
i0quebz,formula1,charles season feel gonna show everyone rapid,1,1647350052.0
i0r09sb,formula1,given drama testing season question merc podium,1,1647352828.0
i0r82o3,formula1,haas score point leclerc pole win easy point,1,1647356159.0
i0raoh7,formula1,gone merc sandbagging picked hamilton winning pole haas scoring point actually planning making effort game year last year couple round blew token time,1,1647357220.0
i0rb10b,formula1,1 yes 2 ver 3 lec,1,1647357361.0
i0rnh5x,formula1,carlos beat lando teammate lando beat danny teammate danny beat max teammate mean carlos better max,1,1647362229.0
i0rwe7d,formula1,haas little chance point best driver 1 podium 120 gp saying max laser focused take pole position overall win mercedes may taken win last year much max year tune drive win,1,1647365669.0
i0sfui6,formula1,predict know formatting prediction work something special also many car race fewer finish leclerc win something happens three lap left race,1,1647373221.0
i0tl765,formula1,lewis pole carlos win,1,1647389860.0
i1i6sxd,formula1,got,1,1647848130.0
i1ju9zr,formula1,prediction stroll become 13th end season,1,1647881857.0
ho93dd7,formula1,toto waiting masi parking lot,1410,1639321005.0
ho920g4,formula1,lewis dad congratulating max jos behind scene big wholesome vibe,364,1639320446.0
ho94opj,formula1,another day another sainz podium overshadowed something else,4975,1639321552.0
ho92ngo,formula1,went car racing toto going fucking murder masi,5577,1639320712.0
ho92kn7,formula1,toto michael great clip archive,2034,1639320680.0
ho9076g,formula1,surprised toto desk still one piece,11521,1639319725.0
ho9072f,formula1,see,4687,1639319724.0
ho92xxx,formula1,mick schumacher biggest galaxy brain move time run latifi road get tire dirty latifi becomes sacrificial lamb lewis win title 8 break dad record,7023,1639320830.0
ho90396,formula1,latifi,6811,1639319690.0
ho903sz,formula1,surely go well hahaha,3434,1639319695.0
ho9034y,formula1,fuck happening,6113,1639319689.0
ho905et,formula1,michael masi literally said fuck hahahaha,7234,1639319710.0
ho904db,formula1,omg wtf ending,2081,1639319700.0
ho903is,formula1,fuck happened,2972,1639319693.0
ho92aqo,formula1,mean prop hamilton think driver would composed interview edit super human composure least opinion,5451,1639320565.0
