iio8wp6,formula1,going seb hath wrought,1315,1659463323.0
iio8vq6,formula1,oh god happening,131,1659463313.0
iio8uv5,formula1,alex palou part 2 electric boogaloo zak brown strike,1455,1659463303.0
iio92ih,formula1,holy shit seb love getting shit going,1250,1659463383.0
iiob53f,formula1,alpine probably thought would cute way surprise oscar announcement lol like proposing girlfriend night planned break,358,1659464160.0
iio91x1,formula1,oh dear chose war even started first race lawyer love mclaren,938,1659463377.0
iio9e19,formula1,swear alonso race sits medieval castle fireplace pondering little trolling man timing impeccable hungary 2007 announcement,1036,1659463501.0
iioddha,formula1,please get lawyer mode part new f1 manager game,106,1659464991.0
iioacn9,formula1,lmao webber alonso engineered looool,490,1659463861.0
iio8sau,formula1,oh god,1677,1659463277.0
iiobk43,formula1,nickel every time young driver name start p team statement put without permission maybe signed mclaren faced legal battle contract dispute two nickel much weird happened twice,334,1659464316.0
iio9fng,formula1,sound pretty much word word like palou hour mclaren announce piastri,63,1659463518.0
iioahsg,formula1,piastri make ballsy statement without contract already signed another f1 team team mclaren imagine ric feel last person find losing job cruelty,401,1659463916.0
iio8twp,formula1,lol way alpine,387,1659463294.0
iioait8,formula1,ferrari fan thank alpine making summer break much enjoyable,64,1659463927.0
iio8thx,formula1,hahahaha yeeeeesssss,179,1659463289.0
iio94zp,formula1,everyone thread telling f1 medium manufacturing drama,451,1659463408.0
iio9adg,formula1,alpine trying beat ferrari omnishambles table honestly extremely embarrassing best bet go similar button 2005 tried force move williams bar bar court battle although much want driver effectively forced race,233,1659463463.0
iio9bmy,formula1,alonso lmaooooo,48,1659463476.0
iio9brx,formula1,holy jesus alpine getting absolutely mugged pair aussie,49,1659463477.0
iio9ydv,formula1,even f1 posted already kkkkk wonder ricciardo alonso lost trust team absolute shitshow,47,1659463713.0
iio8yvq,formula1,way mclaren opening 2 legal front time,554,1659463345.0
iio9eic,formula1,piastri mclaren basically confirmed right way hard deny alpine seat dont another seat go,42,1659463505.0
iio8y7r,formula1,real life,360,1659463338.0
iio91rq,formula1,otmar chip ganassi szafnauer strike,113,1659463375.0
iiobsre,formula1,jenna fryer comment team needing restraining order keep mclaren away driver seem wild,109,1659464405.0
iio8ue7,formula1,f5 season continues,159,1659463299.0
iio8zod,formula1,plot thickens,95,1659463353.0
iio9g2h,formula1,seb started lmao,97,1659463522.0
iiob24t,formula1,two day ago alpine great veteran driver hot prospect waiting behind neither happening,94,1659464129.0
iioa44d,formula1,post winter saying otmar szafnauer great team principal great addition alpine aged pretty poorly,145,1659463773.0
iio961t,formula1,congratulation alpine played,89,1659463419.0
iiobvsi,formula1,fuck going would thought piastri would elated getting nod legitimately decent mid field team confused,91,1659464437.0
iiol8bq,formula1,hello people r confused frontpage long story short last week four time world champion driver sebastian vettel announced retirement sport end season opened seat aston martin racing time rumour two time champion fernando alonso close signing extension current team alpine yesterday aston martin dropped bombshell signed fernando alonso today alpine announced junior driver formula 2 champion oscar piastri would make debut drive 2023 taking alonso vacant seat hour ago oscar piastri announced would,417,1659468012.0
iioa74p,formula1,first silly season living expectation honour sharing,128,1659463804.0
iio969q,formula1,otmar shamble,80,1659463421.0
iioa359,formula1,need daniel ricciardo sort subtweet hinting leaving mclaren 2023 contractual drama chaos,81,1659463763.0
iiof3u8,formula1,think hilarious people swear like drama read comment feel like watching soap opera loving every second personally inject drama straight vein,27,1659465634.0
iiopwcp,formula1,ferrari race strategist v alpine press office team fight last 5 day truly wild ride f1 friday sebastian vettel join social medium surprise everyone announces retirement f1 end season saturday nicholas latifi top fp3 williams george russell qualifies p1 mercedes verstappen red bull languishing p10 ferrari looking strong p2 3 sunday verstappen win p10 grid ten second ahead p2 despite sympathy spin towards end race ferrari continue decide better lose race win one kiss goodbye leclerc wdc hope race strategy using hard tyre even dim witted monkey would realise bad resulting verstappen probably winning championship year regardless ferrari second half season monday fernando alonso take sebastian vettel place aston martin 2023 signing multi year contract team apparently without alpine team principle knowing talk rumoured confirm alonso stay alpine 2023 tuesday alpine announce oscar piastri 2023 ninety minute later piastri release statement denying racing alpine claim statement released without knowledge jesus edit thing missed knew would miss thing,29,1659469775.0
iiotm0t,formula1,like confirm driving alpine 2023,23,1659471186.0
iio8zls,formula1,certified alpine moment,118,1659463352.0
iio97yd,formula1,mean confident seat mclaren 2023,22,1659463438.0
iiobzja,formula1,literally identical palou situation time team holding old co tract announce driver staying next year alpine cgr time driver come denies contract definitively driving time mclaren party fuck going mclaren driver negotiation right team academy currently huge pool promising youngster either contract legal limbo contract norris piastri palou oward herta insane stuff,65,1659464475.0
iio9qrj,formula1,mclaren gonna sign tom brady next rate,19,1659463633.0
iio91xo,formula1,must really confident mclaren get ricciardo contract would interesting month ahead,63,1659463377.0
iio9408,formula1,yeah gonna head bang head team,59,1659463398.0
iio9ai6,formula1,wow disaster palou possible benefit alpine see making announcement going 100x worse world stage certainly good pr,57,1659463464.0
iio8zux,formula1,silliest season,18,1659463355.0
iioafnm,formula1,alpine put hard tire,17,1659463893.0
iioaf9l,formula1,change name lpine rate going,15,1659463889.0
iioiu5u,formula1,alpine losing alonso piastri two day goofiest shit ever,16,1659467083.0
iioa10l,formula1,holy crap like alex palou situation indycar going fun,16,1659463741.0
iioa1p9,formula1,alpine taking biggest l ever seen holy shit,15,1659463748.0
iiom3oe,formula1,dream team alpine press stuff ferrari strategy dutch supporter fan,16,1659468337.0
iio8ufs,formula1,oh shit go,42,1659463299.0
iiodhwv,formula1,driving alpine next year sound really decisive nothing signed yet,14,1659465036.0
iio8z8e,formula1,fuck,40,1659463348.0
iioam8p,formula1,otmar szafnauer shamble imagine alonso laughing as karting spain webber,14,1659463962.0
iiogw2a,formula1,100 alonso webber orchestrated together pretty good mate hilarious,13,1659466320.0
iioonn7,formula1,wherever eventually land big newspaper headline better oscar go,13,1659469309.0
iiod7p1,formula1,silly season quite convey utter level ridiculousness seeing driving alpine great definitely got drive cause would throw away williams mclaren williams feeling would loaner type situation thus amicable organised gotta mclaren zak brown steel chair,12,1659464931.0
iioddda,formula1,mattia binotto like cheer lad heat u bit,13,1659464990.0
iioe1m3,formula1,alonso briatore stroll webber piastri collectively nuked whole alpine team absolute genius,11,1659465238.0
iioj5ev,formula1,least crashgate embarrassing f1 moment renault anymore,13,1659467206.0
iio9hom,formula1,alpine officially biggest clown f1,53,1659463539.0
iipiztc,formula1,basically behind scene ricciardo intends leave alpine party already know piastri intend race alpine alpine already knew going happen talking ricciardo including otmar playing coy legal reason medium ricciardo state intends race mclaren legally say wanted willing race next year mclaren forced buy contract full price arbitration equally alpine state piastri driving force mclaren buy well lose nothing appears fully intend giving race seat walk contract head alpine roll piastri confirms plan stating drive next year forcing alpine let mclaren buy demonstrated intent give drive end way thing always work cannot physically force someone get car perform want right business move get something situation move could force sit year spite terrible look scare away driver signing future,51,1659481067.0
iio8tkf,formula1,peak silly season,11,1659463290.0
iioancu,formula1,triple check parody account also posted ig story strap dude got epic silly season,12,1659463974.0
iiobp6h,formula1,poor ric rough way find job gone,12,1659464369.0
iiog3p3,formula1,burst laughing fantastic stuff miss seb thanks putting nonsense motion,12,1659466014.0
iio907x,formula1,ah shit go,11,1659463359.0
iio998r,formula1,oh le strewth indeed,9,1659463451.0
iio9al6,formula1,seems word word copy alex palou statement,9,1659463465.0
iioafnu,formula1,must mcclaren contract bag publicly denounce alpine like mean definitely fired danny ric,9,1659463893.0
i8oo5vs,formula1,leclerc monaco would expect,10105,1652614623.0
i8oobm6,formula1,poor car one got punted wall last year alesi driving,2272,1652614738.0
i8oo72l,formula1,maybe yearly crash monaco already done f1 weekend smooth sailing,7916,1652614647.0
i8oo5hx,formula1,certified leclerc moment,15311,1652614615.0
i8ooa91,formula1,charles piss random monegasque ghost permanently cursed,4112,1652614711.0
i8oo8me,formula1,get reserve driver race leclerc 2 week,2029,1652614678.0
i8ooig0,formula1,many joke made happened,1310,1652614869.0
i8oo9xr,formula1,oops lol,1272,1652614705.0
i8osx8j,formula1,2017 f2 retired feature sprint race due suspension failure electrical issue 2018 f1 retired due brake failure 2019 f1 retired due tyre puncture touch hulkenberg 2020 f1 monaco host race 2021 f1 crashed qualifying dns 2022 historical gp retired due brake failure definitely cursed never finished single race even feature one,266,1652617745.0
i8oo7o6,formula1,well maybe crash monaco weekend least edit said lost brake unlucky,592,1652614659.0
i8oo5cu,formula1,man genuinely cursed monaco,334,1652614613.0
i8ook3q,formula1,serious question fucking expensive insurance car must imagine run mill billionaire owning one letting someone drive anger around track like monaco slightest mistake punished damage honestly amazed event like happen reason historic vehicle almost always little museum piece,445,1652614901.0
i8p7rmd,formula1,well insurance company say accident happen within 3 mile home,30,1652625521.0
i8ooz8m,formula1,crashgate 2 0 conspiracy theory two hour ago user called u crash666 posted picture tweet http www reddit com r formula1 comment uq2v35 automobileclubmonaco_on_ig_something_special_will tweet title something special happen today driver stay tuned fitting username,240,1652615193.0
i8oo738,formula1,great plan let get way early,184,1652614647.0
i8orezj,formula1,nickel every time leclerc dnfed monaco 6 nickel lot shame happened 6 damn time,70,1652616790.0
i8ou6xp,formula1,sorry allowed drive race car around monaco,207,1652618508.0
i8oock0,formula1,hopefully limited rear wing damage would imagine still ability repair thing ability run track,119,1652614757.0
i8oo9wv,formula1,banned driving monaco,226,1652614704.0
i8oo9zh,formula1,leclerc circuit de monaco love story,83,1652614706.0
i8oogxj,formula1,driver ever worse track record home track like x200b edit surprised get downvoted homie finished gp even fun gp ever professional single seater career right 3 4 year iirc,696,1652614841.0
i8p8xg2,formula1,bro thought moment dank sub nope indeed chuck leclerc,14,1652626049.0
i8ooma4,formula1,oh god charles,39,1652614944.0
i8oobal,formula1,cant wait leclercs f1 crash monaco 2 week,27,1652614732.0
i8otklh,formula1,nothing inchident,9,1652618138.0
i8ou99d,formula1,well came earlier expected chuck know better drive ferrari f1 car monaco,22,1652618546.0
i8oovzu,formula1,http youtube com clip ugkxbpsjft6nxznmeexqs7 0sws8ihv24mjh,20,1652615130.0
i8ooh8d,formula1,tradition,19,1652614847.0
i8op7zs,formula1,stupid,18,1652615360.0
i8opov0,formula1,justr watched crash happened commentator said pressure race weekend enjoy absolutely sending aswell,17,1652615672.0
i8oodco,formula1,official charles fucking cursed monaco definitely good sign year monaco race,38,1652614774.0
i8ooj34,formula1,lec dnf 100 safe bet monaco gp free money guy,14,1652614881.0
i8oord4,formula1,stupid,30,1652615043.0
i8oop7p,formula1,gave wholesome award,23,1652615002.0
i8ouczk,formula1,meme write,3,1652618608.0
i8p3krc,formula1,insurer like crashed,5,1652623531.0
i8q3bh0,formula1,one shocked,5,1652639379.0
i8q9lw1,formula1,hopefully tallied annual monaco crash good go gp,5,1652642180.0
i8oodyt,formula1,oh mu god actually happened,12,1652614786.0
i8ood62,formula1,supposedly brake oof,12,1652614770.0
i8otqzd,formula1,leaf elimated first round game 7 chuck crashing monaco tradition,10,1652618247.0
i8otv8z,formula1,way,5,1652618318.0
i8ou566,formula1,curb enthusiasm theme tune,3,1652618478.0
i8oupuy,formula1,breaking monaco curse early championship winning move,3,1652618817.0
i8oux9u,formula1,chuck must made wish monkey paw something monaco go well together,4,1652618936.0
i8ovfxc,formula1,change identity chuck leclerc,5,1652619237.0
i8p0k24,formula1,known better give charles historic car monaco dude cursed home track,4,1652622031.0
i8p5j29,formula1,tradition,3,1652624472.0
i8p5utc,formula1,necessary needed sacrifice f1 god lift curse,4,1652624627.0
i8p6i31,formula1,getting security deposit back binotto,4,1652624927.0
i8po5b7,formula1,charles monaco leaf first round playoff,4,1652632783.0
i8oolmu,formula1,like love monaco much never missed chance kiss wall,8,1652614931.0
i8oo87c,formula1,hope mean crash f1 race,15,1652614669.0
i8opwl4,formula1,death tax leclerec crashing monaco,7,1652615812.0
i8ou8v2,formula1,stupid,3,1652618540.0
i8p11o4,formula1,amazing tiny seems compared modern car really make smaller,3,1652622284.0
i8p5iym,formula1,monaco leclerc tradition,3,1652624471.0
i8p5sti,formula1,stupid stupid,3,1652624600.0
i8p61sb,formula1,simultaneously real,3,1652624719.0
i8p758d,formula1,stupid,3,1652625230.0
i8pb3ck,formula1,welp time shame existence,3,1652627031.0
i8pbjqp,formula1,stoopid,3,1652627232.0
i8pbn9v,formula1,owner careful leclerc lap record,3,1652627277.0
i8pmxvs,formula1,push 3 le problem solved,3,1652632263.0
i8ptpc2,formula1,stupid charles leclerc,3,1652635194.0
i8q0uf1,formula1,good job chuck,3,1652638287.0
i8qoc02,formula1,sometimes maybe good sometimes maybe shit,3,1652648650.0
i8snqv5,formula1,car meant crashed,3,1652687899.0
i8tzy1k,formula1,somewhere james hunt arm around blonde smile wink walk away holding bottle champagne,3,1652716580.0
i8ook6b,formula1,stupid,9,1652614902.0
i8oodxs,formula1,watch,9,1652614785.0
i8opalj,formula1,charles leclerc extremely talented really smart let drive historic car around monaco knowing curse track,8,1652615409.0
i8oobzm,formula1,sad banana noise,4,1652614746.0
i8oq6lo,formula1,gentleman short view back past thirty year ago niki lauda told u take monkey place cockpit able drive car apparently charles leclerc,14,1652615996.0
i8ooue2,formula1,video driving another historic car seemed really struggle understand cold tire changed gear maybe noped finished lap gear wonder like young driver race 3 pedal car first time ever one monster,8,1652615100.0
i8oog65,formula1,stoopid,7,1652614828.0
i8ooex4,formula1,said lost brake,5,1652614804.0
i8op9ab,formula1,stupid stupid,5,1652615384.0
i8opyv5,formula1,idk mf drive 488 pista around street without crashing every day,6,1652615855.0
i8oolds,formula1,nothing see,5,1652614926.0
i8ooo3x,formula1,shoud stick taxi home,5,1652614980.0
i8ooyai,formula1,jean alesi wreck car last year,5,1652615175.0
i8op4l1,formula1,thing never change seriously though odds leclerc truly cursed monaco,4,1652615295.0
i8ophvt,formula1,expect asked leclerc race around monaco organiser,3,1652615544.0
i8ostx6,formula1,removed plank restored reassembled free rot still car niki,3,1652617687.0
i8otkmx,formula1,way,2,1652618139.0
i8otop4,formula1,charles lecrash,2,1652618208.0
i8otpfz,formula1,smashing said british accent,2,1652618220.0
i8ouemq,formula1,something special,2,1652618635.0
i8oufog,formula1,sure yaya toure agent curse charles leclerc something,2,1652618652.0
i8ouh8i,formula1,man track really hate lol,2,1652618678.0
i8ouhr7,formula1,well shown consistency,2,1652618687.0
i8oul35,formula1,wow much would something like cost,2,1652618741.0
i8oul7v,formula1,sainz double check realised monaco,2,1652618744.0
i8ouzsi,formula1,lol ffs charles,2,1652618976.0
i8ovdkw,formula1,driver whatsapp group must going crazy,2,1652619198.0
i8owfi7,formula1,crashles leclerc,2,1652619797.0
i8owwr0,formula1,fucking way,2,1652620060.0
i8oxhj6,formula1,wer heißt die mutter von niki lauda,2,1652620384.0
i8oyfqn,formula1,rumoured chuck leclerc driving instead charles,2,1652620906.0
i8oyi4q,formula1,joke writes,2,1652620943.0
i8oyrft,formula1,double check make sure meme wow,2,1652621081.0
i8ozhsp,formula1,say line bart stupid,2,1652621473.0
i8ozpuq,formula1,charles know every single barrier hometown continues show u,2,1652621594.0
i8p09uj,formula1,sorry guy,2,1652621883.0
i8p0lkn,formula1,leclerc never allowed race home forever lmao,2,1652622052.0
i8p0p7o,formula1,well awkward,2,1652622104.0
i8p1084,formula1,link anyone wanting video http www youtube com watch v mn 3hxcwg1e,2,1652622262.0
i8p3107,formula1,stupid charles probably,2,1652623269.0
i8p3tuq,formula1,joke right,2,1652623652.0
i8p407h,formula1,ouch lick paint lick paint fixed,2,1652623737.0
i8p467r,formula1,remember baku right monaco,2,1652623820.0
i8p4n56,formula1,look broken,2,1652624050.0
i8p58n6,formula1,fucking way,2,1652624337.0
i8p66wa,formula1,c est la grand prix,2,1652624784.0
i8p7o7a,formula1,press triangle reverse time,2,1652625476.0
i8p7pjq,formula1,told push car,2,1652625494.0
i8p7roq,formula1,shit box,2,1652625522.0
i8p97hd,formula1,rather expensive inchident,2,1652626177.0
i8p9tae,formula1,embarrassing,2,1652626452.0
i8pa3gy,formula1,know anyone ever heard movie watch rush want learn bit niki lauda imho one best racing movie ever made best think better ford v ferrari longshot,2,1652626582.0
i8pa3mz,formula1,damn dude seriously unluckiest mf around monaco,2,1652626584.0
i8pacpw,formula1,truly lauda car replica valuable race completely destroyed would lost forever sometimes crash car salvageable also driving car super risky,2,1652626699.0
i8pbdp9,formula1,alesi crash car last year,2,1652627156.0
i8pbfc5,formula1,buff,2,1652627177.0
i8pbnak,formula1,swear moment cursed think ever finished even one fia sanctioned event monaco,2,1652627278.0
i8pc2bd,formula1,joke real real charles lot pressure going monaco race,2,1652627472.0
i8pcjla,formula1,wonder said probably something stupidity,2,1652627693.0
i8pdblj,formula1,get system,2,1652628047.0
i8pdzo5,formula1,la rascasse,2,1652628352.0
i8peedx,formula1,honestly let drive,2,1652628539.0
i8pfz15,formula1,leclerc monaco better love hate story twilight,2,1652629245.0
i8pgybc,formula1,terrible drive like pig,2,1652629679.0
i8pllro,formula1,make shit lmaoo,2,1652631695.0
i8plqyc,formula1,try open drs,2,1652631757.0
i8pmb45,formula1,foreshadowing,2,1652631995.0
i8pmvan,formula1,profesional,2,1652632232.0
i8poz4n,formula1,gonna lose championship lead home gp isnt,2,1652633140.0
i8pr2gh,formula1,even fault organizer known better,2,1652634049.0
i8pr6n3,formula1,take moment appreciate car still get driven risk crashing,2,1652634099.0
i8prqhs,formula1,leclerc perfecting crash,2,1652634335.0
i8prvdu,formula1,leclerc street circuit mean destined happen often,2,1652634393.0
i8pscq1,formula1,tradition,2,1652634604.0
i8pv7dp,formula1,leclerc defense famous rascasse corner pretty slippery due oil small bit debris covered road previous crash see soon began braking corner back end stepped swung around wall seem like major structural damage done car rear wing crumpled enough end leclerc day monaco http www msn com en u sport sport leclerc crash niki laudas ferrari 312t monaco historic ar aaxihvg,2,1652635839.0
i8pzlhc,formula1,man got yip definitely head,2,1652637750.0
i8q1yrd,formula1,man spent entire life street drive like someone driving opposite side road hopefully way getting annual monaco bad luck way,2,1652638779.0
i8q23lc,formula1,jesus charles try get way around track would ya,2,1652638834.0
i8q4t2k,formula1,bottas teach thing two renowned rally driving skill,2,1652640045.0
i8q62gz,formula1,monaco believe magic truly cursed,2,1652640601.0
i8q85xv,formula1,monaco giveth monaco taketh away,2,1652641533.0
i44uv8c,formula1,entire race one tyre change final lap lmao legend,2106,1649572449.0
i44uskn,formula1,cant believe strategy worked,4355,1649572403.0
i44uwwb,formula1,legit thought williams forgot pit albon,3565,1649572477.0
i44use6,formula1,insane strategy absolute madlads,4884,1649572400.0
i44v2og,formula1,get undercut pit absolute gigabrain williams,394,1649572578.0
i44us9m,formula1,tyre whisperer,2090,1649572398.0
i44ut0b,formula1,scared pit near end,654,1649572411.0
i44uto5,formula1,williams masterplan,185,1649572422.0
i44ut3y,formula1,chad 57 hards,1367,1649572413.0
i44ux1d,formula1,make officialy worst car grid,147,1649572480.0
i44utgm,formula1,9000 iq strategy,820,1649572419.0
i44uv20,formula1,strategy know worked,358,1649572446.0
i44uvc3,formula1,alex goat many predicted smoke latifi season,666,1649572451.0
i44v1i2,formula1,showed last lap broadcast even crossing line picture picture technology exist,85,1649572557.0
i44utff,formula1,love see great race great strategy,209,1649572418.0
i44v0cg,formula1,even care podium today focused albon getting 1 point last lap,186,1649572536.0
i44utgb,formula1,fucking love see good shit,65,1649572418.0
i44uzq5,formula1,albon redemption arc full swing p20 p10,66,1649572525.0
i44ut82,formula1,let go albon fucking mega stint,266,1649572415.0
i44v40j,formula1,happy people sleep made hards last could stop regulation allowed scored point dog shit williams started 20th,153,1649572603.0
i44uwum,formula1,mega alex absolutely mega,51,1649572476.0
i44uz9m,formula1,voted driver day got,49,1649572518.0
i44ycgj,formula1,travesty albon get driver day performance imo,41,1649574854.0
i44uwo2,formula1,true dotd honestly,278,1649572473.0
i44vjm4,formula1,people said pre season latifi better good one alex shut guy action,36,1649572894.0
i44vtzv,formula1,enough pace 57 lap old hard tyre comfortably hold 7th place highly impressive suggests car potential superb skill albon clever tactic team nick latifi really need game though likeable bloke mile behind albon term ability,40,1649573087.0
i44uvzy,formula1,albon could done 100 lap tire still pull green sector,103,1649572461.0
i44uuur,formula1,mega job alex albon,34,1649572442.0
i44ux3k,formula1,driver day,32,1649572481.0
i44uyri,formula1,legend say still drive hard tyre,26,1649572510.0
i44vor2,formula1,albon williams pulled absolute madness albon pace tyre insane fact managed stay lead lap pitting right end masterstroke strategy,25,1649572988.0
i44x5yt,formula1,alex absolutely best thing williams going season far,25,1649574015.0
i44v72v,formula1,williams fucking beauty absolutely insane drive crazy as strategy everything absolutely nailed hard deny charles dotd,22,1649572660.0
i44utho,formula1,crazy strategy lol,106,1649572419.0
i44uw2f,formula1,robbed dotd,105,1649572463.0
i44utfy,formula1,yes come alex,23,1649572418.0
i44vhou,formula1,came pit still p10 shook wanted yell 3am lol,20,1649572859.0
i44uttr,formula1,insane drive today,57,1649572424.0
i44uyq1,formula1,dotd great drive,18,1649572509.0
i44v9lb,formula1,discussing driver day thought leclerc dominance 5 10 lap left think albon deserves great drive strategy last,17,1649572707.0
i44vigb,formula1,unbelievable work team making strategy work albon putting one hell drive showing deserved spot back,16,1649572872.0
i44urqy,formula1,lmao took like 49 race george get first point williams alex get third,1028,1649572390.0
i44vvtd,formula1,driver day insane strategy importantly form kept fantastic pace relatively slow car old hards,15,1649573123.0
i44uwxo,formula1,insane strategy williams congratulation,13,1649572478.0
i44xonh,formula1,albon would like two podium last year hamilton hate right,13,1649574375.0
i44y52e,formula1,fact 5 behind mclaren pitting madness,14,1649574705.0
i450hzn,formula1,going go one best race slowest car basically pit p20 p10,14,1649576472.0
i451oem,formula1,thats wanted back,13,1649577390.0
i44uxbb,formula1,mega drive alex,11,1649572485.0
i44uvkh,formula1,may never see strategy like work ever crazy,39,1649572455.0
i44xye2,formula1,thai r whisperer,34,1649574570.0
i44uuo6,formula1,nit show,13,1649572439.0
i44uuwc,formula1,absolute mad man,12,1649572443.0
i44ux9u,formula1,4d chess albono,11,1649572484.0
i44wbyo,formula1,considering albon one point trailing mclarens 7th faster lap lewis one point yeah albon williams playing 5d chess tyre,11,1649573424.0
i4539nd,formula1,albon really sticking toto wolfe trying keep williams,11,1649578645.0
i44vl9c,formula1,race albono going make latifi look like chump year 57 lap hards absolute madlad,9,1649572925.0
i44y2s4,formula1,albono beloved,10,1649574660.0
i44uwf7,formula1,williams masterclass williams masterclass williams masterclass williams masterclass williams masterclass williams masterclass williams masterclass,32,1649572469.0
