ho9o6ss,formula1,want proof well,5,1639329590.0
ho9od5z,formula1,know reddit post legally binding contract,2,1639329658.0
ho9ogy4,formula1,everyone tagging posted prop sending,2,1639329699.0
ho9oi2t,formula1,even snitch bet already tattoo time shine,2,1639329711.0
ho9pfic,formula1,man looking excuse,2,1639330077.0
ho9pgv6,formula1,content,2,1639330092.0
ho9qkbd,formula1,gonna awesome get inked award wdc hamilton retroactively,2,1639330524.0
ho9qu9z,formula1,never wanted see dickpic badly,2,1639330632.0
ho9rztj,formula1,someone get cyril,2,1639331081.0
ho9vnj8,formula1,could let slide op,2,1639332511.0
ho9w6op,formula1,hahaha u reaper_2 appear court hearing demanding result overturned reason,2,1639332716.0
hoa0scl,formula1,respect bringing,2,1639334496.0
hoa0w80,formula1,need proof asking friend,2,1639334537.0
hoa1g5z,formula1,one going r karmacourt,2,1639334748.0
hoa2y42,formula1,coward,2,1639335313.0
hoa4nel,formula1,fun red bull take op court get logo removed small penis,2,1639335955.0
hoa5b5t,formula1,lucky remind u forgot,2,1639336199.0
hoa65lv,formula1,rush needle yet,2,1639336518.0
hoa6zna,formula1,toto u reaper_2 going appeal fia decision ca,2,1639336832.0
hoa6zu0,formula1,checo legend tattood side least cl depending much canvas work,2,1639336834.0
hoa8pi1,formula1,get number 33 beside call lion,2,1639337486.0
hoaacfa,formula1,happy note least small tattoo,2,1639338125.0
hoaagx0,formula1,gonna hurt brother,2,1639338173.0
hoaoy6m,formula1,hold accountable,2,1639343972.0
hoarp5n,formula1,bet sweating protest lol,2,1639345090.0
hoayyav,formula1,red bull give wing,2,1639348089.0
hob2c8h,formula1,proof ban,2,1639349511.0
hobe4wy,formula1,show u,2,1639354765.0
hobecwy,formula1,add honda logo dude,2,1639354864.0
hobgm6b,formula1,tattoo artist created regerts proud reveal latest work red bell,2,1639355892.0
hoca6gr,formula1,get bull tattooed next hole piss come make yellow circle middle,2,1639369566.0
hodjxay,formula1,max tattoo guy bet sweating bullet 1 lap go,2,1639401979.0
ho9o6l0,formula1,6 year ago fia truly fucking everybody today,5,1639329588.0
ho9oa2u,formula1,one small tatoo,5,1639329626.0
ho9o9jb,formula1,proof ban,2,1639329620.0
hoalcp3,formula1,worry last minute change rule,2,1639342539.0
ho9oah7,formula1,uphold protest love god reaper_2,4,1639329630.0
ho9o8v2,formula1,u reaper_2 hello,0,1639329613.0
hoa16xc,formula1,lmao comment made six year ago great find op must fund user r reaper_2 demand tattoo red bull logo penis,2,1639334650.0
ho9o753,formula1,u reaper_2 oh wait op,-3,1639329594.0
ho9p9v1,formula1,one bull penis another boyfriend make logo touching tip,1,1639330015.0
hoahqt4,formula1,smell want red bull tattoo cock need reason explain people,1,1639341105.0
ho9o8i9,formula1,remindme 1 day haha,1,1639329609.0
ho9o8vx,formula1,question,1,1639329613.0
ho9o92b,formula1,oh fucked,1,1639329615.0
ho9o9e6,formula1,must big ball,1,1639329619.0
ho9o9ff,formula1,take word,1,1639329619.0
ho9oa7h,formula1,look like ca decide fate penis friend,1,1639329627.0
ho9oaer,formula1,proof happen,1,1639329629.0
ho9oaul,formula1,looking excuse,1,1639329634.0
ho9oboh,formula1,better got red bull penis ball penis without ball,1,1639329643.0
ho9obu6,formula1,okay screenshots sure going get stuck task verifying though,1,1639329644.0
ho9oc2m,formula1,legal reason need proof please provide timely manner picture,1,1639329647.0
ho9oc52,formula1,wait couple week make sure,1,1639329647.0
ho9ocge,formula1,wanna right,1,1639329651.0
ho9ocvs,formula1,op writing ca speak,1,1639329655.0
ho9odft,formula1,nice self report,1,1639329661.0
ho9odor,formula1,r e b u l l,1,1639329664.0
ho9offm,formula1,well cyril kept end bargain,1,1639329683.0
ho9oflx,formula1,save thread,1,1639329684.0
ho9ofr0,formula1,well know op supporting appeal,1,1639329686.0
ho9ofye,formula1,masi decided change rule,1,1639329688.0
ho9ogaq,formula1,know must,1,1639329692.0
ho9oglq,formula1,give u original,1,1639329695.0
ho9ogo9,formula1,finger crossed lawyer win,1,1639329696.0
ho9ogym,formula1,wait till appeal done,1,1639329699.0
ho9ohaq,formula1,didnt expect see refreshing mercs complain update,1,1639329703.0
ho9ohgu,formula1,guy praying ca,1,1639329705.0
ho9oi41,formula1,ca rescue,1,1639329712.0
ho9oivo,formula1,speak op praying merc lawyer get,1,1639329720.0
ho9oj4e,formula1,red bull give wing,1,1639329723.0
ho9ojc3,formula1,want picture proof,1,1639329725.0
ho9ojmq,formula1,regardless protest outcome max champion atleast hour unlucky,1,1639329728.0
ho9ok5m,formula1,luckily cell phone camera great zoom ability day,1,1639329734.0
ho9okfh,formula1,op currently praying fia god roll back lap 57,1,1639329738.0
ho9okmq,formula1,simply lovely,1,1639329740.0
ho9oksw,formula1,champion yet,1,1639329742.0
ho9olru,formula1,reddit forget,1,1639329753.0
ho9olyf,formula1,guy personally funded mercedes legal team,1,1639329755.0
ho9om3g,formula1,since dug history guess right,1,1639329756.0
ho9omxb,formula1,learn op physically unable provide enough room,1,1639329765.0
ho9onub,formula1,based previous f1 tattoo bet suspect hear around end next season,1,1639329775.0
ho9oo21,formula1,provisional wait,1,1639329777.0
ho9oobr,formula1,op mercedes lawyer,1,1639329780.0
ho9ope9,formula1,proof 10 second time penalty,1,1639329792.0
ho9opoa,formula1,definitely taking ban one,1,1639329794.0
ho9oprt,formula1,put asterisk end,1,1639329796.0
ho9oq7e,formula1,real reason mercedes protested,1,1639329800.0
ho9oqka,formula1,maybe get temporary one,1,1639329804.0
ho9os6t,formula1,bull get decision anyway space bull,1,1639329821.0
ho9ot5i,formula1,know one person hoping fia overturn result,1,1639329832.0
ho9otko,formula1,time deliver,1,1639329837.0
ho9otky,formula1,op mercedes laywer,1,1639329837.0
ho9otxn,formula1,heard rumor volunteered attorney mercedes,1,1639329841.0
ho9otzk,formula1,totto reddit account wild,1,1639329842.0
ho9ou8r,formula1,didnt age well,1,1639329845.0
ho9ouih,formula1,honestly op blame pull,1,1639329847.0
ho9oxjd,formula1,allowed term european trademark law,1,1639329880.0
ho9oyjq,formula1,someone tattooed max champion race back must nerve till last lap,1,1639329891.0
ho9ozb9,formula1,astrology guy shamble well guess,1,1639329900.0
ho9ozrq,formula1,r karmacourt waiting,1,1639329905.0
ho9p1em,formula1,dude probably plane abu dhabi barge steward room argue mercedes case,1,1639329923.0
ho9p1wv,formula1,know good artist want recommendation gunna dm danny see got cyril,1,1639329928.0
ho9p4c9,formula1,might dickpic accept see homo,1,1639329955.0
ho9p4ry,formula1,u reaper_2,1,1639329960.0
ho9p6o3,formula1,going need high definition picture fully erect penis confirm already tattoo sir,1,1639329981.0
ho9p6rl,formula1,well like red bull going bankrupt lifetime going become obsolete go bankrupt tattoo logo penis,1,1639329983.0
ho9p7or,formula1,well well well look turntable,1,1639329992.0
ho9p8tx,formula1,seems painful,1,1639330004.0
ho9payu,formula1,ah reason contest,1,1639330028.0
ho9pb33,formula1,least wait till appeal heard,1,1639330029.0
ho9pgcx,formula1,tattoo go hard soft,1,1639330087.0
ho9pgxz,formula1,big enough write give wing,1,1639330093.0
ho9pmpj,formula1,legally confirm,1,1639330157.0
ho9pni4,formula1,proof ban,1,1639330166.0
ho9pp09,formula1,u reaper_2 gots,1,1639330183.0
ho9ppbj,formula1,may suggest get logo tattooed testis instead way refer red ball,1,1639330186.0
ho9pt7u,formula1,going need coronavirus sized needle l,1,1639330227.0
ho9py8s,formula1,think need thread remind whole bunch people promise made example lot people thread http www reddit com r formula1 comment lf9i3x 5bmercedes amg_petronas_f1_team 5d_hamilton_confirmed gmkjk6n utm_medium android_app utm_source share context 3,1,1639330281.0
ho9q7n7,formula1,decade realize trans woman man body well thing called formula 1,1,1639330384.0
ho9q8lo,formula1,brought upon,1,1639330394.0
ho9qfdg,formula1,really hope martin guy sky driver see start giving shit,1,1639330469.0
ho9qko7,formula1,max get decide tattoo,1,1639330528.0
ho9ql9n,formula1,worst tattoo,1,1639330535.0
ho9qlqj,formula1,max max super max,1,1639330540.0
ho9qr30,formula1,remember downvoted heavily calling max future wdc first season lmao,1,1639330598.0
ho9qral,formula1,posting soo guess wanted anyways,1,1639330600.0
ho9qtvg,formula1,awkward liar,1,1639330628.0
ho9quv1,formula1,underside mate condolence,1,1639330638.0
ho9rize,formula1,still hope merc fight court might better wait tattoo,1,1639330899.0
ho9rvwh,formula1,redbull logo big even 10 resized,1,1639331039.0
ho9sysf,formula1,awkward painful,1,1639331465.0
ho9t39v,formula1,specify temporary permanent,1,1639331514.0
ho9t5tx,formula1,proof ban,1,1639331542.0
ho9tazm,formula1,wait court case finish like english football fan,1,1639331598.0
ho9tgon,formula1,x200b good luck mate see result,1,1639331660.0
ho9tj2y,formula1,well know going help foot bill lawyer,1,1639331687.0
ho9tky5,formula1,looking forward seeing penis,1,1639331708.0
ho9ton7,formula1,masi changing rule penultimate lap season spite u reaper_2 think need put protest result,1,1639331748.0
ho9tzh6,formula1,u reaper_2 desperately hitting f5 mercs protest,1,1639331865.0
ho9u2e3,formula1,actually tattoo professional tattoo artist wording say one actually,1,1639331895.0
ho9u8t6,formula1,okay want anything happen call lawyer proof ban tattoo time op whip start poking,1,1639331966.0
ho9ugur,formula1,fucking hell hahahahha,1,1639332051.0
ho9umu0,formula1,prop bringing unprompted,1,1639332115.0
ho9v18x,formula1,r suicidebywords,1,1639332271.0
ho9vaxp,formula1,join toto cause,1,1639332374.0
ho9vc40,formula1,pic please,1,1639332387.0
ho9vjw9,formula1,penis going become angel,1,1639332470.0
ho9vz3f,formula1,thit another bet dani,1,1639332634.0
ho9w9d8,formula1,one person hoping merc protest upheld,1,1639332745.0
ho9w9k8,formula1,talking max chilton,1,1639332747.0
ho9whbn,formula1,toto,1,1639332832.0
ho9wi5j,formula1,looking forward fan video,1,1639332841.0
ho9wrco,formula1,bad design tbh,1,1639332940.0
ho9wxir,formula1,let see penis,1,1639333006.0
ho9wyss,formula1,picture happen,1,1639333020.0
ho9x44m,formula1,post wearing see clothing work instagram,1,1639333076.0
ho9x79a,formula1,go ca op,1,1639333110.0
ho9x9th,formula1,red bull rather big logo sure fit,1,1639333138.0
ho9xdvl,formula1,im imagining op love time screaming redbull give wing,1,1639333180.0
ho9xeq1,formula1,u reaper_2 hope ready mate,1,1639333189.0
ho9xt1p,formula1,u reaper_2 really rooting merc protest,1,1639333341.0
ho9y87i,formula1,u reaper_2 fucked,1,1639333500.0
ho9y91b,formula1,op deliver,1,1639333509.0
ho9ycqn,formula1,sure send proof mate,1,1639333548.0
ho9yhnn,formula1,get jenson,1,1639333599.0
ho9yquk,formula1,plot twist u reaper_2 actually female genre,1,1639333697.0
ho9z105,formula1,cyril done nobody else longer running get f1 tattoo yet story reaper_2 hold red bull,1,1639333809.0
ho9zqn3,formula1,want proof,1,1639334087.0
ho9zsyo,formula1,better rethink life choice,1,1639334112.0
ho9zveb,formula1,max face,1,1639334138.0
ho9zwr7,formula1,u reaper_2 o_o,1,1639334153.0
hoa0042,formula1,might want see court case come booking appointment,1,1639334189.0
hoa05uo,formula1,ok stand lol,1,1639334252.0
hoa0cwc,formula1,odd feeling somewhat support mercedes protest,1,1639334329.0
hoa0e51,formula1,know dude writes name grain rice,1,1639334342.0
hoa0im9,formula1,note nothing sporting regs say attached tattooing,1,1639334390.0
hoa0mbf,formula1,joke long team logo penis long enough find,1,1639334431.0
hoa0uwf,formula1,u reaper_2 tattoo decided court,1,1639334523.0
hoa0y23,formula1,post one would known posted guess mean must get,1,1639334558.0
hoa2nj0,formula1,couple wing suffice,1,1639335199.0
hoa2u12,formula1,story max get taken away would worth,1,1639335269.0
hoa2uz5,formula1,hopefully big enough tattoo artist fit,1,1639335280.0
hoa2vq2,formula1,op last lap http imgur com yx6tjpd,1,1639335288.0
hoa36bz,formula1,op find,1,1639335399.0
hoa39cf,formula1,noticed say 6 fricking year ago,1,1639335431.0
hoa3h8a,formula1,lol 3 upvotes want penis tattoo need validated internet stranger,1,1639335515.0
hoa3pf5,formula1,guy tense hour life,1,1639335606.0
hoa3s1y,formula1,know made needle small,1,1639335634.0
hoa3uh3,formula1,poor tattoo artist,1,1639335659.0
hoa3wfs,formula1,like anyone call 6 year later,1,1639335680.0
hoa4hgn,formula1,oh yikes glhf,1,1639335893.0
hoa4o6p,formula1,sure post pic done,1,1639335963.0
hoa4qqf,formula1,kinda awkward know mind f1 season hope forget,1,1639335988.0
hoa4wyu,formula1,proof ban,1,1639336053.0
hoa50v9,formula1,reaper reaper,1,1639336093.0
hoa5dbx,formula1,protest race result well,1,1639336222.0
hoa5g8z,formula1,plot twist u reaper_2 girl,1,1639336252.0
hoa5hmt,formula1,willing start crowdfunding,1,1639336266.0
hoa5hq9,formula1,bet bet,1,1639336267.0
hoa5yp5,formula1,as profit organization,1,1639336446.0
hoa6hke,formula1,sure op gonna resurrect thread unless gonna right,1,1639336645.0
hoa6jqb,formula1,imagine tattooing result overrided,1,1639336667.0
hoa6u7s,formula1,look like masi fia really wanted see looked like nob eh,1,1639336776.0
hoa6utj,formula1,like red bull logo smaller,1,1639336783.0
hoa70lq,formula1,commenting save comment fact made post make think deliver,1,1639336842.0
hoa7bb2,formula1,atleast nobody ever see tattoo,1,1639336952.0
hoa7nig,formula1,im bit confused post 6 year old max started red bull 2016 5 year ago rounded,1,1639337080.0
hoa7x7m,formula1,get front page reddit please,1,1639337182.0
hoa8gb8,formula1,contact red bull sweet sweet sponsorship money,1,1639337387.0
iepaskn,formula1,absolutely insane picture,6435,1656859845.0
ieparoy,formula1,one hell photo,3732,1656859834.0
iepav7b,formula1,thank god catch fire shitload fuel board,2208,1656859878.0
iepavyg,formula1,soo lucky car catch fire scary crash,1694,1656859886.0
iepwabg,formula1,spectator view http twitter com _markgallagher status 1543603756041895939 20 lytzzpnapiapwnu7sxiqxw,167,1656868943.0
iepaufx,formula1,angle make apparent lucky get unscathed,488,1656859868.0
iepas9a,formula1,jezus nobody get hurt,751,1656859841.0
iepayg0,formula1,thank fuck fire even want imagine outcome,415,1656859916.0
iepax85,formula1,look brutal explains took long extract,145,1656859901.0
iephc1z,formula1,see took long get car look like able,47,1656862711.0
iepb5ce,formula1,would freak zhou car caught fire man lucky,42,1656860001.0
iepasjo,formula1,damn shot,115,1656859845.0
iepawsj,formula1,think lesson learned greater distance non guardrail fencing,196,1656859896.0
iepkrzx,formula1,first real lord please let okay moment real,24,1656864160.0
iepavw9,formula1,ben stansall afp http www instagram com bstansall editorial link http www gettyimages com au detail news photo alfa romeo chinese driver zhou guanyu seen crash news photo 1241683828,285,1656859886.0
iepg15c,formula1,wondering removed car dubious use crane potentially injured driver inside,19,1656862150.0
iepat7n,formula1,lifelong claustrophobia begin hope recovers,291,1656859853.0
iepaw1b,formula1,picture testament safety standard practice implemented year,48,1656859888.0
iepfbmm,formula1,human alive,13,1656861845.0
iepazj7,formula1,imagine caught fire full tank fuel,93,1656859929.0
iepb8rf,formula1,feel ill seeing helmet thank god okay,13,1656860043.0
iepasi8,formula1,1 careful owner,46,1656859844.0
iepqe2x,formula1,wonder showing terrifying,10,1656866458.0
iepatib,formula1,worst time claustrophobia kick,23,1656859857.0
iepodc5,formula1,engineer saved life amazing guy design,7,1656865648.0
iepasf2,formula1,look uncomfortable,44,1656859843.0
iepo1cp,formula1,thank god halo,7,1656865516.0
ieppzi9,formula1,halo saved life thankfully fire wowowow,7,1656866293.0
iepjia6,formula1,odd happening close 0 thanks fuck car catch fire thanks fuck halo,26,1656863637.0
iepavau,formula1,happy okay,6,1656859879.0
iepegmp,formula1,god bless advancement technology could much glad zhou safe,5,1656861471.0
iepqz2v,formula1,completely okay absolutely insane safe f1 car,6,1656866698.0
ieqqkgq,formula1,surely safety oversight car caught fire zhou coming,7,1656882258.0
iephdfz,formula1,fire jesus,4,1656862728.0
iepoay8,formula1,fuck look terrible look straight metal support inside corner edge look brutal,5,1656865621.0
iepr14t,formula1,two life saved halo today,5,1656866722.0
ieqm3sz,formula1,structural gap armco barrier catch fence beyond another question replay car suddenly flip reached last 1 4 gravel trap gravel trap created sudden resistance cause car flip completely miss tire wall,5,1656880293.0
iepl63p,formula1,yup guessing wondering got zhou,12,1656864320.0
iepozqr,formula1,name halo nothing guardian angel form engineering thank goodness ok also glad fan injured,13,1656865893.0
iepfe1p,formula1,imagine worst crash career getting stuck car see front photographer snapping pic,27,1656861873.0
iepavqs,formula1,might insane pic lot absolute claustrophobia inducing,4,1656859884.0
iepfz7m,formula1,getty image breaking bad pile money meme today,3,1656862128.0
iepgo9q,formula1,remember everyone complaining halo,3,1656862426.0
ieq1n4a,formula1,look safe tire wall post look really dangerous land,3,1656871256.0
ieqd2zr,formula1,netflix going make 20 min long documentary,5,1656876271.0
iepndr4,formula1,halo saved life today,16,1656865254.0
iepf21t,formula1,zhou glad survived rest know win championship ben stansall image one best sport photograph ever taken breathless,8,1656861728.0
iephu9t,formula1,surprised get people shouting park mate,14,1656862928.0
iepax86,formula1,absolutely insane,3,1656859902.0
ieph84w,formula1,yikes reminds crash picture alonso mclaren 2016 australian gp,3,1656862665.0
iepjcty,formula1,photo glad driver spectator walk away type insane crash,3,1656863574.0
iepmglf,formula1,get,3,1656864864.0
iepoo8p,formula1,hate imagine would happened fire could escaped,3,1656865767.0
iepqx69,formula1,shoutouts halo thing kept head crushed,3,1656866676.0
iepy8a4,formula1,get,3,1656869780.0
iepyrws,formula1,glad car catch fire absolutely wedged really difficult escape time,3,1656870015.0
iepzc9n,formula1,halo definitely saved multiple life point,3,1656870258.0
ieq36zx,formula1,fact flipped cleared entire tyre barrier made actually shout holy shit saw,3,1656871931.0
ieqp05s,formula1,insanely lucky fuel leak fire grosjean situation would done terrifying,3,1656881564.0
ieqwkb5,formula1,car caught fire way would survived,3,1656884961.0
ier802z,formula1,lady gent need halo,3,1656890427.0
iepp3ff,formula1,thankfully fuel bladder job ruptured like grosjean would walking away,6,1656865934.0
iepb056,formula1,holy sh wonder took long extract thank god whatever imaginary space ghost prefer okay,8,1656859937.0
iepblj0,formula1,step marshall stuck,17,1656860197.0
iepav22,formula1,pic decade,6,1656859876.0
iepgxjs,formula1,simply cannot believe lived thankful ever improving safety regulation seeing f2 incident,5,1656862536.0
iepawkr,formula1,making anxious claustrophobic looking,2,1656859894.0
iepawnr,formula1,must terrifying experience,2,1656859895.0
iepax5q,formula1,oh lord look bad wonder show replay,2,1656859901.0
iepax6h,formula1,feeling claustrophobic looking geez terrible,2,1656859901.0
iepazaw,formula1,holy shit wonder took long remove zhou car,2,1656859926.0
iepb6sa,formula1,photographer missed wow,2,1656860019.0
iepb79m,formula1,gotta love far safety come f1 fucking insane,2,1656860025.0
iepb7wx,formula1,thankfully fuel tank secure want think outcome repeat grojeans crash,2,1656860033.0
iepbchq,formula1,photo amazing shame happen,2,1656860089.0
iepbhnq,formula1,need looked car would caught fire dead way get someone like car wedged two obstacle,2,1656860150.0
iepbnvi,formula1,thank fuck car didnt catch fire,2,1656860226.0
iepbny2,formula1,crack front hoop scary,2,1656860227.0
iepbpmv,formula1,scary photo even considering speed crash happened,2,1656860248.0
iepby0q,formula1,glad ok one crazy photo,2,1656860354.0
iepdvqc,formula1,thought man fire coldest photo f1,2,1656861225.0
iepe0y5,formula1,grosjean fire best pic f1 zhou hold beer,2,1656861287.0
iepec7q,formula1,absolutely sickening look glad ok,2,1656861419.0
iepezbz,formula1,many thing gone wrong one shot along car stuck driver get risk fire also scary think car landed place one guardrail upright could gotten head,2,1656861695.0
iepf2tz,formula1,mean kind look go maybe convenient location driver get trapped burn death,2,1656861738.0
iepgdbc,formula1,jesus christ,2,1656862297.0
iepgjq8,formula1,really hope okay man,2,1656862372.0
iepgkq0,formula1,must scary stuck like must feel helpless glad ok,2,1656862385.0
iepigq7,formula1,fuck track design allowed,2,1656863194.0
iepkz9l,formula1,get,2,1656864243.0
iepn35d,formula1,holy fucking hell felt good,2,1656865132.0
iepo3r2,formula1,photo year winner surely,2,1656865541.0
iepodh6,formula1,horrifying glad okay,2,1656865649.0
iepouhx,formula1,hopefully move fence barrier next race see anyways,2,1656865835.0
ieppk0g,formula1,worst crash long time great see walking around end race could gone bad,2,1656866118.0
iepprzp,formula1,thank fia safety feature,2,1656866207.0
ieppvxz,formula1,lived grosjean nissany yesterday hamilton last year herta indy year prof without shadow doubt halo important thing ever happened motorsport five life undoubtedly saved engineering innovation,2,1656866252.0
ieppwpz,formula1,damn horrific,2,1656866262.0
iepq35t,formula1,holy fuck thank god fire,2,1656866334.0
iepq6sg,formula1,holy fuck high speed impact imagine would gone trapped horrific relived see around paddock race,2,1656866375.0
iepqic1,formula1,man glad listen dumbass implementing halo thing keep proving worth,2,1656866507.0
iepr0wa,formula1,car job incredible far driver safety come last 20 year,2,1656866719.0
iepr5gk,formula1,halo giga chad,2,1656866772.0
ieprdse,formula1,poor man catch break season,2,1656866869.0
ieprglo,formula1,halo ftw,2,1656866902.0
ieprkce,formula1,zhou like remote couch cushion,2,1656866945.0
ieprlku,formula1,man caught fire,2,1656866958.0
iepsadr,formula1,copy pasting comment different thread everyone informed look like alfa romeo 3d printing roll hoop since 2018 http www additivemanufacturing medium article additive manufacturing spark f1 car victory made aluminum magnesium scandium alloy scalmalloy device support 12 ton force even though hollow supported complex internal feature structural integrity high strength aluminum alloy developed selective laser melting exceeds tensile fatigue strength aluminum alloy used part sauber alsi10mg much 70 percent weight saving worth gambling driver safety tiny percent thought go immediately indy practice year colton herta gained air flipped landed halo skidded track higher speed http www youtube com watch v uoljnpopcwe indycar roll hoop standardized solid steel bolted safety cell believe fia would even allow al alloy used roll hoop halo made titanium edit looking picture aftermath roll hoop might survived portion safety cell onto hoop attached might failed honestly worse fia ton work starting today fix problem,2,1656867247.0
iepsbmd,formula1,imagine would happened flown bit higher fence stand,2,1656867261.0
iepsoz7,formula1,worst accident seen hope well,2,1656867417.0
iept3gs,formula1,holy shit man picture emerge scarier accident seems,2,1656867588.0
ieptuf9,formula1,front tire totally folded car lifted carried away later seen underneath looked like car transformed futuristic hover car p zero almost became f zero day also surprising hear alex pinball albon suffered zhou,2,1656867899.0
iepu857,formula1,want hear complaint halo accident clear important,2,1656868060.0
iepubjm,formula1,halo job even,2,1656868100.0
iepuf6j,formula1,remind hanging like cow,2,1656868144.0
iepuhaf,formula1,think actually poo pant,2,1656868169.0
iepuq0q,formula1,move fence tyre wall future avoid,2,1656868272.0
iepuy72,formula1,sauber alfa romeo always end big crash first ericsson leclerc gio zhou,2,1656868369.0
iepves0,formula1,watching replay notice first photograph fleeing luckily correct side catch fence job well,2,1656868566.0
iepvic8,formula1,see stuff like im glad halo,2,1656868609.0
iepvlcq,formula1,like end 2 vertical fencing post well jesus amount luck picture good bad also imagine review path right front barrier caused car vault,2,1656868646.0
iepw1mv,formula1,potential thing really fucking bad crazy hopefully lesson learned track,2,1656868838.0
iepwdhm,formula1,even get hurt crash fucking insane,2,1656868982.0
iepwyjh,formula1,wow absolute miracle zhou left scene unscathed incident like prove fia implementation halo right choice,2,1656869234.0
iepxz2o,formula1,look metal bar holding first barrier geez,2,1656869672.0
iepxzsw,formula1,glad ok,2,1656869680.0
iepy7rk,formula1,jesus scary bizarre absolute miracle he walked unscathed,2,1656869774.0
iepzv6a,formula1,halo saving life,2,1656870485.0
ieq0ah6,formula1,holy shit amazing hurt,2,1656870669.0
ieq2mbu,formula1,fact even need medical attention routine checkup god damn miracle thanks everyone continuously making safer sport involved,2,1656871677.0
ieq2sp7,formula1,really want see hell managed get safely,2,1656871756.0
ieq3yie,formula1,rear end tire stack protectosimething look safe,2,1656872266.0
ieq5bu1,formula1,safety issue gap stuck happens car catch fire,2,1656872864.0
ieq7pg2,formula1,freaking fuck,2,1656873905.0
ieqax2m,formula1,parking really pain silverstone everyone fine guess joke allowed,2,1656875318.0
ieqbf1s,formula1,check every video spectator recorded yet exactly get look like could movie stack tyre easily fence behind seems quite close stand right hardly imagine would pull crane still stuck much like move patient much crash rather cut away everything around even zhou able move time really get car,2,1656875540.0
