ho4hzty,formula1,love lewis asked use bottas said never really done lol though tbh bottas nowhere made sense utilise bottas seems like missed call massive verstappen take pole going interesting race especially term strategy,7,1639233487.0
ho4un6c,formula1,see verstappen gone fastest forget goat beaten teammate russell,7,1639239315.0
ho4e4p7,formula1,max first lap q3 absolute insanity,12,1639231529.0
ho4e1qy,formula1,like expected,59,1639231489.0
iafuhgv,formula1,charles got sebastian vettel ferrari experience,7055,1653840169.0
iafukpe,formula1,literally impossible throw front row lockout ferrari hold champagne,4782,1653840207.0
iag0aqj,formula1,checo next home track monaco course special place win charles,1028,1653842728.0
iafudru,formula1,congratulation charles leclerc first monaco grand prix finish,7300,1653840126.0
iafud5g,formula1,ferrari snatching defeat jaw victory tradition jpg,8189,1653840119.0
iafwwo6,formula1,poem ferrari pole pace fuck strategy lose race,598,1653841219.0
iafwijg,formula1,streak broken race seb top 5 finish monaco 2009 2021 max dnf p1 streak abu dhabi 2021 barcelona 2022 leclerc dnf dns streak monaco f2 quali 2017 2021 also tf guy always first one post every single race,1135,1653841047.0
iafw01h,formula1,swear charles one day hold record pole turned win,174,1653840820.0
iafuf5a,formula1,great job perez absolutely disgraceful ferrari,2580,1653840141.0
iafuoif,formula1,ferrari strategy masterclass work fucking hell disaster charles,471,1653840253.0
iafzcqr,formula1,always liked checo worked hard always nice humble god good tire management probably best right,140,1653842303.0
iaful7c,formula1,classic ferrari fucked 1 2 2 4,139,1653840214.0
iafug7g,formula1,rumour take infinite number monkey typewriter one write strategy worse ferrari,2135,1653840155.0
iafzxrv,formula1,man watching perez tear hearing national anthem performed grand band gave goosebump chill tear powerful image performance well done checo respect gutted leclerc tho,583,1653842566.0
iafuf1o,formula1,last half classic monaco well 1st half way also classic monaco,2076,1653840141.0
iafuf9t,formula1,charles lepain,562,1653840144.0
iafufhn,formula1,ferrari made charles lose,466,1653840146.0
iafudqv,formula1,lmaoooo fuck race classic ferrari classic sainz second place close yet far 4am going sleep mvp race gasly carrying early entertainment inters ferrari fucking latifi stroll hitting wall,2672,1653840126.0
iafuigi,formula1,checo dad organising biggest party north america speak,254,1653840181.0
iafug7n,formula1,ferrari throw away 1 2 outstanding drive checo charles finally finished broke monaco jinx terrific race much going,805,1653840155.0
iafugyi,formula1,pouring one charles tonight would want ferrari debrief room shitshow race,344,1653840163.0
iafvry6,formula1,wait summerslam leclerc finally defeat ferrari strategist steel cage match,70,1653840722.0
iafy3gi,formula1,never nervous great job checo moment handed mexican flag post race lap flying actually got teary eyed viva mexico cabrones,282,1653841739.0
iafue4p,formula1,death tax russel finishing top 5,1320,1653840130.0
iafukjw,formula1,checo discussion seems went well,175,1653840206.0
iafwr68,formula1,mexican seeing checo get emotional stage get emotional well vamos checo que orguso buena carrera,515,1653841154.0
iafuhty,formula1,leclerc even podium losing even point max painful race,261,1653840174.0
iafuevp,formula1,doubted could manage tyre,370,1653840139.0
iafw2xn,formula1,alonso disappeared backed everyone elplan,139,1653840855.0
iafuemb,formula1,get checo,463,1653840136.0
iag9787,formula1,never entire life bet formula 1 placed 100 bet perez win shit friend morning going end gambling career,40,1653846774.0
iafwxo6,formula1,watching checo jumping monocoque cheering immediately fell back onto halo hilarious,101,1653841231.0
iafuedm,formula1,ohhh checo legend,466,1653840133.0
iafug6c,formula1,well done checo sure tyre gonna die lockup,86,1653840154.0
iafuetw,formula1,checo made big impression championship,272,1653840139.0
iafuegu,formula1,holy shit drive,71,1653840134.0
iafucvd,formula1,excellent drive checo exciting monaco remember,634,1653840115.0
iafufb1,formula1,least leclerc retire time,68,1653840144.0
iafwtlt,formula1,thing understand like ferrari stratum sucked year know ferrari know possible ferrari like know write linkedin ad fucking strategist pay em team ffs,23,1653841183.0
iafugko,formula1,mexican minister defence,99,1653840159.0
iafvev6,formula1,strategise losing beyond leclerc got killed team hear asking pit miss saw come right behind sainz odd thing going ferrari even got got oh well monaco nice quali racing much,97,1653840564.0
iafueml,formula1,rb outsmarted ferrari ferrari going win title get race strategy right,614,1653840136.0
iafuh1h,formula1,call race half n half,60,1653840164.0
iafvkc4,formula1,greatest ennemy ferrari ferrari fucked 1 2 n c,19,1653840630.0
iafvew4,formula1,finally perez win happy happened last weekend,88,1653840565.0
iagj11h,formula1,fucking finally perez win merit scintillating drive,18,1653851355.0
iafuooa,formula1,russell top 5 legend long keep checo new webber ferrari suck lmao,74,1653840255.0
iafuhlh,formula1,excellent drive top 4 ferrari bad taking home victory spoon fed smh,16,1653840171.0
iafwfv1,formula1,saw watch race 100 sure leclerc crashed,14,1653841014.0
iafya0r,formula1,race similarity baku 2021 1 leclerc pole 2 perez win 3 leclerc p4 4 q3 ending red flag 5 sainz crashing behind driver caused q3 red flag 6 driver podium red bull racing driver program current rbr driver perez vettel gasly baku,15,1653841822.0
iafv5oc,formula1,another day another sainz podium overshadowed literally everything,148,1653840455.0
iafujrm,formula1,u come vamos let goo checo,56,1653840197.0
iafwl59,formula1,fuck yes viva mexico,11,1653841080.0
iafwsj7,formula1,viva méxico gracias checo por toda la alegrías que no da,11,1653841170.0
iafuj2m,formula1,really thought sainz moment would loved see win today honestly entertaining race,49,1653840189.0
iafueet,formula1,checo legend,75,1653840134.0
iaful2m,formula1,congratulation checo incredible drive,10,1653840212.0
iafxuoa,formula1,mean come knew something going go wrong leclerc lol let honest,37,1653841631.0
iafufiv,formula1,deserves kept cool cucumber,22,1653840146.0
iafxbfw,formula1,perez proving good car,22,1653841396.0
iafunoy,formula1,god track terrible racing,59,1653840243.0
iafugaj,formula1,drive formula 2 speed trouble whatsoever maintaining track position need know monaco grand prix,107,1653840156.0
iafuj0h,formula1,fucking hell ferrari,8,1653840188.0
iafyaa8,formula1,fuck latifi stroll still driving f1 car,7,1653841825.0
iag6lte,formula1,checo far favorite driver good team player dealt crummy hand crummy appreciating team,5,1653845585.0
iagj686,formula1,first time mexican monaco hope energy carry patricio ward running second indie 500 potentially could first mexican 500 vamos cabrones,7,1653851421.0
iafumy9,formula1,checo imperious unreal drive ferrari gonna ferrari feel charles man still exciting monaco race seen saying much,18,1653840234.0
iafufs7,formula1,checo beauty,17,1653840149.0
iafwrku,formula1,rb better using team order checo still hunt wdc,17,1653841159.0
iafyinw,formula1,happy checo huele tierra mojada guadalajara guadalajara,16,1653841930.0
iafxhv9,formula1,checo say signed early christian,6,1653841474.0
iafxoaa,formula1,happy checo,6,1653841552.0
iag0kx8,formula1,hueeeeeeevo checo ganador eat doubter,7,1653842855.0
iagjkib,formula1,te quiero mucho checo pérez,6,1653851607.0
iagozzh,formula1,charles drove 2 consecutive perfect weekend yet came 45 point versappen due team engine,7,1653854151.0
iagyk48,formula1,ferrari absolutely amazing strategy consistent screwing team driver making redbull life easy said perez absolutely amazing today make single error put lap time absolutely needed fantastic drive,7,1653858779.0
iafuleg,formula1,decided want die kudos checo though day,14,1653840216.0
iafvzx3,formula1,hard believe red bull really finally found second driver decade fumbling one trainee,14,1653840819.0
iafudmx,formula1,one told mother nature need raining missile raining water start race,31,1653840125.0
iafuotn,formula1,extremely extremely happy checo vamos edit also sad charles,14,1653840257.0
iafuzfk,formula1,holy fuck perez monaco,14,1653840380.0
iafugcg,formula1,grande shit show mamma mia,21,1653840156.0
iafuiu1,formula1,least leclerc finished race,4,1653840186.0
iafukwu,formula1,well driven checo always rapid around baku looking forward next race,5,1653840210.0
iafuxjy,formula1,great see ferrari lost strategy,5,1653840359.0
iafvjme,formula1,fucking happy even,6,1653840621.0
iafvjs0,formula1,gutted charles hyped rb checo 15 point driver lead,5,1653840623.0
iafx7ee,formula1,checooooooo much earned,4,1653841347.0
iafx9v3,formula1,funny enough everyone podium basically current former red bull member,6,1653841377.0
iafxaga,formula1,ferrari snatching defeat jaw victory tradition,5,1653841383.0
iafxnlv,formula1,know everyone disappointed leclerc fast definitely get win eventually really happy checo chance come often enjoying win last,4,1653841543.0
iag9ib7,formula1,vamos checo,6,1653846918.0
iagf152,formula1,pato ward daniel suarez win 500 600 tonight mexico swept greatest day racing,5,1653849489.0
iagpbvs,formula1,grande checo,5,1653854310.0
iafuhj6,formula1,point taken leclerc,3,1653840170.0
iafuhql,formula1,sad see graphic showing leclerc lost 3 place,4,1653840173.0
iafui1x,formula1,gotta one weirdest race recent memory,5,1653840176.0
iafun0o,formula1,suspect one race year neither max lec get top 2,4,1653840235.0
iafv8a6,formula1,sergio number 2 driver perez let go checo,3,1653840485.0
iafvw97,formula1,checo absolute chad,5,1653840774.0
iafwxog,formula1,ferrari know lose monaco gp front row,5,1653841231.0
iafxkqe,formula1,indy,3,1653841509.0
iafxusk,formula1,manage throw away easy one two finish harbor best car grid,4,1653841633.0
iafzw07,formula1,proud viejo sabroso huevo cabrón vamos,5,1653842543.0
iagf43r,formula1,minister minimal tire deg defense service salut,4,1653849527.0
iagffup,formula1,sainz pitted told would refused,3,1653849676.0
iags0ak,formula1,viva mexico cabrones,4,1653855585.0
iah3z26,formula1,latifi belong series man bullshit getting fucking annoying,5,1653861463.0
iafuhiw,formula1,redemption spain ferrari fan hurt bit checo drove marvelously,10,1653840170.0
iafujxb,formula1,flawless race checo rb strategy team win go everybody said rb wouldnt let checo win,21,1653840198.0
iafycbc,formula1,people going understand monaco overtakes strategy driver skill way long time yet people still moan boring stale etc excitement monaco overtaking watching driver mess tight condition unlike track exact reason edge seat throughout second half race find stale year,22,1653841850.0
iafufcj,formula1,finally checo deserves win,28,1653840145.0
iafugbp,formula1,bad number two driver,9,1653840156.0
iafued9,formula1,try fuck strategy cunt checo probably,36,1653840133.0
homx333,formula1,going give george run money king man photoshoot,1515,1639570975.0
hoo2ahv,formula1,sir terry pratchett forged sword meteorite ore feel like sir lewis blade finest carbon fibre light enough wield day without tiring sharp enough slice hardest pirelli rubber,120,1639589411.0
homyb3l,formula1,bono squire gone yes made joke another thread late one resist another go,2683,1639571728.0
hon86yk,formula1,love start rocking armour knight style helmet design,976,1639577038.0
honi3a3,formula1,looking forward sir ver bot lineup,396,1639581468.0
hon5m44,formula1,show race wearing plate armor squire holding standard say sir hamilton,351,1639575765.0
homzhfs,formula1,lewis hamilton knight realm think appropriate course consider action masi fia act war queen lead military offensive french tradition,3283,1639572436.0
hon4dz2,formula1,even begin imagine pride anthony linda carmen must feel putting aside immense accomplishment way conduct far beyond best parent could dream masterclass parenting,286,1639575141.0
homx8qp,formula1,way merc anounce anything today today hamilton,612,1639571071.0
honn2z5,formula1,sometimes get mad good looking,33,1639583458.0
hon2nqn,formula1,still arise sir lewis hamilton,264,1639574230.0
hondqji,formula1,sir lewis hamilton really roll tongue well seems like born,138,1639579588.0
hoobddm,formula1,mean masi committed act high treason britannia immediately destroyed entire royal navy,23,1639592913.0
homxcmi,formula1,well deserved,201,1639571139.0
honebd4,formula1,introduced sir lewis hamilton broadcast,17,1639579842.0
hon45xj,formula1,mean angla officially squire,79,1639575025.0
homxsyi,formula1,damm used lewis formal clothes actually like style enters paddock,169,1639571421.0
hon6gzw,formula1,drip man,65,1639576195.0
homx54a,formula1,deserved half tory donor tax dodger reputed paedophile honour list always seems contain,254,1639571011.0
homxlje,formula1,looking sharp,34,1639571293.0
homysvh,formula1,first person stevenage ever knighted,33,1639572028.0
homx7cx,formula1,official sir lewis hamilton honest race overall suit like look extremely smart real gentleman without doubt,168,1639571048.0
homzkad,formula1,look simple smirk love man,87,1639572482.0
honfbd1,formula1,walk tailor getting knighted want look like fucking total badass tailor thing sir,8,1639580281.0
honqwdw,formula1,title want title deserves,9,1639584950.0
honqvoa,formula1,congratulation sir lewis hamilton,8,1639584942.0
hoo8ads,formula1,get lewis,8,1639591708.0
hon02a2,formula1,lovely well deserved,19,1639572775.0
hon52nz,formula1,well deserved,6,1639575489.0
hoo34lr,formula1,love neck brooch ruby silver look stunning,7,1639589731.0
hoo6mq3,formula1,collar pin amazing looking good,5,1639591068.0
hoodw9y,formula1,claim sir three letter abbreviation since sirotkin three year removed f1,6,1639593889.0
hon22zi,formula1,looking smooth silk,14,1639573911.0
hon5y3s,formula1,one best role model sport,15,1639575933.0
hona4cb,formula1,well deserved one best people representing uk imo,15,1639577954.0
hon4w4g,formula1,well deserved,3,1639575397.0
honepci,formula1,hope needed new sword touched neck muscle lol trying joke hating,4,1639580013.0
hon7rv1,formula1,cool congrats,5,1639576833.0
honco4a,formula1,well deserved,4,1639579110.0
hoo7xx5,formula1,great,4,1639591571.0
hon9mlk,formula1,michael masi overrule uk constitution queen allow max become knighted,20,1639577723.0
hon94zk,formula1,fuck guy handsome,14,1639577495.0
homwxzb,formula1,might thinking,15,1639570886.0
hon5bqu,formula1,lewis stood first line ordained last minute michael masi sent someone hold line max verstappen slipped behind got ordained instead,23,1639575619.0
homybuq,formula1,happy see lewis ceremony today looking like enjoying regardless support opinion final race decision made outcome tough mentally,25,1639571740.0
homwvrd,formula1,thought already knighthood already sir lewis hamilton work,13,1639570849.0
hona6yc,formula1,true role model,3,1639577986.0
honyun6,formula1,still believe royal title 21st century court queen thats protecting pedo son justice,3,1639588085.0
hoo0mqo,formula1,look noble af,3,1639588779.0
hoo22xr,formula1,lewis 2022 helmet going medieval design heard first,3,1639589331.0
hoo35eu,formula1,king george sir lewis,3,1639589740.0
hoo3dt1,formula1,love fit sure collar clasp called elegant touch really neat congrats sir lee hamilton absolute legend,3,1639589829.0
hooakct,formula1,get man knight armor stand stat,3,1639592597.0
hooufy6,formula1,read word sir lewis hamilton automatically voice sir david attenborough,3,1639600236.0
hopgr93,formula1,everybody liked,3,1639609082.0
hophiq6,formula1,pretty awesome knighted still active athlete ever knighted retirement commentator obligated refer sir lewis hamilton race,3,1639609403.0
hophlpo,formula1,max may champion lewis show rising horse next year squire help requires everyone call sir lewis,3,1639609439.0
hoq01qz,formula1,expect silver plat armour suit pair knight sword attached front wing next season,3,1639617675.0
hoqcqrn,formula1,queen know,3,1639623303.0
hordy2r,formula1,well deserved,3,1639645700.0
hon5d9e,formula1,knight defend queen capacity shes trouble archaic law say queen call knight something,8,1639575640.0
hon8tvs,formula1,never big fan honestly attitude hearbreaking lose genuinely feel like good dude might lost race track time pretty sure outside race track even,15,1639577350.0
honsju0,formula1,one title fia take away,7,1639585605.0
homxaka,formula1,congrats lewis well deserved still 8 x world champ eye,95,1639571103.0
honxrle,formula1,congrats lewis fuck royal stand,5,1639587660.0
hon5ins,formula1,thought sir already confusing,2,1639575717.0
hoo78xm,formula1,hamilton becomes another motorsport knight great news,2,1639591303.0
hoo81bk,formula1,knight rider,2,1639591609.0
hoo9ivo,formula1,torch breach go,2,1639592191.0
hooc4n2,formula1,nothing massive congratulation,2,1639593208.0
hooezot,formula1,thought already knighted back,2,1639594308.0
hoogxs3,formula1,thought already knight knight x2,2,1639595060.0
hoojlot,formula1,cant wait crofty throat end time,2,1639596080.0
hoonthe,formula1,awesome congratulation well deserved lewis,2,1639597693.0
hooq9lm,formula1,say want role model,2,1639598627.0
hopbdeg,formula1,gonna change still arise blessed knighted,2,1639606855.0
hopeirm,formula1,bono pls call sir,2,1639608152.0
hophjl4,formula1,wtf swear hamilton knighted last year year,2,1639609413.0
hoq5jeg,formula1,take even longer crofty scream name,2,1639620144.0
hoqcsmb,formula1,special guy,2,1639623326.0
hor3ndp,formula1,man point talk daughter good people one best u,2,1639637804.0
horxvqx,formula1,lol anyone sir point apparently,2,1639660066.0
honjn0p,formula1,handsome deserving sir lewis hamilton arise 3,3,1639582105.0
homxlsm,formula1,curiosity many black poc knighted lewis first edit thank everyone providing example answering question also statistic provided really appreciate knowledge,10,1639571298.0
honayz3,formula1,get official suit armor something like,3,1639578341.0
hoo6zor,formula1,oh fuck medallion steel suit armor lance horse knighthood stuff worth,1,1639591205.0
homxty9,formula1,congrats well deserved,9,1639571439.0
homy0aj,formula1,get knighted already happened difference edit fuck downvoting get news hamilton outside uk supposed know ceremony supposed last year,10,1639571547.0
honb01i,formula1,still rise,4,1639578355.0
honbl7m,formula1,someone deserves,4,1639578621.0
honf7uj,formula1,michael masi yoink,3,1639580238.0
hon0m88,formula1,great honor one 8 driver championship,-3,1639573094.0
hon3g6z,formula1,time red bull protest medal title,-1,1639574652.0
hon3lli,formula1,sir mawis velton,2,1639574731.0
honmwei,formula1,post 5 time please lol,1,1639583388.0
hon2h7t,formula1,least got title year,-2,1639574130.0
hon0w85,formula1,leave right race wondering uk quarantine rule,0,1639573252.0
homz5tx,formula1,wondering purpose knighting someone,3,1639572245.0
hon2vt7,formula1,must second place medallion edit lost lololol,-10,1639574349.0
hl4xvup,formula1,steward decided investigation necessary,13026,1637252886.0
hl5p896,formula1,dude invite embassy go,477,1637263615.0
hl4z27d,formula1,fyi one steward typically appointed host nation,1847,1637253353.0
hl5d1xu,formula1,lewis receives penalty touching human right issue government put parc fermé,650,1637258814.0
hl4zxyn,formula1,would quite end season lewis get arrested disturbing peace dictator shit,5131,1637253700.0
hl4xum6,formula1,strait jail,1361,1637252872.0
hl4yjqv,formula1,thank standing lewis seb lewis fighting well righteous cause one feel put something line gotta love good guy,5503,1637253150.0
hl51qm0,formula1,bold move lot respect lewis one dare speak,2163,1637254399.0
hl4y54e,formula1,people said nerve good small thing thing none le,1149,1637252989.0
hl513fz,formula1,hopefully seb others continue speak across rest weekend prop lewis saying,198,1637254149.0
hl4zwku,formula1,first time heard driver speak ab human right issue middle east lewis get lot respect still remember gp taking place bahrain sa slaughtering civilian,612,1637253685.0
hl5j9gk,formula1,actually madman,70,1637261243.0
hl55z3i,formula1,hat speaking,97,1637256062.0
hl4y4is,formula1,people told mention anything,1499,1637252982.0
hl4xyav,formula1,hamilton trying right wrong world still driving like absolute legend,607,1637252913.0
hl6al7n,formula1,lewis catch 22 fuck hate race day man good humanity lebron seems speak hurt paycheck lewis seems actually give fuck people filthy rich,16,1637272084.0
hl54u3x,formula1,breaking news lewis hamilton arrested qatari law enforcement,245,1637255615.0
hl5dhrt,formula1,jesus amount whataboutism shit take like lewis race weekend insane hell driver grid none people would come say thing insane people pull mental gymnastics go hamilton say,335,1637258985.0
hl5bklo,formula1,holy shit lewis champ indeed,76,1637258232.0
hl55gml,formula1,rooting max hard like hamilton big respect,155,1637255861.0
hl575j6,formula1,alternative headline investigation incident max lewis brazil fia decided disqualify lewis race subsequent race,11,1637256522.0
hl5f14y,formula1,f1 bos stefano domenicali told bbc sport week sport could help promote change racing country qatar saudi arabia also like money,11,1637259586.0
hl5bzjh,formula1,thank speaking legend,34,1637258395.0
hl5dzyo,formula1,prop athlete stature across sport call like lebron ronaldo messi taking note,26,1637259182.0
hl5bdgi,formula1,lewis actually ball stand preaches unlike lot people,27,1637258153.0
hl50tke,formula1,respect,58,1637254042.0
hl5mcaz,formula1,hope smartarses said say anything saudi happy,7,1637262463.0
hl5z00v,formula1,sneaking suspicion folk whose first reaction well bring prepared powerpoint handout detailing human right issue country also let forget china actually care global human right issue instead using way get conclusion ever talking human right violation overlap f1 race location,20,1637267454.0
hl5o9k9,formula1,understand people dislike even hate lewis root race weekend great ambassador motorsports,35,1637263232.0
hl51bp8,formula1,really wanted make statement could race,266,1637254237.0
hl4xy68,formula1,lewis go missing heard first,63,1637252911.0
hl5dxmc,formula1,yeah perfect say hi qatar probably,26,1637259156.0
hl51rxm,formula1,well done lewis definitely team lewis admire speaking thing like,35,1637254413.0
hl5ohh5,formula1,feel f1 liberty medium happy decides retire must shaking every time make statement kind thing afraid pocket feel lighter hope pull shitfuckery get retire sooner,33,1637263319.0
hl54p5w,formula1,true liberty medium looooovvvveeeesss money,7,1637255559.0
hl5i9h9,formula1,genuinely believe going amazing thing vast wealth retires,6,1637260851.0
hl6e49x,formula1,love lewis reigning wdc good example world,6,1637273520.0
hl5c43l,formula1,take would think condemn murderous regime soil big respect lewis,14,1637258443.0
hl4xrvt,formula1,wrong,41,1637252842.0
hl5jykd,formula1,surprised toilet garage work,5,1637261518.0
hl6nj6z,formula1,lewis chadmilton,6,1637277524.0
hl8ilsx,formula1,comment section smh seen comment week f1 need address human right violation upcoming qatar saudi arabia round lewis get hate,6,1637314474.0
hl8p1zw,formula1,never worried lewis prolonging contract negotiation toto dragging reached level actually make difference come awareness regard right insert pretty much anything anyone something care deeply nothing absolutely nothing provide platform like f1 fashion music stay f1 long need f1 megaphone address issue eager see far would go quatar saudi arabia glad seizing opportunity expect similar intervention respect point felt heart anymore much realised needed stay make change,5,1637319765.0
hl8ubfw,formula1,right away go,4,1637323407.0
hld30ph,formula1,great stuff hoping driver would speak awesome lewis,7,1637394464.0
hl5an8g,formula1,mad mad respect saying,4,1637257872.0
hl5b74y,formula1,moment race toto anybody seen lewis,4,1637258085.0
hl5ca0j,formula1,every time issue racing place like qatar saudi arabia someone manages bring hamilton activism put sort blame responsibility speaking people basically every social issue constantly speak though personally responsible addressing world problem glad see speak,4,1637258507.0
hl5d21v,formula1,big fan lewis respect admire always fight right clause speaking happening something donde see everyday,4,1637258816.0
hl5gs5h,formula1,good job lewis hamilton thank,5,1637260267.0
hl5h23f,formula1,comparing human right abuse country gitmo say competition calling human right issue one country mean happening bad one negate,4,1637260376.0
hl5htj0,formula1,good shit lewis,5,1637260678.0
hl5ofgi,formula1,redbull man love lewis hustle desire speak best lewis,3,1637263296.0
hl5q13m,formula1,madlad actually called legend,4,1637263930.0
hl5r8tt,formula1,guy one best ambassador sport ever let take granted,5,1637264409.0
hl6eji9,formula1,sportingly hate lewis passion would great seb force way power structure sport retire might see real change,3,1637273697.0
hl6k5jg,formula1,respect went hamilton,4,1637276056.0
hl7a9oh,formula1,get lewis,4,1637287914.0
hl8zuo5,formula1,gotta give major prop lewis,4,1637326756.0
hl92zix,formula1,except comment considering tight lipped athlete middle east china come human right violation good lewis saying something ball someone like lebron come china,5,1637328442.0
hlaj216,formula1,good job lewis support another show champ,4,1637349701.0
hlb9d5d,formula1,wish driver would use voice highlight issue,4,1637359944.0
hlc1hso,formula1,king,5,1637372192.0
hl58yj9,formula1,get lewis,11,1637257223.0
hl4zlzo,formula1,love guy,20,1637253568.0
hl5ccsn,formula1,track right cirzens,10,1637258538.0
